Categoria;Nome do Serviço;Link;Visitas;URL_Original
Empresa, Indústria e Comércio;Cadastro Do Comercio Industria E Servicos Ccis Inscricao De Contribuinte De Outras Unidades Da Federacao Como Substituto Tributario Nas Operacoes Com Combustiveis Liquidos E Gasosos E Lubrificantes E Respectivas Manutencoes Cadastrais;https://www.ms.gov.br/empresa-industria-e-comercio/cadastro-do-comercio-industria-e-servicos-ccis-inscricao-de-contribuinte-de-outras-unidades-da-federacao-como-substituto-tributario-nas-operacoes-com-combustiveis-liquidos-e-gasosos-e-lubrificantes-e-respectivas-manutencoes-cadastrais186;52;empresa-industria-e-comercio//cadastro-do-comercio-industria-e-servicos-ccis-inscricao-de-contribuinte-de-outras-unidades-da-federacao-como-substituto-tributario-nas-operacoes-com-combustiveis-liquidos-e-gasosos-e-lubrificantes-e-respectivas-manutencoes-cadastrais186
Agropecuária e Vida Rural;Cadastrar Laboratorios E Veterinarios Para Utilizacao Do Aplicativo Resenha Virtual;https://www.ms.gov.br/agropecuaria-e-vida-rural/cadastrar-laboratorios-e-veterinarios-para-utilizacao-do-aplicativo-resenha-virtual168;51;agropecuaria-e-vida-rural//cadastrar-laboratorios-e-veterinarios-para-utilizacao-do-aplicativo-resenha-virtual168
Administração Pública;Divida Ativa Judicializada;https://www.ms.gov.br/administracao-publica/divida-ativa-judicializada37;51;administracao-publica//divida-ativa-judicializada37
Agropecuária e Vida Rural;Cadastro E Utilizacao Do App Transportador;https://www.ms.gov.br/agropecuaria-e-vida-rural/cadastro-e-utilizacao-do-app-transportador158;50;agropecuaria-e-vida-rural//cadastro-e-utilizacao-do-app-transportador158
Agropecuária e Vida Rural;Programa De Avancos Na Pecuaria De Mato Grosso Do Sul Proape Sub Programa Precoce Ms;https://www.ms.gov.br/agropecuaria-e-vida-rural/programa-de-avancos-na-pecuaria-de-mato-grosso-do-sul-proape-sub-programa-precoce-ms89;50;agropecuaria-e-vida-rural//programa-de-avancos-na-pecuaria-de-mato-grosso-do-sul-proape-sub-programa-precoce-ms89
Saúde e Cuidado;Programa Remedio Em Casa Prc;https://www.ms.gov.br/saude-e-cuidado/programa-remedio-em-casa-prc166;50;saude-e-cuidado//programa-remedio-em-casa-prc166
Direitos e Cidadania;Solicitar Atendimento Pelo Centro De Referencia Em Direitos Humanos De Prevencao E Combate A Homofobia Centrho;https://www.ms.gov.br/direitos-e-cidadania/solicitar-atendimento-pelo-centro-de-referencia-em-direitos-humanos-de-prevencao-e-combate-a-homofobia-centrho132;49;direitos-e-cidadania/solicitar-atendimento-pelo-centro-de-referencia-em-direitos-humanos-de-prevencao-e-combate-a-homofobia-centrho132
Direitos e Cidadania;Declaracao Das Remuneracoes De Contribuicoes Previdenciarias Para Fins De Beneficio Junto Ao Inss;https://www.ms.gov.br/direitos-e-cidadania/declaracao-das-remuneracoes-de-contribuicoes-previdenciarias-para-fins-de-beneficio-junto-ao-inss176;49;direitos-e-cidadania//declaracao-das-remuneracoes-de-contribuicoes-previdenciarias-para-fins-de-beneficio-junto-ao-inss176
Administração Pública;Requerer Regularizacao De Debitos Parcelamentos;https://www.ms.gov.br/administracao-publica/requerer-regularizacao-de-debitos-parcelamentos90;48;administracao-publica//requerer-regularizacao-de-debitos-parcelamentos90
Comunicação e Transparência;Pedido De Acesso A Informacao;https://www.ms.gov.br/comunicacao-e-transparencia/pedido-de-acesso-a-informacao165;47;comunicacao-e-transparencia//pedido-de-acesso-a-informacao165
Administração Pública;Autorizacao De Empresas Permissionarias Para Fins De Reparo E Manutencao De Instrumentos De Medicao Regulamentados;https://www.ms.gov.br/administracao-publica/autorizacao-de-empresas-permissionarias-para-fins-de-reparo-e-manutencao-de-instrumentos-de-medicao-regulamentados31;47;administracao-publica/autorizacao-de-empresas-permissionarias-para-fins-de-reparo-e-manutencao-de-instrumentos-de-medicao-regulamentados31
Trânsito e Transportes;Solicitacao De Alienacao Ou Desalienacao Do Veiculo Em Nome Do Mesmo Proprietario;https://www.ms.gov.br/transito-e-transportes/solicitacao-de-alienacao-ou-desalienacao-do-veiculo-em-nome-do-mesmo-proprietario62;46;transito-e-transportes//solicitacao-de-alienacao-ou-desalienacao-do-veiculo-em-nome-do-mesmo-proprietario62
Arte e Cultura;Orientacoes Para Solicitacao De Certidao Negativa De Tombamento;https://www.ms.gov.br/arte-e-cultura/orientacoes-para-solicitacao-de-certidao-negativa-de-tombamento142;46;arte-e-cultura/orientacoes-para-solicitacao-de-certidao-negativa-de-tombamento142
Administração Pública;Cadastro De Fornecedores;https://www.ms.gov.br/administracao-publica/cadastro-de-fornecedores36;45;administracao-publica//cadastro-de-fornecedores36
Saúde e Cuidado;Fornecimento De Medicamentos Da Assistencia Farmaceutica Estadual Componente Basico;https://www.ms.gov.br/saude-e-cuidado/fornecimento-de-medicamentos-da-assistencia-farmaceutica-estadual-componente-basico147;45;saude-e-cuidado//fornecimento-de-medicamentos-da-assistencia-farmaceutica-estadual-componente-basico147
Empresa, Indústria e Comércio;Consulta Solicitacoes Processo Livro Ou Servico;https://www.ms.gov.br/empresa-industria-e-comercio/consulta-solicitacoes-processo-livro-ou-servico106;45;empresa-industria-e-comercio//consulta-solicitacoes-processo-livro-ou-servico106
Segurança;Registro De Boletins De Ocorrencia Depac;https://www.ms.gov.br/seguranca/registro-de-boletins-de-ocorrencia-depac126;45;seguranca//registro-de-boletins-de-ocorrencia-depac126
Meio Ambiente;Certidao Negativa;https://www.ms.gov.br/meio-ambiente/certidao-negativa166;44;meio-ambiente//certidao-negativa166
Educação e Pesquisa;Apoiar A Educacao Basica Das Escolas Publicas De Mato Grosso Do Sul;https://www.ms.gov.br/educacao-e-pesquisa/apoiar-a-educacao-basica-das-escolas-publicas-de-mato-grosso-do-sul168;44;educacao-e-pesquisa/apoiar-a-educacao-basica-das-escolas-publicas-de-mato-grosso-do-sul168
Agropecuária e Vida Rural;Emitir Guia De Transito Animal Gta;https://www.ms.gov.br/agropecuaria-e-vida-rural/emitir-guia-de-transito-animal-gta96;44;agropecuaria-e-vida-rural/emitir-guia-de-transito-animal-gta96
Comunicação e Transparência;Registrar Denuncia;https://www.ms.gov.br/comunicacao-e-transparencia/registrar-denuncia58;42;comunicacao-e-transparencia/registrar-denuncia58//index
Agropecuária e Vida Rural;Cadastrar Medico Veterinario Para Realizar Vacinacao Contra Brucelose;https://www.ms.gov.br/agropecuaria-e-vida-rural/cadastrar-medico-veterinario-para-realizar-vacinacao-contra-brucelose4;42;agropecuaria-e-vida-rural//cadastrar-medico-veterinario-para-realizar-vacinacao-contra-brucelose4
Saúde e Cuidado;Solicitar Teleconsulta;https://www.ms.gov.br/saude-e-cuidado/solicitar-teleconsulta177;40;saude-e-cuidado//solicitar-teleconsulta177
Trabalho, Emprego e Previdência;Agendar Atendimento Presencial;https://www.ms.gov.br/trabalho-emprego-e-previdencia/agendar-atendimento-presencial153;39;trabalho-emprego-e-previdencia//agendar-atendimento-presencial153
Assistência Social;Solicitacao De Cursos Na Escola Do Suas Ms;https://www.ms.gov.br/assistencia-social/solicitacao-de-cursos-na-escola-do-suas-ms60;39;assistencia-social//solicitacao-de-cursos-na-escola-do-suas-ms60
Saúde e Cuidado;Servico De Imagem E Diagnostico;https://www.ms.gov.br/saude-e-cuidado/servico-de-imagem-e-diagnostico28;38;saude-e-cuidado//servico-de-imagem-e-diagnostico28
Empresa, Indústria e Comércio;Cadastro Do Comercio Industria E Servicos Ccis Inscricao De Contribuinte De Outras Unidades Da Federacao Como Substituto Tributario Nas Operacoes Com Combustiveis Liquidos E Gasosos E Lubrificantes E;https://www.ms.gov.br/empresa-industria-e-comercio/cadastro-do-comercio-industria-e-servicos-ccis-inscricao-de-contribuinte-de-outras-unidades-da-federacao-como-substituto-tributario-nas-operacoes-com-combustiveis-liquidos-e-gasosos-e-lubrificantes-e;38;empresa-industria-e-comercio/cadastro-do-comercio-industria-e-servicos-ccis-inscricao-de-contribuinte-de-outras-unidades-da-federacao-como-substituto-tributario-nas-operacoes-com-combustiveis-liquidos-e-gasosos-e-lubrificantes-e//index
Assistência Social;Orientacao Para Retificacao Do Nome No Registro Civil;https://www.ms.gov.br/assistencia-social/orientacao-para-retificacao-do-nome-no-registro-civil39;37;assistencia-social//orientacao-para-retificacao-do-nome-no-registro-civil39
Empresa, Indústria e Comércio;Fundo Constitucional Do Centro Oeste Fco;https://www.ms.gov.br/empresa-industria-e-comercio/fundo-constitucional-do-centro-oeste-fco63;37;empresa-industria-e-comercio/fundo-constitucional-do-centro-oeste-fco63
Ciência e Tecnologia;Redefinir Senha Legislacao;https://www.ms.gov.br/ciencia-e-tecnologia/redefinir-senha-legislacao198;37;ciencia-e-tecnologia//redefinir-senha-legislacao198
Educação e Pesquisa;2A Via De Certificado De Conclusao De Curso;https://www.ms.gov.br/educacao-e-pesquisa/2a-via-de-certificado-de-conclusao-de-curso97;36;educacao-e-pesquisa//2a-via-de-certificado-de-conclusao-de-curso97
Administração Pública;Solicitar Peticionamento Processual;https://www.ms.gov.br/administracao-publica/solicitar-peticionamento-processual48;36;administracao-publica//solicitar-peticionamento-processual48
Trânsito e Transportes;Licenca De Fretamento Continuo Lfc;https://www.ms.gov.br/transito-e-transportes/licenca-de-fretamento-continuo-lfc87;36;transito-e-transportes//licenca-de-fretamento-continuo-lfc87
Empresa, Indústria e Comércio;Solicitar Licitacao;https://www.ms.gov.br/empresa-industria-e-comercio/solicitar-licitacao64;36;empresa-industria-e-comercio//solicitar-licitacao64
Educação e Pesquisa;Consulta De Livros E Catalogos De Artes Visuais Da Biblioteca Do Marco;https://www.ms.gov.br/educacao-e-pesquisa/consulta-de-livros-e-catalogos-de-artes-visuais-da-biblioteca-do-marco76;36;educacao-e-pesquisa/consulta-de-livros-e-catalogos-de-artes-visuais-da-biblioteca-do-marco76
Agropecuária e Vida Rural;Cancelar Ficha Sanitaria;https://www.ms.gov.br/agropecuaria-e-vida-rural/cancelar-ficha-sanitaria98;36;agropecuaria-e-vida-rural//cancelar-ficha-sanitaria98
Agropecuária e Vida Rural;Autorizacao De Aquisicaoimportacao E Plantio De Mudas Citricas Para Produtores Rurais;https://www.ms.gov.br/agropecuaria-e-vida-rural/autorizacao-de-aquisicaoimportacao-e-plantio-de-mudas-citricas-para-produtores-rurais138;36;agropecuaria-e-vida-rural//autorizacao-de-aquisicaoimportacao-e-plantio-de-mudas-citricas-para-produtores-rurais138
Saúde e Cuidado;Oferta De Teleconsultoria;https://www.ms.gov.br/saude-e-cuidado/oferta-de-teleconsultoria61;36;saude-e-cuidado//oferta-de-teleconsultoria61
Empresa, Indústria e Comércio;Solicitar Emissao De 2A Via De Conta De Agua E Esgoto;https://www.ms.gov.br/empresa-industria-e-comercio/solicitar-emissao-de-2a-via-de-conta-de-agua-e-esgoto113;35;empresa-industria-e-comercio//solicitar-emissao-de-2a-via-de-conta-de-agua-e-esgoto113
Administração Pública;Servico De Protocolos;https://www.ms.gov.br/administracao-publica/servico-de-protocolos66;35;administracao-publica//servico-de-protocolos66
Saúde e Cuidado;Tratamento Fora De Domicilio;https://www.ms.gov.br/saude-e-cuidado/tratamento-fora-de-domicilio43;35;saude-e-cuidado//tratamento-fora-de-domicilio43
Saúde e Cuidado;Consulta Aos Estoques Dos Medicamentos Do Componente Especializado Da Assistencia Farmaceutica Ceaf;https://www.ms.gov.br/saude-e-cuidado/consulta-aos-estoques-dos-medicamentos-do-componente-especializado-da-assistencia-farmaceutica-ceaf71;35;saude-e-cuidado//consulta-aos-estoques-dos-medicamentos-do-componente-especializado-da-assistencia-farmaceutica-ceaf71
Administração Pública;Solicitar Peticionamento Processual;https://www.ms.gov.br/administracao-publica/solicitar-peticionamento-processual90;34;administracao-publica//solicitar-peticionamento-processual90
Educação e Pesquisa;Recuperacao De Senha Microsoft E Do E Mail Institucional;https://www.ms.gov.br/educacao-e-pesquisa/recuperacao-de-senha-microsoft-e-do-e-mail-institucional46;34;educacao-e-pesquisa//recuperacao-de-senha-microsoft-e-do-e-mail-institucional46
Empresa, Indústria e Comércio;Solicitar Consulta De Debitos De Agua E Esgoto;https://www.ms.gov.br/empresa-industria-e-comercio/solicitar-consulta-de-debitos-de-agua-e-esgoto181;34;empresa-industria-e-comercio//solicitar-consulta-de-debitos-de-agua-e-esgoto181
Segurança;Agente Voluntario De Defesa Civil Avdc;https://www.ms.gov.br/seguranca/agente-voluntario-de-defesa-civil-avdc25;34;seguranca//agente-voluntario-de-defesa-civil-avdc25
Saúde e Cuidado;Envio De Documentos Do Componente Especializado Da Assistencia Farmaceutica Por Meio Digital;https://www.ms.gov.br/saude-e-cuidado/envio-de-documentos-do-componente-especializado-da-assistencia-farmaceutica-por-meio-digital107;33;saude-e-cuidado//envio-de-documentos-do-componente-especializado-da-assistencia-farmaceutica-por-meio-digital107
Assistência Social;Solicitar Cadastro Para Prestacao De Assistencia Religiosa;https://www.ms.gov.br/assistencia-social/solicitar-cadastro-para-prestacao-de-assistencia-religiosa21;33;assistencia-social//solicitar-cadastro-para-prestacao-de-assistencia-religiosa21
Trabalho, Emprego e Previdência;Contratar Mao De Obra Prisional;https://www.ms.gov.br/trabalho-emprego-e-previdencia/contratar-mao-de-obra-prisional18;33;trabalho-emprego-e-previdencia//contratar-mao-de-obra-prisional18
Direitos e Cidadania;Solicitacao De Apoio E Orientacao As Organizacoes Da Sociedade Civil;https://www.ms.gov.br/direitos-e-cidadania/solicitacao-de-apoio-e-orientacao-as-organizacoes-da-sociedade-civil1;32;direitos-e-cidadania/solicitacao-de-apoio-e-orientacao-as-organizacoes-da-sociedade-civil1
Segurança;04 Patrulha Rural Protecao De Vidas No Campo;https://www.ms.gov.br/seguranca/04-patrulha-rural-protecao-de-vidas-no-campo91;32;seguranca/04-patrulha-rural-protecao-de-vidas-no-campo91
Meio Ambiente;Descentalizar O Licenciamento Ambiental;https://www.ms.gov.br/meio-ambiente/descentalizar-o-licenciamento-ambiental170;32;meio-ambiente//descentalizar-o-licenciamento-ambiental170
Agropecuária e Vida Rural;Solicitar Declaracao De Nao Beneficiario Do Programa Nacional De Credito Fundiario Pncf;https://www.ms.gov.br/agropecuaria-e-vida-rural/solicitar-declaracao-de-nao-beneficiario-do-programa-nacional-de-credito-fundiario-pncf23;32;agropecuaria-e-vida-rural/solicitar-declaracao-de-nao-beneficiario-do-programa-nacional-de-credito-fundiario-pncf23
Comunicação e Transparência;Registrar Denuncia;https://www.ms.gov.br/comunicacao-e-transparencia/registrar-denuncia103;32;comunicacao-e-transparencia/registrar-denuncia103//imprimir
Forças Armadas e Defesa Civil;Solicitar Atendimento Para Acoes De Defesa Civil;https://www.ms.gov.br/forcas-armadas-e-defesa-civil/solicitar-atendimento-para-acoes-de-defesa-civil189;31;forcas-armadas-e-defesa-civil//solicitar-atendimento-para-acoes-de-defesa-civil189
Agropecuária e Vida Rural;Solicitacao De Pre Vistoria Para Instalacao De Estabelecimentos Avicolas;https://www.ms.gov.br/agropecuaria-e-vida-rural/solicitacao-de-pre-vistoria-para-instalacao-de-estabelecimentos-avicolas50;31;agropecuaria-e-vida-rural//solicitacao-de-pre-vistoria-para-instalacao-de-estabelecimentos-avicolas50
Agropecuária e Vida Rural;Emitir Ou Consultar Documentos Referentes Ao Transito De Animais;https://www.ms.gov.br/agropecuaria-e-vida-rural/emitir-ou-consultar-documentos-referentes-ao-transito-de-animais173;31;agropecuaria-e-vida-rural//emitir-ou-consultar-documentos-referentes-ao-transito-de-animais173
Empresa, Indústria e Comércio;Avaliar Programas De Integridade;https://www.ms.gov.br/empresa-industria-e-comercio/avaliar-programas-de-integridade119;31;empresa-industria-e-comercio/avaliar-programas-de-integridade119
Habitação;Emissao De Boletos Via Site Oficial;https://www.ms.gov.br/habitacao/emissao-de-boletos-via-site-oficial132;31;habitacao//emissao-de-boletos-via-site-oficial132
Direitos e Cidadania;Solicitacao De Apoio Para Conselheiros Tutelares E Municipais Dos Direitos Da Crianca E Do Adolescente;https://www.ms.gov.br/direitos-e-cidadania/solicitacao-de-apoio-para-conselheiros-tutelares-e-municipais-dos-direitos-da-crianca-e-do-adolescente149;30;direitos-e-cidadania//solicitacao-de-apoio-para-conselheiros-tutelares-e-municipais-dos-direitos-da-crianca-e-do-adolescente149
Administração Pública;Celebrar Convenio De Cooperacao Para Regulacao E Fiscalizacao Dos Servicos De Saneamento Basico;https://www.ms.gov.br/administracao-publica/celebrar-convenio-de-cooperacao-para-regulacao-e-fiscalizacao-dos-servicos-de-saneamento-basico149;30;administracao-publica/celebrar-convenio-de-cooperacao-para-regulacao-e-fiscalizacao-dos-servicos-de-saneamento-basico149
Saúde e Cuidado;Requisicao De Alvara Sanitario;https://www.ms.gov.br/saude-e-cuidado/requisicao-de-alvara-sanitario62;30;saude-e-cuidado//requisicao-de-alvara-sanitario62
Trânsito e Transportes;Solicitar Mudanca De Categoria Na Carteira Nacional De Habilitacao Cnh;https://www.ms.gov.br/transito-e-transportes/solicitar-mudanca-de-categoria-na-carteira-nacional-de-habilitacao-cnh4;29;transito-e-transportes//solicitar-mudanca-de-categoria-na-carteira-nacional-de-habilitacao-cnh4
Agropecuária e Vida Rural;Cadastrar Industria Produtos Agrotoxicos No E Saniagro;https://www.ms.gov.br/agropecuaria-e-vida-rural/cadastrar-industria-produtos-agrotoxicos-no-e-saniagro176;29;agropecuaria-e-vida-rural//cadastrar-industria-produtos-agrotoxicos-no-e-saniagro176
Trânsito e Transportes;Solicitar Registro De Estrangeiro;https://www.ms.gov.br/transito-e-transportes/solicitar-registro-de-estrangeiro43;28;transito-e-transportes/solicitar-registro-de-estrangeiro43
Educação e Pesquisa;Exposicao E Comercializacao De Pecas Artesanais De Ms;https://www.ms.gov.br/educacao-e-pesquisa/exposicao-e-comercializacao-de-pecas-artesanais-de-ms143;28;educacao-e-pesquisa//exposicao-e-comercializacao-de-pecas-artesanais-de-ms143
Empresa, Indústria e Comércio;Cadastrar E Alterar Registro De Produtos Agrotoxicos;https://www.ms.gov.br/empresa-industria-e-comercio/cadastrar-e-alterar-registro-de-produtos-agrotoxicos133;28;empresa-industria-e-comercio//cadastrar-e-alterar-registro-de-produtos-agrotoxicos133
Empresa, Indústria e Comércio;Solicitar Retificacao Da Conta De Agua Eou Esgoto Por Vazamento;https://www.ms.gov.br/empresa-industria-e-comercio/solicitar-retificacao-da-conta-de-agua-eou-esgoto-por-vazamento7;28;empresa-industria-e-comercio/solicitar-retificacao-da-conta-de-agua-eou-esgoto-por-vazamento7
Comunicação e Transparência;Registrar Denuncia;https://www.ms.gov.br/comunicacao-e-transparencia/registrar-denuncia116;28;comunicacao-e-transparencia//registrar-denuncia116
Educação e Pesquisa;Atualizacao De Dados Cadastrais No Sau Sistema Academico Da Uems;https://www.ms.gov.br/educacao-e-pesquisa/atualizacao-de-dados-cadastrais-no-sau-sistema-academico-da-uems70;28;educacao-e-pesquisa//atualizacao-de-dados-cadastrais-no-sau-sistema-academico-da-uems70
Educação e Pesquisa;0512 Proec Solicitacao De Isbn Para Materiais Produzidos Pela Instituicao;https://www.ms.gov.br/educacao-e-pesquisa/0512-proec-solicitacao-de-isbn-para-materiais-produzidos-pela-instituicao195;28;educacao-e-pesquisa//0512-proec-solicitacao-de-isbn-para-materiais-produzidos-pela-instituicao195
Direitos e Cidadania;Solicitar Atendimento Pelo Centro Especializado De Atendimento A Mulher Ceam;https://www.ms.gov.br/direitos-e-cidadania/solicitar-atendimento-pelo-centro-especializado-de-atendimento-a-mulher-ceam181;27;direitos-e-cidadania//solicitar-atendimento-pelo-centro-especializado-de-atendimento-a-mulher-ceam181
Trabalho, Emprego e Previdência;Requer Isencao De Imposto De Renda;https://www.ms.gov.br/trabalho-emprego-e-previdencia/requer-isencao-de-imposto-de-renda156;27;trabalho-emprego-e-previdencia//requer-isencao-de-imposto-de-renda156
Educação e Pesquisa;Abono De Faltas;https://www.ms.gov.br/educacao-e-pesquisa/abono-de-faltas128;26;educacao-e-pesquisa//abono-de-faltas128
Trabalho, Emprego e Previdência;Pedir Nova Analise Da Pericia Medica Recorrer De Decisao;https://www.ms.gov.br/trabalho-emprego-e-previdencia/pedir-nova-analise-da-pericia-medica-recorrer-de-decisao123;26;trabalho-emprego-e-previdencia//pedir-nova-analise-da-pericia-medica-recorrer-de-decisao123
Ciência e Tecnologia;Solicitar Liberacao Ou Bloqueio De Acesso A Conteudo Da Internet;https://www.ms.gov.br/ciencia-e-tecnologia/solicitar-liberacao-ou-bloqueio-de-acesso-a-conteudo-da-internet93;26;ciencia-e-tecnologia//solicitar-liberacao-ou-bloqueio-de-acesso-a-conteudo-da-internet93
Trânsito e Transportes;Solicitar Reabilitacao Carteira Nacional De Habilitacaocnh Condutor;https://www.ms.gov.br/transito-e-transportes/solicitar-reabilitacao-carteira-nacional-de-habilitacaocnh-condutor97;26;transito-e-transportes//solicitar-reabilitacao-carteira-nacional-de-habilitacaocnh-condutor97
Empresa, Indústria e Comércio;Verificacao Metrologica De Instrumentos De Medicao;https://www.ms.gov.br/empresa-industria-e-comercio/verificacao-metrologica-de-instrumentos-de-medicao197;26;empresa-industria-e-comercio/verificacao-metrologica-de-instrumentos-de-medicao197//index
Agropecuária e Vida Rural;Programa De Avancos Na Pecuaria De Mato Grosso Do Sul Proape Sub Programa Peixe Vida;https://www.ms.gov.br/agropecuaria-e-vida-rural/programa-de-avancos-na-pecuaria-de-mato-grosso-do-sul-proape-sub-programa-peixe-vida121;26;agropecuaria-e-vida-rural/programa-de-avancos-na-pecuaria-de-mato-grosso-do-sul-proape-sub-programa-peixe-vida121
Meio Ambiente;Participar Da Consulta Publica E Instrumentos De Participacao Social Da Microrregiao De Saneamento Basico Msb;https://www.ms.gov.br/meio-ambiente/participar-da-consulta-publica-e-instrumentos-de-participacao-social-da-microrregiao-de-saneamento-basico-msb177;25;meio-ambiente//participar-da-consulta-publica-e-instrumentos-de-participacao-social-da-microrregiao-de-saneamento-basico-msb177
Direitos e Cidadania;Servico De Promocao Da Igualdade Racial;https://www.ms.gov.br/direitos-e-cidadania/servico-de-promocao-da-igualdade-racial58;25;direitos-e-cidadania//servico-de-promocao-da-igualdade-racial58
Comunicação e Transparência;Registrar Denuncia;https://www.ms.gov.br/comunicacao-e-transparencia/registrar-denuncia53;25;comunicacao-e-transparencia/registrar-denuncia53
Trabalho, Emprego e Previdência;Solicitar Inclusao Eou Exclusao De Dependentes De Pensao Previdenciaria;https://www.ms.gov.br/trabalho-emprego-e-previdencia/solicitar-inclusao-eou-exclusao-de-dependentes-de-pensao-previdenciaria77;25;trabalho-emprego-e-previdencia//solicitar-inclusao-eou-exclusao-de-dependentes-de-pensao-previdenciaria77
Trânsito e Transportes;Solicitar Alteracao De Dados Na Carteira Nacional De Habilitacao Cnh;https://www.ms.gov.br/transito-e-transportes/solicitar-alteracao-de-dados-na-carteira-nacional-de-habilitacao-cnh200;24;transito-e-transportes//solicitar-alteracao-de-dados-na-carteira-nacional-de-habilitacao-cnh200
Direitos e Cidadania;Reconhecimento De Identidade De Genero Nos Documentos Academicos;https://www.ms.gov.br/direitos-e-cidadania/reconhecimento-de-identidade-de-genero-nos-documentos-academicos118;24;direitos-e-cidadania//reconhecimento-de-identidade-de-genero-nos-documentos-academicos118
Trabalho, Emprego e Previdência;Atendimento Ao Segurado;https://www.ms.gov.br/trabalho-emprego-e-previdencia/atendimento-ao-segurado189;24;trabalho-emprego-e-previdencia//atendimento-ao-segurado189
Trânsito e Transportes;Solicitacao De Desvinculacao De Multas De Veiculos Adquiridos Em Leiloes;https://www.ms.gov.br/transito-e-transportes/solicitacao-de-desvinculacao-de-multas-de-veiculos-adquiridos-em-leiloes7;24;transito-e-transportes//solicitacao-de-desvinculacao-de-multas-de-veiculos-adquiridos-em-leiloes7
Trabalho, Emprego e Previdência;Atendimento Ao Empregador;https://www.ms.gov.br/trabalho-emprego-e-previdencia/atendimento-ao-empregador157;24;trabalho-emprego-e-previdencia/atendimento-ao-empregador157
Administração Pública;Direcao Assessoramento E Coordenacao Juridica;https://www.ms.gov.br/administracao-publica/direcao-assessoramento-e-coordenacao-juridica39;23;administracao-publica//direcao-assessoramento-e-coordenacao-juridica39
Agropecuária e Vida Rural;Cadastrar Apiarios E Meliponarios;https://www.ms.gov.br/agropecuaria-e-vida-rural/cadastrar-apiarios-e-meliponarios67;23;agropecuaria-e-vida-rural//cadastrar-apiarios-e-meliponarios67
Agropecuária e Vida Rural;Baixar O Registro De Estabelecimento Comercial E Prestador De Servico De Agrotoxico;https://www.ms.gov.br/agropecuaria-e-vida-rural/baixar-o-registro-de-estabelecimento-comercial-e-prestador-de-servico-de-agrotoxico141;23;agropecuaria-e-vida-rural//baixar-o-registro-de-estabelecimento-comercial-e-prestador-de-servico-de-agrotoxico141
Assistência Social;Programa Cuidar De Quem Cuida;https://www.ms.gov.br/assistencia-social/programa-cuidar-de-quem-cuida60;23;assistencia-social//programa-cuidar-de-quem-cuida60
Administração Pública;Obter Credenciamento Como Verificador Independente;https://www.ms.gov.br/administracao-publica/obter-credenciamento-como-verificador-independente74;23;administracao-publica//obter-credenciamento-como-verificador-independente74
Educação e Pesquisa;Recuperacao De Senha Do Login Uems;https://www.ms.gov.br/educacao-e-pesquisa/recuperacao-de-senha-do-login-uems190;23;educacao-e-pesquisa//recuperacao-de-senha-do-login-uems190
Agropecuária e Vida Rural;Programa De Verticalizacao Da Producao Agropecuaria Do Estado De Mato Grosso Do Sul;https://www.ms.gov.br/agropecuaria-e-vida-rural/programa-de-verticalizacao-da-producao-agropecuaria-do-estado-de-mato-grosso-do-sul12;22;agropecuaria-e-vida-rural/programa-de-verticalizacao-da-producao-agropecuaria-do-estado-de-mato-grosso-do-sul12
Infraestrutura;Faixas De Dominio;https://www.ms.gov.br/infraestrutura/faixas-de-dominio158;22;infraestrutura//faixas-de-dominio158
