Categoria;Nome do Serviço;Link;Visitas;URL_Original
Trânsito e Transportes;Emitir Guia De Licenciamento Anual;https://www.ms.gov.br/transito-e-transportes/emitir-guia-de-licenciamento-anual100;35623;transito-e-transportes/emitir-guia-de-licenciamento-anual100
Finanças e Impostos;Ipva Consulta De Debito;https://www.ms.gov.br/financas-e-impostos/ipva-consulta-de-debito54;30558;financas-e-impostos/ipva-consulta-de-debito54
Finanças e Impostos;Portal E Fazenda Cadastro;https://www.ms.gov.br/financas-e-impostos/portal-e-fazenda-cadastro135;15364;financas-e-impostos/portal-e-fazenda-cadastro135
Direitos e Cidadania;Expedicao De Carteira De Identidade;https://www.ms.gov.br/direitos-e-cidadania/expedicao-de-carteira-de-identidade127;11689;direitos-e-cidadania//expedicao-de-carteira-de-identidade127
Segurança;Expedicao De Certidao De Antecedentes Criminais;https://www.ms.gov.br/seguranca/expedicao-de-certidao-de-antecedentes-criminais35;11639;seguranca/expedicao-de-certidao-de-antecedentes-criminais35
Finanças e Impostos;Certidao Tributaria Estadual Emissao;https://www.ms.gov.br/financas-e-impostos/certidao-tributaria-estadual-emissao152;8792;financas-e-impostos/certidao-tributaria-estadual-emissao152
Trabalho, Emprego e Previdência;Intermediacao De Empregos;https://www.ms.gov.br/trabalho-emprego-e-previdencia/intermediacao-de-empregos7;8778;trabalho-emprego-e-previdencia/intermediacao-de-empregos7
Trânsito e Transportes;Emissao Da Carteira Nacional De Habilitacao;https://www.ms.gov.br/transito-e-transportes/emissao-da-carteira-nacional-de-habilitacao174;7966;transito-e-transportes/emissao-da-carteira-nacional-de-habilitacao174
Finanças e Impostos;Documento De Arrecadacao Do Estado De Mato Grosso Do Sul Daems Emissao;https://www.ms.gov.br/financas-e-impostos/documento-de-arrecadacao-do-estado-de-mato-grosso-do-sul-daems-emissao5;5930;financas-e-impostos/documento-de-arrecadacao-do-estado-de-mato-grosso-do-sul-daems-emissao5
Trânsito e Transportes;Contestacao Administrativa De Multa Autuacao E Penalidades;https://www.ms.gov.br/transito-e-transportes/contestacao-administrativa-de-multa-autuacao-e-penalidades159;5766;transito-e-transportes/contestacao-administrativa-de-multa-autuacao-e-penalidades159
Educação e Pesquisa;Emitir Certificado De Conclusao Do Ensino Medio;https://www.ms.gov.br/educacao-e-pesquisa/emitir-certificado-de-conclusao-do-ensino-medio111;5589;educacao-e-pesquisa/emitir-certificado-de-conclusao-do-ensino-medio111
Comunicação e Transparência;Falar Com A Gloria;https://www.ms.gov.br/comunicacao-e-transparencia/falar-com-a-gloria167;5183;comunicacao-e-transparencia/falar-com-a-gloria167
Administração Pública;Pagamento De Ipva Inscrito Em Divida Ativa;https://www.ms.gov.br/administracao-publica/pagamento-de-ipva-inscrito-em-divida-ativa134;4770;administracao-publica/pagamento-de-ipva-inscrito-em-divida-ativa134
Segurança;051 Boletim On Line De Acidente De Transito Atendimento Sem Vitimas;https://www.ms.gov.br/seguranca/051-boletim-on-line-de-acidente-de-transito-atendimento-sem-vitimas170;3372;seguranca/051-boletim-on-line-de-acidente-de-transito-atendimento-sem-vitimas170//imprimir
Meio Ambiente;Emissao De Autorizacoes Ambientais Para A Pesca Amadora;https://www.ms.gov.br/meio-ambiente/emissao-de-autorizacoes-ambientais-para-a-pesca-amadora116;3294;meio-ambiente/emissao-de-autorizacoes-ambientais-para-a-pesca-amadora116
Empresa, Indústria e Comércio;Emitir Certidao Simplificada Digital;https://www.ms.gov.br/empresa-industria-e-comercio/emitir-certidao-simplificada-digital84;3293;empresa-industria-e-comercio//emitir-certidao-simplificada-digital84
Finanças e Impostos;Termo De Verificacao Fiscal Tvf Ou Termo De Apreensao Ta Baixa Ou Alteracao;https://www.ms.gov.br/financas-e-impostos/termo-de-verificacao-fiscal-tvf-ou-termo-de-apreensao-ta-baixa-ou-alteracao99;3232;financas-e-impostos/termo-de-verificacao-fiscal-tvf-ou-termo-de-apreensao-ta-baixa-ou-alteracao99
Direitos e Cidadania;Solicitar Carteira De Identificacao Por Nome Social Cns;https://www.ms.gov.br/direitos-e-cidadania/solicitar-carteira-de-identificacao-por-nome-social-cns171;3019;direitos-e-cidadania//solicitar-carteira-de-identificacao-por-nome-social-cns171
Trânsito e Transportes;Participar Do Programa Cnh Ms Social;https://www.ms.gov.br/transito-e-transportes/participar-do-programa-cnh-ms-social138;2839;transito-e-transportes//participar-do-programa-cnh-ms-social138
Assistência Social;Solicitacao De Inclusao No Programa Mais Social;https://www.ms.gov.br/assistencia-social/solicitacao-de-inclusao-no-programa-mais-social118;2632;assistencia-social//solicitacao-de-inclusao-no-programa-mais-social118
Direitos e Cidadania;Solicitar Atendimento No Proconms;https://www.ms.gov.br/direitos-e-cidadania/solicitar-atendimento-no-proconms97;2556;direitos-e-cidadania//solicitar-atendimento-no-proconms97
Administração Pública;Pedido De Parcelamento Eou Pagamento De Debito Inscrito Em Divida Ativa;https://www.ms.gov.br/administracao-publica/pedido-de-parcelamento-eou-pagamento-de-debito-inscrito-em-divida-ativa67;2227;administracao-publica/pedido-de-parcelamento-eou-pagamento-de-debito-inscrito-em-divida-ativa67
Educação e Pesquisa;Consultar Notas E Frequencia De Estudantes;https://www.ms.gov.br/educacao-e-pesquisa/consultar-notas-e-frequencia-de-estudantes143;2201;educacao-e-pesquisa/consultar-notas-e-frequencia-de-estudantes143
Finanças e Impostos;Consulta Tributaria;https://www.ms.gov.br/financas-e-impostos/consulta-tributaria121;2068;financas-e-impostos/consulta-tributaria121
Segurança;Delegacia Virtual Devir;https://www.ms.gov.br/seguranca/delegacia-virtual-devir105;2055;seguranca//delegacia-virtual-devir105
Habitação;Atendimento Via Whatsapp;https://www.ms.gov.br/habitacao/atendimento-via-whatsapp25;1978;habitacao/atendimento-via-whatsapp25
Trânsito e Transportes;Emissao De Crlv E Licenciamento Digital;https://www.ms.gov.br/transito-e-transportes/emissao-de-crlv-e-licenciamento-digital13;1894;transito-e-transportes//emissao-de-crlv-e-licenciamento-digital13
Finanças e Impostos;Ipva Reducao Do Ipva Para Proprietario Ou Possuidor Paraplegico Ou Portador De Deficiencia Fisica;https://www.ms.gov.br/financas-e-impostos/ipva-reducao-do-ipva-para-proprietario-ou-possuidor-paraplegico-ou-portador-de-deficiencia-fisica104;1853;financas-e-impostos/ipva-reducao-do-ipva-para-proprietario-ou-possuidor-paraplegico-ou-portador-de-deficiencia-fisica104
Educação e Pesquisa;Verificacao De Vida Escolar E Autenticidade De Documentos Escolares De Estudantes Do Sistema De Ensino De Mato Grosso Do Sul;https://www.ms.gov.br/educacao-e-pesquisa/verificacao-de-vida-escolar-e-autenticidade-de-documentos-escolares-de-estudantes-do-sistema-de-ensino-de-mato-grosso-do-sul26;1751;educacao-e-pesquisa/verificacao-de-vida-escolar-e-autenticidade-de-documentos-escolares-de-estudantes-do-sistema-de-ensino-de-mato-grosso-do-sul26
Trânsito e Transportes;Solicitar Adicao De Categoria Na Carteira Nacional De Habilitacao Cnh;https://www.ms.gov.br/transito-e-transportes/solicitar-adicao-de-categoria-na-carteira-nacional-de-habilitacao-cnh144;1667;transito-e-transportes/solicitar-adicao-de-categoria-na-carteira-nacional-de-habilitacao-cnh144
Educação e Pesquisa;Emitir No Formato Digital A Carteira De Identificacao Estudantil De Mato Grosso Do Sul;https://www.ms.gov.br/educacao-e-pesquisa/emitir-no-formato-digital-a-carteira-de-identificacao-estudantil-de-mato-grosso-do-sul75;1653;educacao-e-pesquisa/emitir-no-formato-digital-a-carteira-de-identificacao-estudantil-de-mato-grosso-do-sul75
Finanças e Impostos;Nota Fiscal Eletronica Nf E Credenciamento;https://www.ms.gov.br/financas-e-impostos/nota-fiscal-eletronica-nf-e-credenciamento81;1595;financas-e-impostos//nota-fiscal-eletronica-nf-e-credenciamento81
Trânsito e Transportes;Solicitacao De Curso De Reciclagem Para Condutores Infratores;https://www.ms.gov.br/transito-e-transportes/solicitacao-de-curso-de-reciclagem-para-condutores-infratores28;1568;transito-e-transportes/solicitacao-de-curso-de-reciclagem-para-condutores-infratores28
Segurança;Localizar Pessoa Privada De Liberdade;https://www.ms.gov.br/seguranca/localizar-pessoa-privada-de-liberdade21;1551;seguranca//localizar-pessoa-privada-de-liberdade21
Finanças e Impostos;Emitir Nota Fiscal De Consumidor Eletronica;https://www.ms.gov.br/financas-e-impostos/emitir-nota-fiscal-de-consumidor-eletronica170;1473;financas-e-impostos//emitir-nota-fiscal-de-consumidor-eletronica170
Comunicação e Transparência;Energia Social Conta De Luz Zero;https://www.ms.gov.br/comunicacao-e-transparencia/energia-social-conta-de-luz-zero78;1471;comunicacao-e-transparencia//energia-social-conta-de-luz-zero78
Agropecuária e Vida Rural;Credito Rural;https://www.ms.gov.br/agropecuaria-e-vida-rural/credito-rural132;1378;agropecuaria-e-vida-rural//credito-rural132
Finanças e Impostos;Certidao Tributaria Estadual Emissao Certidao Circunstanciada De Debitos Estaduais;https://www.ms.gov.br/financas-e-impostos/certidao-tributaria-estadual-emissao-certidao-circunstanciada-de-debitos-estaduais174;1339;financas-e-impostos/certidao-tributaria-estadual-emissao-certidao-circunstanciada-de-debitos-estaduais174
Finanças e Impostos;Ipva Isencoes Exceto Para Veiculo Rodoviario Utilizado Como Taxi;https://www.ms.gov.br/financas-e-impostos/ipva-isencoes-exceto-para-veiculo-rodoviario-utilizado-como-taxi4;1280;financas-e-impostos/ipva-isencoes-exceto-para-veiculo-rodoviario-utilizado-como-taxi4
Empresa, Indústria e Comércio;Cadastro Do Comercio Industria E Servicos Ccis Inscricao De Empresas;https://www.ms.gov.br/empresa-industria-e-comercio/cadastro-do-comercio-industria-e-servicos-ccis-inscricao-de-empresas89;1274;empresa-industria-e-comercio/cadastro-do-comercio-industria-e-servicos-ccis-inscricao-de-empresas89
Comunicação e Transparência;Registrar Pedido De Acesso A Informacao;https://www.ms.gov.br/comunicacao-e-transparencia/registrar-pedido-de-acesso-a-informacao105;1257;comunicacao-e-transparencia/registrar-pedido-de-acesso-a-informacao105
Comunicação e Transparência;Estatisticas Online;https://www.ms.gov.br/comunicacao-e-transparencia/estatisticas-online118;1211;comunicacao-e-transparencia/estatisticas-online118
Empresa, Indústria e Comércio;Certidao De Inteiro Teor Digital;https://www.ms.gov.br/empresa-industria-e-comercio/certidao-de-inteiro-teor-digital19;1137;empresa-industria-e-comercio//certidao-de-inteiro-teor-digital19
Comunicação e Transparência;Pedido De Acesso A Informacao;https://www.ms.gov.br/comunicacao-e-transparencia/pedido-de-acesso-a-informacao37;1024;comunicacao-e-transparencia/pedido-de-acesso-a-informacao37
Trânsito e Transportes;Solicitacao De Primeiro Registro De Veiculo;https://www.ms.gov.br/transito-e-transportes/solicitacao-de-primeiro-registro-de-veiculo121;1008;transito-e-transportes/solicitacao-de-primeiro-registro-de-veiculo121
Comunicação e Transparência;Programa Cuidar De Quem Cuida;https://www.ms.gov.br/comunicacao-e-transparencia/programa-cuidar-de-quem-cuida60;994;comunicacao-e-transparencia/programa-cuidar-de-quem-cuida60
Finanças e Impostos;Emitir Daems Pagar Emolumentos E Taxas A Pge;https://www.ms.gov.br/financas-e-impostos/emitir-daems-pagar-emolumentos-e-taxas-a-pge132;908;financas-e-impostos/emitir-daems-pagar-emolumentos-e-taxas-a-pge132
Trânsito e Transportes;Emissao De Guias Para Pagamento De Multas;https://www.ms.gov.br/transito-e-transportes/emissao-de-guias-para-pagamento-de-multas173;856;transito-e-transportes//emissao-de-guias-para-pagamento-de-multas173
Trânsito e Transportes;Solicitaremitir Licenca De Aprendizagem De Direcao Veicular Ladv;https://www.ms.gov.br/transito-e-transportes/solicitaremitir-licenca-de-aprendizagem-de-direcao-veicular-ladv2;856;transito-e-transportes//solicitaremitir-licenca-de-aprendizagem-de-direcao-veicular-ladv2
Trânsito e Transportes;Solicitacao De Aplicacao De Exames De Habilitacao Teorico E Pratico;https://www.ms.gov.br/transito-e-transportes/solicitacao-de-aplicacao-de-exames-de-habilitacao-teorico-e-pratico143;854;transito-e-transportes//solicitacao-de-aplicacao-de-exames-de-habilitacao-teorico-e-pratico143
Educação e Pesquisa;Solicitar Transferencia De Estudante;https://www.ms.gov.br/educacao-e-pesquisa/solicitar-transferencia-de-estudante129;776;educacao-e-pesquisa/solicitar-transferencia-de-estudante129
Finanças e Impostos;Ipva Troca De Veiculo Reducao P Pessoa Com Deficiencia Pcd;https://www.ms.gov.br/financas-e-impostos/ipva-troca-de-veiculo-reducao-p-pessoa-com-deficiencia-pcd39;752;financas-e-impostos/ipva-troca-de-veiculo-reducao-p-pessoa-com-deficiencia-pcd39
Agropecuária e Vida Rural;Cadastro Da Agropecuaria Cap Inscricao De Produtor Rural;https://www.ms.gov.br/agropecuaria-e-vida-rural/cadastro-da-agropecuaria-cap-inscricao-de-produtor-rural119;723;agropecuaria-e-vida-rural/cadastro-da-agropecuaria-cap-inscricao-de-produtor-rural119
Comunicação e Transparência;Programa Ms Supera;https://www.ms.gov.br/comunicacao-e-transparencia/programa-ms-supera157;708;comunicacao-e-transparencia/programa-ms-supera157//index
Direitos e Cidadania;Solicitar Emissao De Certidao De Nascimento E Documentos Basicos;https://www.ms.gov.br/direitos-e-cidadania/solicitar-emissao-de-certidao-de-nascimento-e-documentos-basicos152;699;direitos-e-cidadania//solicitar-emissao-de-certidao-de-nascimento-e-documentos-basicos152
Trânsito e Transportes;Solicitacao De Atualizacao De Endereco Do Condutor;https://www.ms.gov.br/transito-e-transportes/solicitacao-de-atualizacao-de-endereco-do-condutor117;681;transito-e-transportes/solicitacao-de-atualizacao-de-endereco-do-condutor117
Empresa, Indústria e Comércio;Pesquisar Viabilidade;https://www.ms.gov.br/empresa-industria-e-comercio/pesquisar-viabilidade198;670;empresa-industria-e-comercio//pesquisar-viabilidade198
Finanças e Impostos;Pendencias Fiscais Eou Cadastrais Regularizacao;https://www.ms.gov.br/financas-e-impostos/pendencias-fiscais-eou-cadastrais-regularizacao149;668;financas-e-impostos/pendencias-fiscais-eou-cadastrais-regularizacao149
Finanças e Impostos;Ipva Reducao Da Base De Calculo Do Ipva Para Veiculos De Frotista;https://www.ms.gov.br/financas-e-impostos/ipva-reducao-da-base-de-calculo-do-ipva-para-veiculos-de-frotista18;648;financas-e-impostos//ipva-reducao-da-base-de-calculo-do-ipva-para-veiculos-de-frotista18
Finanças e Impostos;Cadastro De Contabilistas Inclusao E Alteracao De Dados Do Contabilista;https://www.ms.gov.br/financas-e-impostos/cadastro-de-contabilistas-inclusao-e-alteracao-de-dados-do-contabilista76;638;financas-e-impostos/cadastro-de-contabilistas-inclusao-e-alteracao-de-dados-do-contabilista76//index
Finanças e Impostos;Restituicao Do Indebito Tributario Pedido;https://www.ms.gov.br/financas-e-impostos/restituicao-do-indebito-tributario-pedido172;634;financas-e-impostos/restituicao-do-indebito-tributario-pedido172
Educação e Pesquisa;Processo Seletivo Permanente Notas Do Enem Vagas Remanescentes;https://www.ms.gov.br/educacao-e-pesquisa/processo-seletivo-permanente-notas-do-enem-vagas-remanescentes60;628;educacao-e-pesquisa//processo-seletivo-permanente-notas-do-enem-vagas-remanescentes60
Finanças e Impostos;Nota Fiscal Avulsa Eletronica Nfa E Emissao;https://www.ms.gov.br/financas-e-impostos/nota-fiscal-avulsa-eletronica-nfa-e-emissao185;614;financas-e-impostos/nota-fiscal-avulsa-eletronica-nfa-e-emissao185
Finanças e Impostos;Auto De Lancamento E De Imposicao De Multa Alim Impugnacao;https://www.ms.gov.br/financas-e-impostos/auto-de-lancamento-e-de-imposicao-de-multa-alim-impugnacao83;608;financas-e-impostos/auto-de-lancamento-e-de-imposicao-de-multa-alim-impugnacao83
Educação e Pesquisa;Oferta Do Ensino Fundamental;https://www.ms.gov.br/educacao-e-pesquisa/oferta-do-ensino-fundamental194;608;educacao-e-pesquisa/oferta-do-ensino-fundamental194
Finanças e Impostos;Certidao Tributaria Estadual Emissao Certidao Positiva De Debitos Estaduais;https://www.ms.gov.br/financas-e-impostos/certidao-tributaria-estadual-emissao-certidao-positiva-de-debitos-estaduais200;602;financas-e-impostos/certidao-tributaria-estadual-emissao-certidao-positiva-de-debitos-estaduais200
Educação e Pesquisa;Pre Matricula Presencial E Digital;https://www.ms.gov.br/educacao-e-pesquisa/pre-matricula-presencial-e-digital194;596;educacao-e-pesquisa/pre-matricula-presencial-e-digital194
Assistência Social;Emitir No Formato Digital A Carteira De Identificacao Da Pessoa Com Transtorno Do Espectro Autista;https://www.ms.gov.br/assistencia-social/emitir-no-formato-digital-a-carteira-de-identificacao-da-pessoa-com-transtorno-do-espectro-autista63;574;assistencia-social//emitir-no-formato-digital-a-carteira-de-identificacao-da-pessoa-com-transtorno-do-espectro-autista63
Trânsito e Transportes;Curso De Formacao De Condutores Para 1O Habilitacao;https://www.ms.gov.br/transito-e-transportes/curso-de-formacao-de-condutores-para-1o-habilitacao58;556;transito-e-transportes//curso-de-formacao-de-condutores-para-1o-habilitacao58
Finanças e Impostos;Declaracao De Compras Para Aquisicoes Interestaduais De Materiais De Construcao Por Consumidor Final Nao Contribuinte Do Icms Ou Por Empresas Do Ramo Da Construcao Civil;https://www.ms.gov.br/financas-e-impostos/declaracao-de-compras-para-aquisicoes-interestaduais-de-materiais-de-construcao-por-consumidor-final-nao-contribuinte-do-icms-ou-por-empresas-do-ramo-da-construcao-civil12;550;financas-e-impostos/declaracao-de-compras-para-aquisicoes-interestaduais-de-materiais-de-construcao-por-consumidor-final-nao-contribuinte-do-icms-ou-por-empresas-do-ramo-da-construcao-civil12
Agropecuária e Vida Rural;Cadastrar Marca De Rebanho;https://www.ms.gov.br/agropecuaria-e-vida-rural/cadastrar-marca-de-rebanho2;542;agropecuaria-e-vida-rural/cadastrar-marca-de-rebanho2
Empresa, Indústria e Comércio;Cadastro Do Comercio Industria E Servicos Ccis Alteracao De Dados Cadastrais;https://www.ms.gov.br/empresa-industria-e-comercio/cadastro-do-comercio-industria-e-servicos-ccis-alteracao-de-dados-cadastrais96;534;empresa-industria-e-comercio/cadastro-do-comercio-industria-e-servicos-ccis-alteracao-de-dados-cadastrais96
Trânsito e Transportes;Emitir Licenca De Viagem Eventualturistica Lve;https://www.ms.gov.br/transito-e-transportes/emitir-licenca-de-viagem-eventualturistica-lve172;531;transito-e-transportes/emitir-licenca-de-viagem-eventualturistica-lve172
Finanças e Impostos;Auto De Lancamento E De Imposicao De Multa Alim Mod 2 Solicitacao De Lavratura Referente A Tvf Eou Ta;https://www.ms.gov.br/financas-e-impostos/auto-de-lancamento-e-de-imposicao-de-multa-alim-mod-2-solicitacao-de-lavratura-referente-a-tvf-eou-ta198;524;financas-e-impostos/auto-de-lancamento-e-de-imposicao-de-multa-alim-mod-2-solicitacao-de-lavratura-referente-a-tvf-eou-ta198
Administração Pública;Inscricao Em Divida Ativa Certidao;https://www.ms.gov.br/administracao-publica/inscricao-em-divida-ativa-certidao131;516;administracao-publica/inscricao-em-divida-ativa-certidao131
Finanças e Impostos;Ipva Pedido De Restituicao;https://www.ms.gov.br/financas-e-impostos/ipva-pedido-de-restituicao22;490;financas-e-impostos/ipva-pedido-de-restituicao22
Agropecuária e Vida Rural;Nota Fiscal De Produtor Eletronica Nfp E Emissao;https://www.ms.gov.br/agropecuaria-e-vida-rural/nota-fiscal-de-produtor-eletronica-nfp-e-emissao56;447;agropecuaria-e-vida-rural/nota-fiscal-de-produtor-eletronica-nfp-e-emissao56
Trabalho, Emprego e Previdência;Receber Apoio Para Emitir O Contracheque Aposentado Ou Pensionista;https://www.ms.gov.br/trabalho-emprego-e-previdencia/receber-apoio-para-emitir-o-contracheque-aposentado-ou-pensionista12;445;trabalho-emprego-e-previdencia//receber-apoio-para-emitir-o-contracheque-aposentado-ou-pensionista12
Direitos e Cidadania;Caravana Da Castracao Servico A Ser Oferecido A Partir De Novembro;https://www.ms.gov.br/direitos-e-cidadania/caravana-da-castracao-servico-a-ser-oferecido-a-partir-de-novembro202454;433;direitos-e-cidadania//caravana-da-castracao-servico-a-ser-oferecido-a-partir-de-novembro202454
Empresa, Indústria e Comércio;Solicitar A Conta Nao Entregue De Agua E Esgoto;https://www.ms.gov.br/empresa-industria-e-comercio/solicitar-a-conta-nao-entregue-de-agua-e-esgoto118;430;empresa-industria-e-comercio/solicitar-a-conta-nao-entregue-de-agua-e-esgoto118
Empresa, Indústria e Comércio;Cadastro Do Comercio Industria E Servicos Ccis Inscricao Estadual Temporaria Para Empresas Do Ramo De Construcao Civil;https://www.ms.gov.br/empresa-industria-e-comercio/cadastro-do-comercio-industria-e-servicos-ccis-inscricao-estadual-temporaria-para-empresas-do-ramo-de-construcao-civil175;427;empresa-industria-e-comercio/cadastro-do-comercio-industria-e-servicos-ccis-inscricao-estadual-temporaria-para-empresas-do-ramo-de-construcao-civil175
Finanças e Impostos;Auto De Lancamento E De Imposicao De Multa Alim Mod 1 Solicitacao De Lavratura;https://www.ms.gov.br/financas-e-impostos/auto-de-lancamento-e-de-imposicao-de-multa-alim-mod-1-solicitacao-de-lavratura97;424;financas-e-impostos/auto-de-lancamento-e-de-imposicao-de-multa-alim-mod-1-solicitacao-de-lavratura97
Trânsito e Transportes;Fazer Transferencia Digital De Veiculo;https://www.ms.gov.br/transito-e-transportes/fazer-transferencia-digital-de-veiculo196;423;transito-e-transportes//fazer-transferencia-digital-de-veiculo196
Trabalho, Emprego e Previdência;Requerer Certidao De Tempo De Contribuicao Eou Declaracao De Tempo De Contribuicao;https://www.ms.gov.br/trabalho-emprego-e-previdencia/requerer-certidao-de-tempo-de-contribuicao-eou-declaracao-de-tempo-de-contribuicao98;423;trabalho-emprego-e-previdencia//requerer-certidao-de-tempo-de-contribuicao-eou-declaracao-de-tempo-de-contribuicao98
Finanças e Impostos;Analise Das Obrigacoes Socioeconomicas Pactuadas Em Termo De Acordo Beneficio Da Lei Complementar N 932001 Cidec;https://www.ms.gov.br/financas-e-impostos/analise-das-obrigacoes-socioeconomicas-pactuadas-em-termo-de-acordo-beneficio-da-lei-complementar-n-932001-cidec169;414;financas-e-impostos/analise-das-obrigacoes-socioeconomicas-pactuadas-em-termo-de-acordo-beneficio-da-lei-complementar-n-932001-cidec169
Empresa, Indústria e Comércio;Cadastro Do Comercio Industria E Servicos Ccis Inscricao De Contribuinte Localizado Em Outras Unidades Da Federacao Como Responsavel Pelo Recolhimento Do Icms Nas Operacoes Destinadas A Consumidor Final Icms Difcon;https://www.ms.gov.br/empresa-industria-e-comercio/cadastro-do-comercio-industria-e-servicos-ccis-inscricao-de-contribuinte-localizado-em-outras-unidades-da-federacao-como-responsavel-pelo-recolhimento-do-icms-nas-operacoes-destinadas-a-consumidor-final-icms-difcon53;411;empresa-industria-e-comercio/cadastro-do-comercio-industria-e-servicos-ccis-inscricao-de-contribuinte-localizado-em-outras-unidades-da-federacao-como-responsavel-pelo-recolhimento-do-icms-nas-operacoes-destinadas-a-consumidor-final-icms-difcon53
Administração Pública;Divida Ativa E Protestos;https://www.ms.gov.br/administracao-publica/divida-ativa-e-protestos132;406;administracao-publica//divida-ativa-e-protestos132
Agropecuária e Vida Rural;Habilitacao De Ficha Sanitaria;https://www.ms.gov.br/agropecuaria-e-vida-rural/habilitacao-de-ficha-sanitaria26;405;agropecuaria-e-vida-rural//habilitacao-de-ficha-sanitaria26
Trabalho, Emprego e Previdência;Carteira De Trabalho Digitalinformacoes;https://www.ms.gov.br/trabalho-emprego-e-previdencia/carteira-de-trabalho-digitalinformacoes98;403;trabalho-emprego-e-previdencia//carteira-de-trabalho-digitalinformacoes98
Finanças e Impostos;Demonstrativos De Ppd De Icms E Itcd;https://www.ms.gov.br/financas-e-impostos/demonstrativos-de-ppd-de-icms-e-itcd13;402;financas-e-impostos/demonstrativos-de-ppd-de-icms-e-itcd13
Finanças e Impostos;Documento De Arrecadacao Do Estado De Mato Grosso Do Sul Daems Retificacao Ou Apostilamento;https://www.ms.gov.br/financas-e-impostos/documento-de-arrecadacao-do-estado-de-mato-grosso-do-sul-daems-retificacao-ou-apostilamento82;392;financas-e-impostos/documento-de-arrecadacao-do-estado-de-mato-grosso-do-sul-daems-retificacao-ou-apostilamento82
Habitação;Regularizacao Fundiaria;https://www.ms.gov.br/habitacao/regularizacao-fundiaria197;391;habitacao/regularizacao-fundiaria197
Empresa, Indústria e Comércio;Cadastro Do Comercio Industria E Servicos Ccis Inscricao De Contribuinte Localizado Em Outra Unidade Da Federacao Como Substituto Tributario Do Icms Mediante Termo De Responsabilidade;https://www.ms.gov.br/empresa-industria-e-comercio/cadastro-do-comercio-industria-e-servicos-ccis-inscricao-de-contribuinte-localizado-em-outra-unidade-da-federacao-como-substituto-tributario-do-icms-mediante-termo-de-responsabilidade77;387;empresa-industria-e-comercio/cadastro-do-comercio-industria-e-servicos-ccis-inscricao-de-contribuinte-localizado-em-outra-unidade-da-federacao-como-substituto-tributario-do-icms-mediante-termo-de-responsabilidade77
Educação e Pesquisa;Curso Normal Medio Habilitacao Para Docencia Na Educacao Infantil E Anos Iniciais Do Ensino Fundamental;https://www.ms.gov.br/educacao-e-pesquisa/curso-normal-medio-habilitacao-para-docencia-na-educacao-infantil-e-anos-iniciais-do-ensino-fundamental160;377;educacao-e-pesquisa/curso-normal-medio-habilitacao-para-docencia-na-educacao-infantil-e-anos-iniciais-do-ensino-fundamental160
Empresa, Indústria e Comércio;Cadastro Do Comercio Industria E Servicos Ccis Baixa Da Inscricao Estadual;https://www.ms.gov.br/empresa-industria-e-comercio/cadastro-do-comercio-industria-e-servicos-ccis-baixa-da-inscricao-estadual123;376;empresa-industria-e-comercio/cadastro-do-comercio-industria-e-servicos-ccis-baixa-da-inscricao-estadual123
