Categoria;Nome do Serviço;Link;Visitas;URL_Original
Saúde e Cuidado;Secretaria Academica;https://www.ms.gov.br/saude-e-cuidado/secretaria-academica169;13;saude-e-cuidado//secretaria-academica169
Saúde e Cuidado;Pronto Atendimento Medico Pam;https://www.ms.gov.br/saude-e-cuidado/pronto-atendimento-medico-pam52;13;saude-e-cuidado//pronto-atendimento-medico-pam52
Turismo;Visitacao E Realizacao De Eventos;https://www.ms.gov.br/turismo/visitacao-e-realizacao-de-eventos188;12;turismo//visitacao-e-realizacao-de-eventos188
Segurança;032 Projeto Florestinha Educacao Ambiental;https://www.ms.gov.br/seguranca/032-projeto-florestinha-educacao-ambiental65;12;seguranca//032-projeto-florestinha-educacao-ambiental65
Segurança;05 Policiamento De Transito Protecao De Vidas No Transito Das Cidades;https://www.ms.gov.br/seguranca/05-policiamento-de-transito-protecao-de-vidas-no-transito-das-cidades72;12;seguranca//05-policiamento-de-transito-protecao-de-vidas-no-transito-das-cidades72
Segurança;173 Centro De Equoterapia Da Pmms;https://www.ms.gov.br/seguranca/173-centro-de-equoterapia-da-pmms159;12;seguranca//173-centro-de-equoterapia-da-pmms159
Segurança;Solicitar Busca E Salvamento De Pessoas Ou Bens;https://www.ms.gov.br/seguranca/solicitar-busca-e-salvamento-de-pessoas-ou-bens119;12;seguranca//solicitar-busca-e-salvamento-de-pessoas-ou-bens119
Administração Pública;Solicitar Pedido De Vista E Copia Sistema E Ms;https://www.ms.gov.br/administracao-publica/solicitar-pedido-de-vista-e-copia-sistema-e-ms188;12;administracao-publica/solicitar-pedido-de-vista-e-copia-sistema-e-ms188
Saúde e Cuidado;Telediagnostico Eletrocardiograma;https://www.ms.gov.br/saude-e-cuidado/telediagnostico-eletrocardiograma75;12;saude-e-cuidado//telediagnostico-eletrocardiograma75
Educação e Pesquisa;Realizar Programa Ou Cursos De Capacitacao Continuada;https://www.ms.gov.br/educacao-e-pesquisa/realizar-programa-ou-cursos-de-capacitacao-continuada91;12;educacao-e-pesquisa//realizar-programa-ou-cursos-de-capacitacao-continuada91
Saúde e Cuidado;Solicitacao De Medicamentos Do Componente Especializado;https://www.ms.gov.br/saude-e-cuidado/solicitacao-de-medicamentos-do-componente-especializado78;12;saude-e-cuidado//solicitacao-de-medicamentos-do-componente-especializado78
Agropecuária e Vida Rural;Cadastrar Estabelecimentos De Comercio De Produtos De Uso Veterinario;https://www.ms.gov.br/agropecuaria-e-vida-rural/cadastrar-estabelecimentos-de-comercio-de-produtos-de-uso-veterinario178;12;agropecuaria-e-vida-rural//cadastrar-estabelecimentos-de-comercio-de-produtos-de-uso-veterinario178
Educação e Pesquisa;Solicitacao De Registro De Isbn Vinculado A Fundacao Universidade Estadual De Mato Grosso Do Sul;https://www.ms.gov.br/educacao-e-pesquisa/solicitacao-de-registro-de-isbn-vinculado-a-fundacao-universidade-estadual-de-mato-grosso-do-sul31;12;educacao-e-pesquisa//solicitacao-de-registro-de-isbn-vinculado-a-fundacao-universidade-estadual-de-mato-grosso-do-sul31
Meio Ambiente;Solicitar Pedido De Vista E Copia;https://www.ms.gov.br/meio-ambiente/solicitar-pedido-de-vista-e-copia105;12;meio-ambiente//solicitar-pedido-de-vista-e-copia105
Agropecuária e Vida Rural;Analisar Solos;https://www.ms.gov.br/agropecuaria-e-vida-rural/analisar-solos125;12;agropecuaria-e-vida-rural//analisar-solos125
Arte e Cultura;Realizacao De Eventos;https://www.ms.gov.br/arte-e-cultura/realizacao-de-eventos103;12;arte-e-cultura//realizacao-de-eventos103
Agropecuária e Vida Rural;Programa De Avancos Na Pecuaria De Mato Grosso Do Sul Proape Sub Programa Leitao Vida;https://www.ms.gov.br/agropecuaria-e-vida-rural/programa-de-avancos-na-pecuaria-de-mato-grosso-do-sul-proape-sub-programa-leitao-vida58;12;agropecuaria-e-vida-rural//programa-de-avancos-na-pecuaria-de-mato-grosso-do-sul-proape-sub-programa-leitao-vida58
Empresa, Indústria e Comércio;Alterar O Nome De Consumidor;https://www.ms.gov.br/empresa-industria-e-comercio/alterar-o-nome-de-consumidor70;12;empresa-industria-e-comercio//alterar-o-nome-de-consumidor70
Direitos e Cidadania;Pedido De Acesso A Informacao;https://www.ms.gov.br/direitos-e-cidadania/pedido-de-acesso-a-informacao14;12;direitos-e-cidadania//pedido-de-acesso-a-informacao14
Comunicação e Transparência;Registrar Denuncia;https://www.ms.gov.br/comunicacao-e-transparencia/registrar-denuncia4;11;comunicacao-e-transparencia//registrar-denuncia4
Administração Pública;Solicitar Informacao Ou Encaminhar Manifestacao A Sejusp;https://www.ms.gov.br/administracao-publica/solicitar-informacao-ou-encaminhar-manifestacao-a-sejusp76;11;administracao-publica//solicitar-informacao-ou-encaminhar-manifestacao-a-sejusp76
Ciência e Tecnologia;Solicitar Acesso Ao Wordpress;https://www.ms.gov.br/ciencia-e-tecnologia/solicitar-acesso-ao-wordpress131;11;ciencia-e-tecnologia//solicitar-acesso-ao-wordpress131
Agropecuária e Vida Rural;Cadastrar Colaborador Do Servico De Inspecao Municipalfederal;https://www.ms.gov.br/agropecuaria-e-vida-rural/cadastrar-colaborador-do-servico-de-inspecao-municipalfederal54;11;agropecuaria-e-vida-rural//cadastrar-colaborador-do-servico-de-inspecao-municipalfederal54
Educação e Pesquisa;Consulta Sobre Licitacoes;https://www.ms.gov.br/educacao-e-pesquisa/consulta-sobre-licitacoes88;11;educacao-e-pesquisa//consulta-sobre-licitacoes88
Saúde e Cuidado;Banco De Leite Humano;https://www.ms.gov.br/saude-e-cuidado/banco-de-leite-humano135;11;saude-e-cuidado//banco-de-leite-humano135
Comunicação e Transparência;Pedido De Acesso A Informacao;https://www.ms.gov.br/comunicacao-e-transparencia/pedido-de-acesso-a-informacao143;11;comunicacao-e-transparencia//pedido-de-acesso-a-informacao143
Segurança;176 Projeto Tiro Adaptado Da Pmms;https://www.ms.gov.br/seguranca/176-projeto-tiro-adaptado-da-pmms36;11;seguranca//176-projeto-tiro-adaptado-da-pmms36
Segurança;174 Cematran Centro Educativo De Multiplas Atividades De Transito;https://www.ms.gov.br/seguranca/174-cematran-centro-educativo-de-multiplas-atividades-de-transito190;11;seguranca//174-cematran-centro-educativo-de-multiplas-atividades-de-transito190
Saúde e Cuidado;Telediagnostico Em Teledermatologia;https://www.ms.gov.br/saude-e-cuidado/telediagnostico-em-teledermatologia157;11;saude-e-cuidado//telediagnostico-em-teledermatologia157
Saúde e Cuidado;Doar Medula Ossea;https://www.ms.gov.br/saude-e-cuidado/doar-medula-ossea153;11;saude-e-cuidado//doar-medula-ossea153
Comunicação e Transparência;Pedido De Acesso A Informacao;https://www.ms.gov.br/comunicacao-e-transparencia/pedido-de-acesso-a-informacao97;11;comunicacao-e-transparencia//pedido-de-acesso-a-informacao97
Trabalho, Emprego e Previdência;Exames Periodicos Em Servidores Em Exercicio Na Sejusp Em Desenvolvimento;https://www.ms.gov.br/trabalho-emprego-e-previdencia/exames-periodicos-em-servidores-em-exercicio-na-sejusp-em-desenvolvimento112;11;trabalho-emprego-e-previdencia//exames-periodicos-em-servidores-em-exercicio-na-sejusp-em-desenvolvimento112
Trabalho, Emprego e Previdência;Ouvidoria Da Previdencia;https://www.ms.gov.br/trabalho-emprego-e-previdencia/ouvidoria-da-previdencia119;11;trabalho-emprego-e-previdencia//ouvidoria-da-previdencia119
Trabalho, Emprego e Previdência;Receber Orientacoes Sobre Seus Direitos E Deveres Previdenciario Por Meio Do Proep Programa De Educacao Previdenciaria Do Regime Proprio De Previdencia Social De Ms;https://www.ms.gov.br/trabalho-emprego-e-previdencia/receber-orientacoes-sobre-seus-direitos-e-deveres-previdenciario-por-meio-do-proep-programa-de-educacao-previdenciaria-do-regime-proprio-de-previdencia-social-de-ms137;11;trabalho-emprego-e-previdencia//receber-orientacoes-sobre-seus-direitos-e-deveres-previdenciario-por-meio-do-proep-programa-de-educacao-previdenciaria-do-regime-proprio-de-previdencia-social-de-ms137
Energia;Agencia Virtual;https://www.ms.gov.br/energia/agencia-virtual22;11;energia//agencia-virtual22
Educação e Pesquisa;0334 Proe Divisao De Ingresso Discente Dindproe Vestibular;https://www.ms.gov.br/educacao-e-pesquisa/0334-proe-divisao-de-ingresso-discente-dindproe-vestibular141;11;educacao-e-pesquisa//0334-proe-divisao-de-ingresso-discente-dindproe-vestibular141
Administração Pública;Protocolo Geral;https://www.ms.gov.br/administracao-publica/protocolo-geral93;11;administracao-publica//protocolo-geral93
Segurança;Solicitar Suporte Tecnico Relacionado A Seguranca Contra Incendio E Panico;https://www.ms.gov.br/seguranca/solicitar-suporte-tecnico-relacionado-a-seguranca-contra-incendio-e-panico5;11;seguranca//solicitar-suporte-tecnico-relacionado-a-seguranca-contra-incendio-e-panico5
Segurança;Apoio Tecnico No Ambito Do Plano P2R2 Produtos Quimicos Perigosos;https://www.ms.gov.br/seguranca/apoio-tecnico-no-ambito-do-plano-p2r2-produtos-quimicos-perigosos63;11;seguranca//apoio-tecnico-no-ambito-do-plano-p2r2-produtos-quimicos-perigosos63
Comunicação e Transparência;Pedido De Acesso A Informacao;https://www.ms.gov.br/comunicacao-e-transparencia/pedido-de-acesso-a-informacao102;11;comunicacao-e-transparencia//pedido-de-acesso-a-informacao102
Comunicação e Transparência;Fazer Um Pedido De Informacao;https://www.ms.gov.br/comunicacao-e-transparencia/fazer-um-pedido-de-informacao109;11;comunicacao-e-transparencia//fazer-um-pedido-de-informacao109
Esporte e Lazer;Programa De Formacao E Capacitacao Em Educacao Fisica Atividade Fisica Para A Saude Desporto Paradesporto Arbritagem E Lazer;https://www.ms.gov.br/esporte-e-lazer/programa-de-formacao-e-capacitacao-em-educacao-fisica-atividade-fisica-para-a-saude-desporto-paradesporto-arbritagem-e-lazer100;11;esporte-e-lazer//programa-de-formacao-e-capacitacao-em-educacao-fisica-atividade-fisica-para-a-saude-desporto-paradesporto-arbritagem-e-lazer100
Agropecuária e Vida Rural;Cadastro De Area De Producao Comercial De Citros;https://www.ms.gov.br/agropecuaria-e-vida-rural/cadastro-de-area-de-producao-comercial-de-citros79;10;agropecuaria-e-vida-rural//cadastro-de-area-de-producao-comercial-de-citros79
Educação e Pesquisa;Oferta Da Educacao De Jovens E Adultos Aos Privados De Liberdade;https://www.ms.gov.br/educacao-e-pesquisa/oferta-da-educacao-de-jovens-e-adultos-aos-privados-de-liberdade119;10;educacao-e-pesquisa//oferta-da-educacao-de-jovens-e-adultos-aos-privados-de-liberdade119
Agropecuária e Vida Rural;Consultar Eventos Com Aglomeracao De Animais;https://www.ms.gov.br/agropecuaria-e-vida-rural/consultar-eventos-com-aglomeracao-de-animais165;10;agropecuaria-e-vida-rural//consultar-eventos-com-aglomeracao-de-animais165
Administração Pública;Programa Ms Ativo;https://www.ms.gov.br/administracao-publica/programa-ms-ativo34;10;administracao-publica//programa-ms-ativo34
Educação e Pesquisa;Educacao Infantil;https://www.ms.gov.br/educacao-e-pesquisa/educacao-infantil46;10;educacao-e-pesquisa//educacao-infantil46
Administração Pública;Solicitar Peticionamento Processual Sistema E Ms;https://www.ms.gov.br/administracao-publica/solicitar-peticionamento-processual-sistema-e-ms79;10;administracao-publica//solicitar-peticionamento-processual-sistema-e-ms79
Esporte e Lazer;Federacoes Clubes E Associacoes De Ms;https://www.ms.gov.br/esporte-e-lazer/federacoes-clubes-e-associacoes-de-ms195;10;esporte-e-lazer//federacoes-clubes-e-associacoes-de-ms195
Educação e Pesquisa;Programa Institucional De Bolsas Aos Alunos Da Pos Graduacao Pibap;https://www.ms.gov.br/educacao-e-pesquisa/programa-institucional-de-bolsas-aos-alunos-da-pos-graduacao-pibap81;10;educacao-e-pesquisa//programa-institucional-de-bolsas-aos-alunos-da-pos-graduacao-pibap81
Saúde e Cuidado;Servico De Cardiodiagnostico;https://www.ms.gov.br/saude-e-cuidado/servico-de-cardiodiagnostico53;10;saude-e-cuidado//servico-de-cardiodiagnostico53
Segurança;02 Radio Patrulha Protecao De Vidas Nas Cidades;https://www.ms.gov.br/seguranca/02-radio-patrulha-protecao-de-vidas-nas-cidades67;10;seguranca//02-radio-patrulha-protecao-de-vidas-nas-cidades67
Saúde e Cuidado;Servico De Hemodinamica;https://www.ms.gov.br/saude-e-cuidado/servico-de-hemodinamica25;10;saude-e-cuidado//servico-de-hemodinamica25
Educação e Pesquisa;113 Unidade Universitaria De Mundo Novo Laboratorio De Informatica;https://www.ms.gov.br/educacao-e-pesquisa/113-unidade-universitaria-de-mundo-novo-laboratorio-de-informatica173;10;educacao-e-pesquisa//113-unidade-universitaria-de-mundo-novo-laboratorio-de-informatica173
Esporte e Lazer;Lazer Nas Cidades;https://www.ms.gov.br/esporte-e-lazer/lazer-nas-cidades52;10;esporte-e-lazer//lazer-nas-cidades52
Segurança;Apoio Tecnico Aos Municipios Na Ocorrencia De Desastres;https://www.ms.gov.br/seguranca/apoio-tecnico-aos-municipios-na-ocorrencia-de-desastres6;10;seguranca//apoio-tecnico-aos-municipios-na-ocorrencia-de-desastres6
Segurança;Solicitar Atendimento Pre Hospitalar;https://www.ms.gov.br/seguranca/solicitar-atendimento-pre-hospitalar87;10;seguranca//solicitar-atendimento-pre-hospitalar87
Trabalho, Emprego e Previdência;Comunicar Obito De Servidor Ou Pensionista;https://www.ms.gov.br/trabalho-emprego-e-previdencia/comunicar-obito-de-servidor-ou-pensionista27;10;trabalho-emprego-e-previdencia//comunicar-obito-de-servidor-ou-pensionista27
Saúde e Cuidado;Servico De Capelania Hospitalar;https://www.ms.gov.br/saude-e-cuidado/servico-de-capelania-hospitalar40;10;saude-e-cuidado//servico-de-capelania-hospitalar40
Saúde e Cuidado;Solicitar Orientacao Do Profissional Farmaceutico;https://www.ms.gov.br/saude-e-cuidado/solicitar-orientacao-do-profissional-farmaceutico130;10;saude-e-cuidado//solicitar-orientacao-do-profissional-farmaceutico130
Segurança;Combate A Incendios Urbanos E Rurais;https://www.ms.gov.br/seguranca/combate-a-incendios-urbanos-e-rurais173;10;seguranca//combate-a-incendios-urbanos-e-rurais173
Comunicação e Transparência;Pedido De Acesso A Informacao;https://www.ms.gov.br/comunicacao-e-transparencia/pedido-de-acesso-a-informacao139;10;comunicacao-e-transparencia//pedido-de-acesso-a-informacao139
Assistência Social;Residencias Inclusivas Regionalizadas Para Adultos Com Deficiencia;https://www.ms.gov.br/assistencia-social/residencias-inclusivas-regionalizadas-para-adultos-com-deficiencia68;10;assistencia-social//residencias-inclusivas-regionalizadas-para-adultos-com-deficiencia68
Agropecuária e Vida Rural;Autorizacao De Aquisicaoimportacao De Mudas Citricas Para Estabelecimentos Registrados Na Iagro Como Comerciante De Mudas Citricas;https://www.ms.gov.br/agropecuaria-e-vida-rural/autorizacao-de-aquisicaoimportacao-de-mudas-citricas-para-estabelecimentos-registrados-na-iagro-como-comerciante-de-mudas-citricas135;10;agropecuaria-e-vida-rural//autorizacao-de-aquisicaoimportacao-de-mudas-citricas-para-estabelecimentos-registrados-na-iagro-como-comerciante-de-mudas-citricas135
Agropecuária e Vida Rural;Cadastramento De Area De Plantio De Soja;https://www.ms.gov.br/agropecuaria-e-vida-rural/cadastramento-de-area-de-plantio-de-soja177;10;agropecuaria-e-vida-rural//cadastramento-de-area-de-plantio-de-soja177
Ciência e Tecnologia;Conceder Acesso Ao Matomo;https://www.ms.gov.br/ciencia-e-tecnologia/conceder-acesso-ao-matomo70;10;ciencia-e-tecnologia//conceder-acesso-ao-matomo70
Ciência e Tecnologia;Solicitar Primeiro Acesso Aos Canais Institucionais Oficiais;https://www.ms.gov.br/ciencia-e-tecnologia/solicitar-primeiro-acesso-aos-canais-institucionais-oficiais9;10;ciencia-e-tecnologia//solicitar-primeiro-acesso-aos-canais-institucionais-oficiais9
Empresa, Indústria e Comércio;Consultar Tabela De Precos;https://www.ms.gov.br/empresa-industria-e-comercio/consultar-tabela-de-precos56;10;empresa-industria-e-comercio//consultar-tabela-de-precos56
Agropecuária e Vida Rural;Declarar Semestralmente As Condicoes Fitossanitarias Da Area De Citros Cadastrada;https://www.ms.gov.br/agropecuaria-e-vida-rural/declarar-semestralmente-as-condicoes-fitossanitarias-da-area-de-citros-cadastrada16;10;agropecuaria-e-vida-rural//declarar-semestralmente-as-condicoes-fitossanitarias-da-area-de-citros-cadastrada16
Educação e Pesquisa;Credenciamento E Autorizacao De Instituicoes Publicas E Privadas Para A Oferta De Cursos De Ensino Medio Educacao Profissional Tecnica De Nivel Medio E Educacao De Jovens E Adultos Nas Etapas Do Ensin;https://www.ms.gov.br/educacao-e-pesquisa/credenciamento-e-autorizacao-de-instituicoes-publicas-e-privadas-para-a-oferta-de-cursos-de-ensino-medio-educacao-profissional-tecnica-de-nivel-medio-e-educacao-de-jovens-e-adultos-nas-etapas-do-ensin;10;educacao-e-pesquisa/credenciamento-e-autorizacao-de-instituicoes-publicas-e-privadas-para-a-oferta-de-cursos-de-ensino-medio-educacao-profissional-tecnica-de-nivel-medio-e-educacao-de-jovens-e-adultos-nas-etapas-do-ensin
Saúde e Cuidado;Captacao De Orgaos E Tecidos Para Transplante;https://www.ms.gov.br/saude-e-cuidado/captacao-de-orgaos-e-tecidos-para-transplante95;10;saude-e-cuidado//captacao-de-orgaos-e-tecidos-para-transplante95
Saúde e Cuidado;Cursos De Educacao Profissional Na Area Da Saude;https://www.ms.gov.br/saude-e-cuidado/cursos-de-educacao-profissional-na-area-da-saude149;10;saude-e-cuidado//cursos-de-educacao-profissional-na-area-da-saude149
Trânsito e Transportes;Cidade Escola De Transito Detranzinho;https://www.ms.gov.br/transito-e-transportes/cidade-escola-de-transito-detranzinho113;10;transito-e-transportes//cidade-escola-de-transito-detranzinho113
Turismo;Orientacao Tecnica Para O Desenvolvimento Do Setor De Turismo Em Mato Grosso Do Sul;https://www.ms.gov.br/turismo/orientacao-tecnica-para-o-desenvolvimento-do-setor-de-turismo-em-mato-grosso-do-sul157;10;turismo//orientacao-tecnica-para-o-desenvolvimento-do-setor-de-turismo-em-mato-grosso-do-sul157
Ciência e Tecnologia;Conceder Acesso Ao Gitlabs;https://www.ms.gov.br/ciencia-e-tecnologia/conceder-acesso-ao-gitlabs17;9;ciencia-e-tecnologia//conceder-acesso-ao-gitlabs17
Educação e Pesquisa;Identificar As Instituicoes De Ensino Que Oferecem Descontos E Gerar Documentos Para Uso;https://www.ms.gov.br/educacao-e-pesquisa/identificar-as-instituicoes-de-ensino-que-oferecem-descontos-e-gerar-documentos-para-uso38;9;educacao-e-pesquisa//identificar-as-instituicoes-de-ensino-que-oferecem-descontos-e-gerar-documentos-para-uso38
Empresa, Indústria e Comércio;Atendimento A Denuncias Sobre Locais Eou Produtos E Subprodutos Clandestinos De Origem Animal;https://www.ms.gov.br/empresa-industria-e-comercio/atendimento-a-denuncias-sobre-locais-eou-produtos-e-subprodutos-clandestinos-de-origem-animal23;9;empresa-industria-e-comercio//atendimento-a-denuncias-sobre-locais-eou-produtos-e-subprodutos-clandestinos-de-origem-animal23
Ciência e Tecnologia;Concessao De Bolsas De Estudo;https://www.ms.gov.br/ciencia-e-tecnologia/concessao-de-bolsas-de-estudo159;9;ciencia-e-tecnologia//concessao-de-bolsas-de-estudo159
Educação e Pesquisa;Educacao Especial;https://www.ms.gov.br/educacao-e-pesquisa/educacao-especial57;9;educacao-e-pesquisa//educacao-especial57
Ciência e Tecnologia;Solicitar Treinamento Do Wordpress;https://www.ms.gov.br/ciencia-e-tecnologia/solicitar-treinamento-do-wordpress70;9;ciencia-e-tecnologia//solicitar-treinamento-do-wordpress70
Comunicação e Transparência;Acessar Portal Da Transparencia Da Msgas;https://www.ms.gov.br/comunicacao-e-transparencia/acessar-portal-da-transparencia-da-msgas141;9;comunicacao-e-transparencia//acessar-portal-da-transparencia-da-msgas141
Ciência e Tecnologia;Solicitar Aumento De Quota De E Mail Oficial;https://www.ms.gov.br/ciencia-e-tecnologia/solicitar-aumento-de-quota-de-e-mail-oficial87;9;ciencia-e-tecnologia//solicitar-aumento-de-quota-de-e-mail-oficial87
Educação e Pesquisa;Atualizacao De Dados Cadastrais Do Academico;https://www.ms.gov.br/educacao-e-pesquisa/atualizacao-de-dados-cadastrais-do-academico173;9;educacao-e-pesquisa//atualizacao-de-dados-cadastrais-do-academico173
Trabalho, Emprego e Previdência;Avaliacao Pericial Fora Do Local De Lotacao Ou De Exercicio Pericia Em Transitosolicitar Avaliacao Pericial Fora Do Local De Lotacao Ou De Exercicio Pericia Em Transito;https://www.ms.gov.br/trabalho-emprego-e-previdencia/avaliacao-pericial-fora-do-local-de-lotacao-ou-de-exercicio-pericia-em-transitosolicitar-avaliacao-pericial-fora-do-local-de-lotacao-ou-de-exercicio-pericia-em-transito46;9;trabalho-emprego-e-previdencia//avaliacao-pericial-fora-do-local-de-lotacao-ou-de-exercicio-pericia-em-transitosolicitar-avaliacao-pericial-fora-do-local-de-lotacao-ou-de-exercicio-pericia-em-transito46
Educação e Pesquisa;2A Via Do Diploma;https://www.ms.gov.br/educacao-e-pesquisa/2a-via-do-diploma58;9;educacao-e-pesquisa//2a-via-do-diploma58
Educação e Pesquisa;077 Sreddra Expedicao De Certificados E Diplomas;https://www.ms.gov.br/educacao-e-pesquisa/077-sreddra-expedicao-de-certificados-e-diplomas68;9;educacao-e-pesquisa//077-sreddra-expedicao-de-certificados-e-diplomas68
Trabalho, Emprego e Previdência;Exames Medicos Admissionais Em Desenvolvimento;https://www.ms.gov.br/trabalho-emprego-e-previdencia/exames-medicos-admissionais-em-desenvolvimento128;9;trabalho-emprego-e-previdencia//exames-medicos-admissionais-em-desenvolvimento128
Trabalho, Emprego e Previdência;Pagar O Recolhimento Previdenciario Servidor Licenciado Para Acompanhamento De Conjuge;https://www.ms.gov.br/trabalho-emprego-e-previdencia/pagar-o-recolhimento-previdenciario-servidor-licenciado-para-acompanhamento-de-conjuge154;9;trabalho-emprego-e-previdencia//pagar-o-recolhimento-previdenciario-servidor-licenciado-para-acompanhamento-de-conjuge154
Energia;Plicativo Msgas Acompanhamento Do Consumo Emissao De 2A Via De Fatura;https://www.ms.gov.br/energia/plicativo-msgas-acompanhamento-do-consumo-emissao-de-2a-via-de-fatura116;9;energia/plicativo-msgas-acompanhamento-do-consumo-emissao-de-2a-via-de-fatura116//imprimir
Trânsito e Transportes;Solicitar Vistoria De Veiculo De Passageiros Intermunicipal Na Modalidade Fretamento;https://www.ms.gov.br/transito-e-transportes/solicitar-vistoria-de-veiculo-de-passageiros-intermunicipal-na-modalidade-fretamento82;9;transito-e-transportes//solicitar-vistoria-de-veiculo-de-passageiros-intermunicipal-na-modalidade-fretamento82
Trabalho, Emprego e Previdência;Solicitar Avaliacao Pericial Por Motivo De Doenca Em Pessoa Da Familia;https://www.ms.gov.br/trabalho-emprego-e-previdencia/solicitar-avaliacao-pericial-por-motivo-de-doenca-em-pessoa-da-familia190;9;trabalho-emprego-e-previdencia//solicitar-avaliacao-pericial-por-motivo-de-doenca-em-pessoa-da-familia190
Saúde e Cuidado;Solicitacao De Consulta;https://www.ms.gov.br/saude-e-cuidado/solicitacao-de-consulta94;9;saude-e-cuidado//solicitacao-de-consulta94
Ciência e Tecnologia;Solicitar Acesso Aos Sistemas Institucionais Mantidos Pela Setdig;https://www.ms.gov.br/ciencia-e-tecnologia/solicitar-acesso-aos-sistemas-institucionais-mantidos-pela-setdig91;9;ciencia-e-tecnologia//solicitar-acesso-aos-sistemas-institucionais-mantidos-pela-setdig91
Empresa, Indústria e Comércio;Acessar Aos Dados Do Portal Da Transparencia;https://www.ms.gov.br/empresa-industria-e-comercio/acessar-aos-dados-do-portal-da-transparencia176;9;empresa-industria-e-comercio//acessar-aos-dados-do-portal-da-transparencia176
Turismo;Eventos Promocionais Do Turismo;https://www.ms.gov.br/turismo/eventos-promocionais-do-turismo60;9;turismo//eventos-promocionais-do-turismo60
Educação e Pesquisa;Realizar Cursos De Aperfeicoamento Carga Horaria Acima De 120 Horas;https://www.ms.gov.br/educacao-e-pesquisa/realizar-cursos-de-aperfeicoamento-carga-horaria-acima-de-120-horas150;9;educacao-e-pesquisa//realizar-cursos-de-aperfeicoamento-carga-horaria-acima-de-120-horas150
Segurança;Solicitar Transferencia De Custodiado39?Utm_Content=Link_In_Bio;https://www.ms.gov.br/seguranca/solicitar-transferencia-de-custodiado39?utm_content=link_in_bio;9;seguranca//solicitar-transferencia-de-custodiado39?utm_content=link_in_bio
Educação e Pesquisa;Acessar Gratuitamente Programas Da Tv Educativa Portal Da Educativa;https://www.ms.gov.br/educacao-e-pesquisa/acessar-gratuitamente-programas-da-tv-educativa-portal-da-educativa175;8;educacao-e-pesquisa//acessar-gratuitamente-programas-da-tv-educativa-portal-da-educativa175
Comunicação e Transparência;Fazer Pedido De Acesso A Informacao;https://www.ms.gov.br/comunicacao-e-transparencia/fazer-pedido-de-acesso-a-informacao178;8;comunicacao-e-transparencia//fazer-pedido-de-acesso-a-informacao178
Administração Pública;Solicitar Pedido De Vista E Copia;https://www.ms.gov.br/administracao-publica/solicitar-pedido-de-vista-e-copia53;8;administracao-publica//solicitar-pedido-de-vista-e-copia53
Empresa, Indústria e Comércio;Registro De Produtos No Sie;https://www.ms.gov.br/empresa-industria-e-comercio/registro-de-produtos-no-sie4;8;empresa-industria-e-comercio//registro-de-produtos-no-sie4
Ciência e Tecnologia;Solicitar Acesso Ao Grafana;https://www.ms.gov.br/ciencia-e-tecnologia/solicitar-acesso-ao-grafana21;8;ciencia-e-tecnologia//solicitar-acesso-ao-grafana21
Esporte e Lazer;Federacoes E Ligas Inexigibilidade;https://www.ms.gov.br/esporte-e-lazer/federacoes-e-ligas-inexigibilidade195;8;esporte-e-lazer//federacoes-e-ligas-inexigibilidade195
Comunicação e Transparência;Fazer Pedido De Acesso A Informacao;https://www.ms.gov.br/comunicacao-e-transparencia/fazer-pedido-de-acesso-a-informacao134;8;comunicacao-e-transparencia//fazer-pedido-de-acesso-a-informacao134
Educação e Pesquisa;141 Unidade Universitaria De Paranaiba Nucleo De Praticas E Assistencia Juridica Curso Direito;https://www.ms.gov.br/educacao-e-pesquisa/141-unidade-universitaria-de-paranaiba-nucleo-de-praticas-e-assistencia-juridica-curso-direito127;8;educacao-e-pesquisa//141-unidade-universitaria-de-paranaiba-nucleo-de-praticas-e-assistencia-juridica-curso-direito127
Energia;Solicitar Religacao De Fornecimento De Gas Natural Em Ate 4 Horas;https://www.ms.gov.br/energia/solicitar-religacao-de-fornecimento-de-gas-natural-em-ate-4-horas109;8;energia//solicitar-religacao-de-fornecimento-de-gas-natural-em-ate-4-horas109
