Categoria;Nome do Serviço;Link;Visitas;URL_Original
Administração Pública;Apoio A Projetos Culturais Por Meio De Editais Publicos;https://www.ms.gov.br/administracao-publica/apoio-a-projetos-culturais-por-meio-de-editais-publicos23;201;administracao-publica/apoio-a-projetos-culturais-por-meio-de-editais-publicos23
Empresa, Indústria e Comércio;Validar Documentos;https://www.ms.gov.br/empresa-industria-e-comercio/validar-documentos163;201;empresa-industria-e-comercio//validar-documentos163
Agropecuária e Vida Rural;Nota Fiscal De Produtor Serie Especial Nfpse Desbloqueio Para Impressao De Formulario;https://www.ms.gov.br/agropecuaria-e-vida-rural/nota-fiscal-de-produtor-serie-especial-nfpse-desbloqueio-para-impressao-de-formulario38;201;agropecuaria-e-vida-rural/nota-fiscal-de-produtor-serie-especial-nfpse-desbloqueio-para-impressao-de-formulario38
Empresa, Indústria e Comércio;Autorizacao Especifica Credito Outorgado Nas Operacoes Internas E Interestaduais Com Acucar Pelos Fabricantes De Acucar;https://www.ms.gov.br/empresa-industria-e-comercio/autorizacao-especifica-credito-outorgado-nas-operacoes-internas-e-interestaduais-com-acucar-pelos-fabricantes-de-acucar145;199;empresa-industria-e-comercio/autorizacao-especifica-credito-outorgado-nas-operacoes-internas-e-interestaduais-com-acucar-pelos-fabricantes-de-acucar145
Meio Ambiente;Outorga De Direito De Uso De Recursos Hidricos E Cadastro Estadual De Usuario De Recursos Hidricos Ceurh;https://www.ms.gov.br/meio-ambiente/outorga-de-direito-de-uso-de-recursos-hidricos-e-cadastro-estadual-de-usuario-de-recursos-hidricos-ceurh144;198;meio-ambiente/outorga-de-direito-de-uso-de-recursos-hidricos-e-cadastro-estadual-de-usuario-de-recursos-hidricos-ceurh144
Finanças e Impostos;Denuncia Espontanea Solicitacao;https://www.ms.gov.br/financas-e-impostos/denuncia-espontanea-solicitacao185;198;financas-e-impostos/denuncia-espontanea-solicitacao185
Trânsito e Transportes;Solicitar Agendamento De Examereexame Teorico Tecnico Renovacao Cnh;https://www.ms.gov.br/transito-e-transportes/solicitar-agendamento-de-examereexame-teorico-tecnico-renovacao-cnh85;198;transito-e-transportes//solicitar-agendamento-de-examereexame-teorico-tecnico-renovacao-cnh85
Direitos e Cidadania;Solicitar Fiscalizacao Proconms;https://www.ms.gov.br/direitos-e-cidadania/solicitar-fiscalizacao-proconms179;198;direitos-e-cidadania//solicitar-fiscalizacao-proconms179
Empresa, Indústria e Comércio;Cadastro Do Comercio Industria E Servicos Ccis Inscricao De Frigorificos;https://www.ms.gov.br/empresa-industria-e-comercio/cadastro-do-comercio-industria-e-servicos-ccis-inscricao-de-frigorificos112;197;empresa-industria-e-comercio/cadastro-do-comercio-industria-e-servicos-ccis-inscricao-de-frigorificos112
Ciência e Tecnologia;Criar Senha De Carteira De Pesca;https://www.ms.gov.br/ciencia-e-tecnologia/criar-senha-de-carteira-de-pesca171;196;ciencia-e-tecnologia//criar-senha-de-carteira-de-pesca171
Agropecuária e Vida Rural;Nota Fiscal De Produtor Serie Especial Nfpse Prestacao De Contas De Notas Emitidas E Nao Baixadas Automaticamente Ou Canceladas;https://www.ms.gov.br/agropecuaria-e-vida-rural/nota-fiscal-de-produtor-serie-especial-nfpse-prestacao-de-contas-de-notas-emitidas-e-nao-baixadas-automaticamente-ou-canceladas153;196;agropecuaria-e-vida-rural/nota-fiscal-de-produtor-serie-especial-nfpse-prestacao-de-contas-de-notas-emitidas-e-nao-baixadas-automaticamente-ou-canceladas153
Empresa, Indústria e Comércio;Autorizacao Para Impressao De Documentos Fiscais Aidf Cancelamento Do Pedido;https://www.ms.gov.br/empresa-industria-e-comercio/autorizacao-para-impressao-de-documentos-fiscais-aidf-cancelamento-do-pedido199;194;empresa-industria-e-comercio/autorizacao-para-impressao-de-documentos-fiscais-aidf-cancelamento-do-pedido199
Finanças e Impostos;Escrituracao Fiscal Digital Efd Entrega;https://www.ms.gov.br/financas-e-impostos/escrituracao-fiscal-digital-efd-entrega44;194;financas-e-impostos/escrituracao-fiscal-digital-efd-entrega44
Finanças e Impostos;Ipva Isencao 2022 Decreto No ;https://www.ms.gov.br/financas-e-impostos/ipva-isencao-2022-decreto-no-157032021155;194;financas-e-impostos/ipva-isencao-2022-decreto-no-157032021155
Saúde e Cuidado;Consultar Receita Medica Digital;https://www.ms.gov.br/saude-e-cuidado/consultar-receita-medica-digital136;194;saude-e-cuidado//consultar-receita-medica-digital136
Educação e Pesquisa;Solicitar Consulta E Emprestimo De Publicacoes Periodicos Livros E Obras Raras Do Acervo Da Biblioteca Estadual;https://www.ms.gov.br/educacao-e-pesquisa/solicitar-consulta-e-emprestimo-de-publicacoes-periodicos-livros-e-obras-raras-do-acervo-da-biblioteca-estadual14;193;educacao-e-pesquisa//solicitar-consulta-e-emprestimo-de-publicacoes-periodicos-livros-e-obras-raras-do-acervo-da-biblioteca-estadual14
Empresa, Indústria e Comércio;Autorizacao Para Impressao De Documentos Fiscais Aidf Comprovacao Intempestiva;https://www.ms.gov.br/empresa-industria-e-comercio/autorizacao-para-impressao-de-documentos-fiscais-aidf-comprovacao-intempestiva112;193;empresa-industria-e-comercio/autorizacao-para-impressao-de-documentos-fiscais-aidf-comprovacao-intempestiva112
Administração Pública;Pedido De Acesso A Processo Administrativo Disciplinar Ou A Sindicancia No Ambito Da Corregedoria Da Sas;https://www.ms.gov.br/administracao-publica/pedido-de-acesso-a-processo-administrativo-disciplinar-ou-a-sindicancia-no-ambito-da-corregedoria-da-sas40;191;administracao-publica/pedido-de-acesso-a-processo-administrativo-disciplinar-ou-a-sindicancia-no-ambito-da-corregedoria-da-sas40
Comunicação e Transparência;Registrar Denuncia;https://www.ms.gov.br/comunicacao-e-transparencia/registrar-denuncia34;189;comunicacao-e-transparencia/registrar-denuncia34
Agropecuária e Vida Rural;Cadastro Da Agropecuaria Cap Suspensao Temporaria Da Inscricao Estadual A Pedido Do Contribuinte E Sua Prorrogacao;https://www.ms.gov.br/agropecuaria-e-vida-rural/cadastro-da-agropecuaria-cap-suspensao-temporaria-da-inscricao-estadual-a-pedido-do-contribuinte-e-sua-prorrogacao173;188;agropecuaria-e-vida-rural/cadastro-da-agropecuaria-cap-suspensao-temporaria-da-inscricao-estadual-a-pedido-do-contribuinte-e-sua-prorrogacao173
Comunicação e Transparência;Solicitar Credenciamento De Instrucao De Assistencia Tecnica E Extesao Ruralater No Sistema De Informacao De Assistencia Tecnicasiater;https://www.ms.gov.br/comunicacao-e-transparencia/solicitar-credenciamento-de-instrucao-de-assistencia-tecnica-e-extesao-ruralater-no-sistema-de-informacao-de-assistencia-tecnicasiater111;188;comunicacao-e-transparencia/solicitar-credenciamento-de-instrucao-de-assistencia-tecnica-e-extesao-ruralater-no-sistema-de-informacao-de-assistencia-tecnicasiater111
Empresa, Indústria e Comércio;Guia Nacional De Informacao E Apuracao Do Icms Substituicao Tributaria Gia St Baixa De Notificacao;https://www.ms.gov.br/empresa-industria-e-comercio/guia-nacional-de-informacao-e-apuracao-do-icms-substituicao-tributaria-gia-st-baixa-de-notificacao182;182;empresa-industria-e-comercio/guia-nacional-de-informacao-e-apuracao-do-icms-substituicao-tributaria-gia-st-baixa-de-notificacao182
Comunicação e Transparência;Registrar Reclamacao Solicitacao Sugestao E Elogio;https://www.ms.gov.br/comunicacao-e-transparencia/registrar-reclamacao-solicitacao-sugestao-e-elogio122;182;comunicacao-e-transparencia/registrar-reclamacao-solicitacao-sugestao-e-elogio122
Empresa, Indústria e Comércio;Icms Importacao Inclusao De Item Na Listagem De Materia Primamercadoria Para Fins De Diferimento Do Imposto Beneficio Previsto Em Termo De Acordo;https://www.ms.gov.br/empresa-industria-e-comercio/icms-importacao-inclusao-de-item-na-listagem-de-materia-primamercadoria-para-fins-de-diferimento-do-imposto-beneficio-previsto-em-termo-de-acordo68;181;empresa-industria-e-comercio/icms-importacao-inclusao-de-item-na-listagem-de-materia-primamercadoria-para-fins-de-diferimento-do-imposto-beneficio-previsto-em-termo-de-acordo68
Trabalho, Emprego e Previdência;Anunciar Vagas De Emprego Atraves De Plataforma;https://www.ms.gov.br/trabalho-emprego-e-previdencia/anunciar-vagas-de-emprego-atraves-de-plataforma51;180;trabalho-emprego-e-previdencia/anunciar-vagas-de-emprego-atraves-de-plataforma51
Finanças e Impostos;Autorizacao Especifica Dilatacao Do Prazo Para Pagamento Semanal Do Icms Devido Nas Saidas Interestaduais Art 72 V Do Anexo V Ao Ricms;https://www.ms.gov.br/financas-e-impostos/autorizacao-especifica-dilatacao-do-prazo-para-pagamento-semanal-do-icms-devido-nas-saidas-interestaduais-art-72-v-do-anexo-v-ao-ricms188;178;financas-e-impostos/autorizacao-especifica-dilatacao-do-prazo-para-pagamento-semanal-do-icms-devido-nas-saidas-interestaduais-art-72-v-do-anexo-v-ao-ricms188
Meio Ambiente;Licenciamento Ambiental Para Supressao Vegetal;https://www.ms.gov.br/meio-ambiente/licenciamento-ambiental-para-supressao-vegetal180;177;meio-ambiente/licenciamento-ambiental-para-supressao-vegetal180
Finanças e Impostos;Pedido De Parcelamento De Debito Ppd De Ipva Exercicios Anteriores Autoparcelamento;https://www.ms.gov.br/financas-e-impostos/pedido-de-parcelamento-de-debito-ppd-de-ipva-exercicios-anteriores-autoparcelamento38;176;financas-e-impostos/pedido-de-parcelamento-de-debito-ppd-de-ipva-exercicios-anteriores-autoparcelamento38
Agropecuária e Vida Rural;Nota Fiscal De Produtor Serie Especial Nfpse Impressao De Formulario;https://www.ms.gov.br/agropecuaria-e-vida-rural/nota-fiscal-de-produtor-serie-especial-nfpse-impressao-de-formulario51;174;agropecuaria-e-vida-rural/nota-fiscal-de-produtor-serie-especial-nfpse-impressao-de-formulario51
Meio Ambiente;Corte Isolado De Arvores Nativas Cani;https://www.ms.gov.br/meio-ambiente/corte-isolado-de-arvores-nativas-cani195;174;meio-ambiente/corte-isolado-de-arvores-nativas-cani195
Agropecuária e Vida Rural;Cadastro Da Agropecuaria Cap Inscricao De Produtor Rural Em Terras Indigenas;https://www.ms.gov.br/agropecuaria-e-vida-rural/cadastro-da-agropecuaria-cap-inscricao-de-produtor-rural-em-terras-indigenas192;174;agropecuaria-e-vida-rural/cadastro-da-agropecuaria-cap-inscricao-de-produtor-rural-em-terras-indigenas192
Agropecuária e Vida Rural;Nota Fiscal De Produtor Eletronica Nfp E Cancelamento Dentro Do Prazo De 24H;https://www.ms.gov.br/agropecuaria-e-vida-rural/nota-fiscal-de-produtor-eletronica-nfp-e-cancelamento-dentro-do-prazo-de-24h90;174;agropecuaria-e-vida-rural/nota-fiscal-de-produtor-eletronica-nfp-e-cancelamento-dentro-do-prazo-de-24h90
Finanças e Impostos;Icms Diferencial De Aliquotas Dispensa Da Cobranca Na Aquisicao De Maquinario Por Industrial Ou Produtor Rural;https://www.ms.gov.br/financas-e-impostos/icms-diferencial-de-aliquotas-dispensa-da-cobranca-na-aquisicao-de-maquinario-por-industrial-ou-produtor-rural84;174;financas-e-impostos/icms-diferencial-de-aliquotas-dispensa-da-cobranca-na-aquisicao-de-maquinario-por-industrial-ou-produtor-rural84
Finanças e Impostos;Autorizacao Especifica Aquisicao De Produtos Agricolas Por Industria Exceto Fabricante De Racao Animal Com Diferimento Do Lancamento E Do Pagamento Do Icms Na Operacao Interna;https://www.ms.gov.br/financas-e-impostos/autorizacao-especifica-aquisicao-de-produtos-agricolas-por-industria-exceto-fabricante-de-racao-animal-com-diferimento-do-lancamento-e-do-pagamento-do-icms-na-operacao-interna28;172;financas-e-impostos/autorizacao-especifica-aquisicao-de-produtos-agricolas-por-industria-exceto-fabricante-de-racao-animal-com-diferimento-do-lancamento-e-do-pagamento-do-icms-na-operacao-interna28
Empresa, Indústria e Comércio;Registrar Abertura De Empresa;https://www.ms.gov.br/empresa-industria-e-comercio/registrar-abertura-de-empresa14;171;empresa-industria-e-comercio//registrar-abertura-de-empresa14
Direitos e Cidadania;Solicitacao De Atendimento Aos Consumidores Endividadossuperendividados;https://www.ms.gov.br/direitos-e-cidadania/solicitacao-de-atendimento-aos-consumidores-endividadossuperendividados101;171;direitos-e-cidadania//solicitacao-de-atendimento-aos-consumidores-endividadossuperendividados101
Agropecuária e Vida Rural;Nota Fiscal De Produtor Eletronica Nfp E Cancelamento Extemporaneo Nao Autorizado On Line;https://www.ms.gov.br/agropecuaria-e-vida-rural/nota-fiscal-de-produtor-eletronica-nfp-e-cancelamento-extemporaneo-nao-autorizado-on-line80;170;agropecuaria-e-vida-rural/nota-fiscal-de-produtor-eletronica-nfp-e-cancelamento-extemporaneo-nao-autorizado-on-line80
Empresa, Indústria e Comércio;Icms Homologacao De Transferencia De Credito Realizada Por Distribuidora De Combustiveis;https://www.ms.gov.br/empresa-industria-e-comercio/icms-homologacao-de-transferencia-de-credito-realizada-por-distribuidora-de-combustiveis70;170;empresa-industria-e-comercio/icms-homologacao-de-transferencia-de-credito-realizada-por-distribuidora-de-combustiveis70
Administração Pública;Selecao E Ingresso De Pessoal Por Meio De Concursos Publicos Processos Seletivos Internos E Processos Seletivos Simplificados;https://www.ms.gov.br/administracao-publica/selecao-e-ingresso-de-pessoal-por-meio-de-concursos-publicos-processos-seletivos-internos-e-processos-seletivos-simplificados149;169;administracao-publica/selecao-e-ingresso-de-pessoal-por-meio-de-concursos-publicos-processos-seletivos-internos-e-processos-seletivos-simplificados149
Trânsito e Transportes;Curso Especializado Para Condutores De Veiculos De Transporte De Produtos Perigosos Mopp;https://www.ms.gov.br/transito-e-transportes/curso-especializado-para-condutores-de-veiculos-de-transporte-de-produtos-perigosos-mopp72;167;transito-e-transportes//curso-especializado-para-condutores-de-veiculos-de-transporte-de-produtos-perigosos-mopp72
Finanças e Impostos;Ipva Alegacaocomunicacao De Venda De Veiculo;https://www.ms.gov.br/financas-e-impostos/ipva-alegacaocomunicacao-de-venda-de-veiculo53;166;financas-e-impostos/ipva-alegacaocomunicacao-de-venda-de-veiculo53
Agropecuária e Vida Rural;Icms Reducao Da Base De Calculo Nas Operacoes Internas Com Energia Eletrica Destinada A Produtor Rural Que Exerca A Atividade De Avicultura De Corte;https://www.ms.gov.br/agropecuaria-e-vida-rural/icms-reducao-da-base-de-calculo-nas-operacoes-internas-com-energia-eletrica-destinada-a-produtor-rural-que-exerca-a-atividade-de-avicultura-de-corte139;166;agropecuaria-e-vida-rural/icms-reducao-da-base-de-calculo-nas-operacoes-internas-com-energia-eletrica-destinada-a-produtor-rural-que-exerca-a-atividade-de-avicultura-de-corte139
Finanças e Impostos;Autorizacao Especifica Credenciamento Para Remessa De Aluminio Em Outra Uf Clausula 1A 4O Ii Do Convenio Icms 362016 Art 47 A 5O Ii Do Anexo Iii Ao Regulamento Do Icms;https://www.ms.gov.br/financas-e-impostos/autorizacao-especifica-credenciamento-para-remessa-de-aluminio-em-outra-uf-clausula-1a-4o-ii-do-convenio-icms-362016-art-47-a-5o-ii-do-anexo-iii-ao-regulamento-do-icms34;166;financas-e-impostos/autorizacao-especifica-credenciamento-para-remessa-de-aluminio-em-outra-uf-clausula-1a-4o-ii-do-convenio-icms-362016-art-47-a-5o-ii-do-anexo-iii-ao-regulamento-do-icms34
Finanças e Impostos;Autorizacao Controle De Empresas Interdependentes Art 57 A Da Lei No ;https://www.ms.gov.br/financas-e-impostos/autorizacao-controle-de-empresas-interdependentes-art-57-a-da-lei-no-18101997166;164;financas-e-impostos/autorizacao-controle-de-empresas-interdependentes-art-57-a-da-lei-no-18101997166//index
Agropecuária e Vida Rural;Registrar Empresa Comerciante De Agrotoxico E Prestador De Servico;https://www.ms.gov.br/agropecuaria-e-vida-rural/registrar-empresa-comerciante-de-agrotoxico-e-prestador-de-servico165;163;agropecuaria-e-vida-rural//registrar-empresa-comerciante-de-agrotoxico-e-prestador-de-servico165
Empresa, Indústria e Comércio;Nota Fiscal De Empresas Cancelamento Por Motivo De Extravio;https://www.ms.gov.br/empresa-industria-e-comercio/nota-fiscal-de-empresas-cancelamento-por-motivo-de-extravio56;161;empresa-industria-e-comercio/nota-fiscal-de-empresas-cancelamento-por-motivo-de-extravio56
Agropecuária e Vida Rural;Consultar Atraves Do E Saniagro Modulo Aim Autos De Infracao Existentes Ao Interessado;https://www.ms.gov.br/agropecuaria-e-vida-rural/consultar-atraves-do-e-saniagro-modulo-aim-autos-de-infracao-existentes-ao-interessado143;161;agropecuaria-e-vida-rural//consultar-atraves-do-e-saniagro-modulo-aim-autos-de-infracao-existentes-ao-interessado143
Trânsito e Transportes;Solicitacao De Atualizacao De Curso Para Instrutor De Transito;https://www.ms.gov.br/transito-e-transportes/solicitacao-de-atualizacao-de-curso-para-instrutor-de-transito196;161;transito-e-transportes//solicitacao-de-atualizacao-de-curso-para-instrutor-de-transito196
Agropecuária e Vida Rural;Icms Reducao Da Base De Calculo Nas Operacoes Internas Com Energia Eletrica Destinada A Produtor Rural Para Fim Especifico De Irrigacao;https://www.ms.gov.br/agropecuaria-e-vida-rural/icms-reducao-da-base-de-calculo-nas-operacoes-internas-com-energia-eletrica-destinada-a-produtor-rural-para-fim-especifico-de-irrigacao152;158;agropecuaria-e-vida-rural/icms-reducao-da-base-de-calculo-nas-operacoes-internas-com-energia-eletrica-destinada-a-produtor-rural-para-fim-especifico-de-irrigacao152
Empresa, Indústria e Comércio;Icms St Homologacao De Credito Por Venda De Combustivel Ao Estado Do Mato Grosso Do Sul;https://www.ms.gov.br/empresa-industria-e-comercio/icms-st-homologacao-de-credito-por-venda-de-combustivel-ao-estado-do-mato-grosso-do-sul20;158;empresa-industria-e-comercio/icms-st-homologacao-de-credito-por-venda-de-combustivel-ao-estado-do-mato-grosso-do-sul20
Finanças e Impostos;Itcd Solicitacao De Restituicaocompensacao De Itcd Indevido;https://www.ms.gov.br/financas-e-impostos/itcd-solicitacao-de-restituicaocompensacao-de-itcd-indevido142;158;financas-e-impostos/itcd-solicitacao-de-restituicaocompensacao-de-itcd-indevido142
Empresa, Indústria e Comércio;Prorrogacao De Atestado De Inexistencia Para Fins De Diferimento Do Icms Diferencial De Aliquotas E De Importacao Na Aquisicao De Maquinas E Equipamentos Industriais Termo De Acordo;https://www.ms.gov.br/empresa-industria-e-comercio/prorrogacao-de-atestado-de-inexistencia-para-fins-de-diferimento-do-icms-diferencial-de-aliquotas-e-de-importacao-na-aquisicao-de-maquinas-e-equipamentos-industriais-termo-de-acordo200;156;empresa-industria-e-comercio/prorrogacao-de-atestado-de-inexistencia-para-fins-de-diferimento-do-icms-diferencial-de-aliquotas-e-de-importacao-na-aquisicao-de-maquinas-e-equipamentos-industriais-termo-de-acordo200
Finanças e Impostos;Icms Calculo Para Recolhimento Espontaneo Normal Transporte Equalizacao E Substituicao Tributaria;https://www.ms.gov.br/financas-e-impostos/icms-calculo-para-recolhimento-espontaneo-normal-transporte-equalizacao-e-substituicao-tributaria83;154;financas-e-impostos/icms-calculo-para-recolhimento-espontaneo-normal-transporte-equalizacao-e-substituicao-tributaria83//index
Finanças e Impostos;Informacoes Fiscais E Cadastrais Solicitacao;https://www.ms.gov.br/financas-e-impostos/informacoes-fiscais-e-cadastrais-solicitacao118;152;financas-e-impostos/informacoes-fiscais-e-cadastrais-solicitacao118//index
Trânsito e Transportes;Solicitar Processo Primeira Habilitacao Permissao Para Dirigir Ppd;https://www.ms.gov.br/transito-e-transportes/solicitar-processo-primeira-habilitacao-permissao-para-dirigir-ppd42;151;transito-e-transportes//solicitar-processo-primeira-habilitacao-permissao-para-dirigir-ppd42
Administração Pública;Emitir Boleto Para Pagamento De Divida Ativa Protestada;https://www.ms.gov.br/administracao-publica/emitir-boleto-para-pagamento-de-divida-ativa-protestada135;149;administracao-publica//emitir-boleto-para-pagamento-de-divida-ativa-protestada135
Finanças e Impostos;Bilhete De Passagem Eletronico Bp E Modelo 63 Pedido De Credenciamento;https://www.ms.gov.br/financas-e-impostos/bilhete-de-passagem-eletronico-bp-e-modelo-63-pedido-de-credenciamento110;148;financas-e-impostos/bilhete-de-passagem-eletronico-bp-e-modelo-63-pedido-de-credenciamento110//index
Trânsito e Transportes;Transferencia De Propriedade Veicular;https://www.ms.gov.br/transito-e-transportes/transferencia-de-propriedade-veicular1;146;transito-e-transportes//transferencia-de-propriedade-veicular1
Finanças e Impostos;Ipva Desvinculacao De Debitos Anteriores Para Veiculos Adquiridos Em Leilao Exclusivamente Administracoes Publicas E Leiloeiros Oficiais;https://www.ms.gov.br/financas-e-impostos/ipva-desvinculacao-de-debitos-anteriores-para-veiculos-adquiridos-em-leilao-exclusivamente-administracoes-publicas-e-leiloeiros-oficiais187;144;financas-e-impostos/ipva-desvinculacao-de-debitos-anteriores-para-veiculos-adquiridos-em-leilao-exclusivamente-administracoes-publicas-e-leiloeiros-oficiais187
Agropecuária e Vida Rural;Socred Solicitacao De Credito Fiscal Do Icms Referente A Operacoes E Prestacoes Relacionadas A Produtos E A Atividade Agropecuaria;https://www.ms.gov.br/agropecuaria-e-vida-rural/socred-solicitacao-de-credito-fiscal-do-icms-referente-a-operacoes-e-prestacoes-relacionadas-a-produtos-e-a-atividade-agropecuaria91;144;agropecuaria-e-vida-rural/socred-solicitacao-de-credito-fiscal-do-icms-referente-a-operacoes-e-prestacoes-relacionadas-a-produtos-e-a-atividade-agropecuaria91
Trânsito e Transportes;Protocolar Defesa E Recurso A Processo Administrativo De Suspensaocassacao De Cnh;https://www.ms.gov.br/transito-e-transportes/protocolar-defesa-e-recurso-a-processo-administrativo-de-suspensaocassacao-de-cnh71;143;transito-e-transportes//protocolar-defesa-e-recurso-a-processo-administrativo-de-suspensaocassacao-de-cnh71
Agropecuária e Vida Rural;Nota Fiscal De Produtor Eletronica Nfp E Cancelamento Extemporaneo;https://www.ms.gov.br/agropecuaria-e-vida-rural/nota-fiscal-de-produtor-eletronica-nfp-e-cancelamento-extemporaneo168;142;agropecuaria-e-vida-rural/nota-fiscal-de-produtor-eletronica-nfp-e-cancelamento-extemporaneo168
Trânsito e Transportes;Solicitar Carteira Nacional De Habilitacao Definitiva;https://www.ms.gov.br/transito-e-transportes/solicitar-carteira-nacional-de-habilitacao-definitiva104;139;transito-e-transportes//solicitar-carteira-nacional-de-habilitacao-definitiva104
Administração Pública;Pedir Revisao De Divida Inscrita Prdi;https://www.ms.gov.br/administracao-publica/pedir-revisao-de-divida-inscrita-prdi3;138;administracao-publica/pedir-revisao-de-divida-inscrita-prdi3
Comunicação e Transparência;Registrar Denuncia;https://www.ms.gov.br/comunicacao-e-transparencia/registrar-denuncia18;137;comunicacao-e-transparencia/registrar-denuncia18
Finanças e Impostos;Autorizacao Especifica Concessao Percentual De Valor De Margem De Valor Diferenciado Para Produtos Alimenticios;https://www.ms.gov.br/financas-e-impostos/autorizacao-especifica-concessao-percentual-de-valor-de-margem-de-valor-diferenciado-para-produtos-alimenticios80;136;financas-e-impostos/autorizacao-especifica-concessao-percentual-de-valor-de-margem-de-valor-diferenciado-para-produtos-alimenticios80
Finanças e Impostos;Autorizacao Especifica Concessao Ou Renovacao Do Diferimento Do Eac Previsto No Convenio Icms No 1523 No Cumprimento De Obrigacoes Que Dispoe Sobre O Regime De Tributacao Monofasica Do Icms;https://www.ms.gov.br/financas-e-impostos/autorizacao-especifica-concessao-ou-renovacao-do-diferimento-do-eac-previsto-no-convenio-icms-no-1523-no-cumprimento-de-obrigacoes-que-dispoe-sobre-o-regime-de-tributacao-monofasica-do-icms71;136;financas-e-impostos/autorizacao-especifica-concessao-ou-renovacao-do-diferimento-do-eac-previsto-no-convenio-icms-no-1523-no-cumprimento-de-obrigacoes-que-dispoe-sobre-o-regime-de-tributacao-monofasica-do-icms71
Agropecuária e Vida Rural;Transferencia De Animal Registrado No Smepa Sistema De Monitoramento De Estoque De Produtos Agropecuarios;https://www.ms.gov.br/agropecuaria-e-vida-rural/transferencia-de-animal-registrado-no-smepa-sistema-de-monitoramento-de-estoque-de-produtos-agropecuarios104;132;agropecuaria-e-vida-rural/transferencia-de-animal-registrado-no-smepa-sistema-de-monitoramento-de-estoque-de-produtos-agropecuarios104
Trabalho, Emprego e Previdência;Seguro Desemprego;https://www.ms.gov.br/trabalho-emprego-e-previdencia/seguro-desemprego102;132;trabalho-emprego-e-previdencia//seguro-desemprego102
Finanças e Impostos;Icms Comunicacao Da Apropriacao De Credito Nos Termos Do Art 17 3O Ii A Da Resolucaosefaz No 30262025 Limite De 300 Uferms;https://www.ms.gov.br/financas-e-impostos/icms-comunicacao-da-apropriacao-de-credito-nos-termos-do-art-17-3o-ii-a-da-resolucaosefaz-no-30262025-limite-de-300-uferms90;132;financas-e-impostos/icms-comunicacao-da-apropriacao-de-credito-nos-termos-do-art-17-3o-ii-a-da-resolucaosefaz-no-30262025-limite-de-300-uferms90//index
Comunicação e Transparência;Atendimento Para Esclarecimentos Sobre Certificacao Do Ensino Medio Pelo Enem No Periodo De 2009 A ;https://www.ms.gov.br/comunicacao-e-transparencia/atendimento-para-esclarecimentos-sobre-certificacao-do-ensino-medio-pelo-enem-no-periodo-de-2009-a-2012114;131;comunicacao-e-transparencia//atendimento-para-esclarecimentos-sobre-certificacao-do-ensino-medio-pelo-enem-no-periodo-de-2009-a-2012114
Finanças e Impostos;Itcd Causa Mortis E Doacoes Pedido De Parcelamento De Debito Ppd;https://www.ms.gov.br/financas-e-impostos/itcd-causa-mortis-e-doacoes-pedido-de-parcelamento-de-debito-ppd123;130;financas-e-impostos/itcd-causa-mortis-e-doacoes-pedido-de-parcelamento-de-debito-ppd123
Administração Pública;Emissao De Certidao De Atendimento;https://www.ms.gov.br/administracao-publica/emissao-de-certidao-de-atendimento66;129;administracao-publica/emissao-de-certidao-de-atendimento66
Trânsito e Transportes;Junta Medica E Junta Psicologica;https://www.ms.gov.br/transito-e-transportes/junta-medica-e-junta-psicologica147;128;transito-e-transportes//junta-medica-e-junta-psicologica147
