titulo_servico;siglaorgao;nome_orgao;categoria;url
2ª via de certificado de conclusão de curso;UEMS;Universidade Estadual de Mato Grosso do Sul;Educação e Pesquisa;https://www.ms.gov.br/educacao-e-pesquisa/2a-via-de-certificado-de-conclusao-de-curso97
2ª via do diploma;UEMS;Universidade Estadual de Mato Grosso do Sul;Educação e Pesquisa;https://www.ms.gov.br/educacao-e-pesquisa/2a-via-do-diploma58
Acessar agência virtual;MSGÁS;Companhia de Gás do Estado de Mato Grosso do Sul;Energia;https://www.ms.gov.br/energia/agencia-virtual22
Acessar cursos da Escola do SUAS/MS;SEAD;Secretaria de Estado de Assistência Social e Direitos Humanos;Assistência Social;https://www.ms.gov.br/assistencia-social/solicitacao-de-cursos-na-escola-do-suas-ms60
Acessar dados do portal da transparência;CGE MS;Controladoria Geral do Estado de Mato Grosso do Sul;Comunicação e Transparência;https://www.ms.gov.br/comunicacao-e-transparencia/acessar-dados-do-portal-da-transparencia171
Acessar delegacia virtual;SETESC;Secretaria de Estado de Turismo, Esporte e Cultura;Direitos e Cidadania;https://www.ms.gov.br/direitos-e-cidadania/delegacia-virtual188
Acessar gratuitamente programas da TV educativa (Portal da Educativa);FERTEL - Educativa MS;Fundação Estadual Jornalista Luiz Chagas de Rádio e Televisão;Educação e Pesquisa;https://www.ms.gov.br/educacao-e-pesquisa/acessar-gratuitamente-programas-da-tv-educativa-portal-da-educativa175
Acessar indicadores da atividade turística do Mato Grosso Do Sul;FUNDTUR;Fundação de Turismo de Mato Grosso do Sul;Turismo;https://www.ms.gov.br/turismo/acessar-indicadores-da-atividade-turistica-do-mato-grosso-do-sul141
Acessar notícias em tempo real gratuitamente (Portal da Educativa);FERTEL - Educativa MS;Fundação Estadual Jornalista Luiz Chagas de Rádio e Televisão;Comunicação e Transparência;https://www.ms.gov.br/comunicacao-e-transparencia/acessar-noticias-em-tempo-real-gratuitamente-portal-da-educativa128
Acessar o aplicativo MSGÁS (acompanhamento do consumo, emissão de 2ª via de fatura);MSGÁS;Companhia de Gás do Estado de Mato Grosso do Sul;Energia;https://www.ms.gov.br/energia/plicativo-msgas-acompanhamento-do-consumo-emissao-de-2a-via-de-fatura116
Acessar os cursos por quem já é graduado;UEMS;Universidade Estadual de Mato Grosso do Sul;Educação e Pesquisa;https://www.ms.gov.br/educacao-e-pesquisa/911-secretaria-academica-da-graduacao-portador-de-diploma31
Acessar os dados estatísticos online;SEJUSP;Secretaria de Estado de Justiça e Segurança Pública de Mato Grosso do Sul;Comunicação e Transparência;https://www.ms.gov.br/comunicacao-e-transparencia/estatisticas-online118
Acessar plataforma de inteligência turística de Mato Grosso do Sul;FUNDTUR;Fundação de Turismo de Mato Grosso do Sul;Turismo;https://www.ms.gov.br/turismo/plataforma-de-inteligencia-turistica-de-mato-grosso-do-sul12
Acessar portal da transparência da MSGÁS;MSGÁS;Companhia de Gás do Estado de Mato Grosso do Sul;Comunicação e Transparência;https://www.ms.gov.br/comunicacao-e-transparencia/acessar-portal-da-transparencia-da-msgas141
Acessar site para ouvir a rádio educativa fm 104,7 de forma gratuita (Portal da Educativa);FERTEL - Educativa MS;Fundação Estadual Jornalista Luiz Chagas de Rádio e Televisão;Comunicação e Transparência;https://www.ms.gov.br/comunicacao-e-transparencia/acessar-site-para-ouvir-a-radio-educativa-fm-1047-de-forma-gratuita-portal-da-educativa85
Aderir ao PACPOA-MS;IAGRO;Agência Estadual de Defesa Sanitária Animal Vegetal  Mato Grosso do Sul;Agropecuária e Vida Rural;https://www.ms.gov.br/agropecuaria-e-vida-rural/aderir-ao-pacpoa-ms41
Aderir ao PECOMS;IAGRO;Agência Estadual de Defesa Sanitária Animal Vegetal  Mato Grosso do Sul;Agropecuária e Vida Rural;https://www.ms.gov.br/agropecuaria-e-vida-rural/requerimento-de-adesao-ao-pecoms-iagro7
Aderir ao cadastro de fornecedores;SAD;Secretaria de Estado de Administração de Mato Grosso do Sul;Administração Pública;https://www.ms.gov.br/administracao-publica/cadastro-de-fornecedores36
Aderir ao débito automático da fatura de consumo;MSGÁS;Companhia de Gás do Estado de Mato Grosso do Sul;Energia;https://www.ms.gov.br/energia/adesao-ao-debito-automatico163
Aderir ao programa de verticalização da produção agropecuária do estado do MS;AGRAER;Agência de Desenvolvimento Agrário e Extensão Rural de Mato Grosso do Sul;Agropecuária e Vida Rural;https://www.ms.gov.br/agropecuaria-e-vida-rural/programa-de-verticalizacao-da-producao-agropecuaria-do-estado-de-mato-grosso-do-sul12
Aderir à fatura de consumo online;MSGÁS;Companhia de Gás do Estado de Mato Grosso do Sul;Energia;https://www.ms.gov.br/energia/adesao-a-fatura-on-line36
Agendar o atendimento presencial;AGEPREV;Agência de Previdência Social de Mato Grosso do Sul;Trabalho, Emprego e Previdência;https://www.ms.gov.br/trabalho-emprego-e-previdencia/agendar-atendimento-presencial153
Alterar espécie do veículo para coleção - Mesmo proprietário;DETRAN;Departamento Estadual de Trânsito de Mato Grosso do Sul;Trânsito e Transportes;https://www.ms.gov.br/transito-e-transportes/veiculos-de-colecao39
Alterar registro de empresa comerciante de agrotóxico e prestador de serviço;IAGRO;Agência Estadual de Defesa Sanitária Animal Vegetal  Mato Grosso do Sul;Agropecuária e Vida Rural;https://www.ms.gov.br/agropecuaria-e-vida-rural/alterar-registro-de-empresa-comerciante-de-agrotoxico-e-prestador-de-servico103
Analisar processos de segurança contra incêndio e pânico PSCIP;CBMMS;Corpo de Bombeiros Militar;Segurança;https://www.ms.gov.br/seguranca/analisar-processos-de-seguranca-contra-incendio-e-panico-pscip16
Anunciar vagas de emprego;FUNTRAB;Fundação de Trabalho de Mato Grosso do Sul;Trabalho, Emprego e Previdência;https://www.ms.gov.br/trabalho-emprego-e-previdencia/anunciar-vagas-de-emprego-atraves-de-plataforma51
Análise das obrigações socioeconômicas pactuadas em Termo de Acordo - Benefício da Lei Complementar nº 93/2001 (CIDEC);SEFAZ MS;Secretaria de Estado de Fazenda de Mato Grosso do Sul;Finanças e Impostos;https://www.ms.gov.br/financas-e-impostos/analise-das-obrigacoes-socioeconomicas-pactuadas-em-termo-de-acordo-beneficio-da-lei-complementar-n-932001-cidec169
Apoiar a educação básica das escolas públicas de Mato Grosso do Sul;FADEB;Fundação da Apoio e Desenvolvimento à Educação Básica;Educação e Pesquisa;https://www.ms.gov.br/educacao-e-pesquisa/apoiar-a-educacao-basica-das-escolas-publicas-de-mato-grosso-do-sul168
Apresentar defesa e/ou recurso em processo administrativo sanitário PAS;SES;Secretaria de Estado de Saúde de Mato Grosso do Sul;Saúde e Cuidado;https://www.ms.gov.br/saude-e-cuidado/processo-administrativo-sanitario3
Apresentar monitoramento de outorga de recursos hídricos;IMASUL;Instituto de Meio Ambiente de Mato Grosso do Sul;Meio Ambiente;https://www.ms.gov.br/meio-ambiente/apresentar-monitoramento-de-outorga-de-recursos-hidricos182
Assessoria de projetos especiais;UEMS;Universidade Estadual de Mato Grosso do Sul;Educação e Pesquisa;https://www.ms.gov.br/educacao-e-pesquisa/assessoria-de-projetos-especiais28
Assinar Acordo de Cooperação Técnica sobre arborização urbana e rede de energia;AGEMS;Agência Estadual de Regulação de Serviços Públicos de Mato Grosso do Sul;Energia;https://www.ms.gov.br/energia/assinar-acordo-de-cooperacao-tecnica-sobre-arborizacao-urbana-e-rede-de-energia67
Assistência administrativa à coordenação do curso de ciências biológicas;UEMS;Universidade Estadual de Mato Grosso do Sul;Educação e Pesquisa;https://www.ms.gov.br/educacao-e-pesquisa/assistencia-administrativa-a-coordenacao-do-curso-de-ciencias-biologicas10
Atender a pacientes com hemofilia, outras coagulopatias e anemia falciforme;SES;Secretaria de Estado de Saúde de Mato Grosso do Sul;Saúde e Cuidado;https://www.ms.gov.br/saude-e-cuidado/atender-a-pacientes-com-hemofilia-outras-coagulopatias-e-anemia-falciforme27
Atender, Registrar e Apurar as infrações penais que configurem violência e familiar contra a mulher;PCMS;Polícia Civil de Mato Grosso do Sul;Segurança;https://www.ms.gov.br/seguranca/atender-registrar-e-apurar-as-infracoes-penais-que-configurem-violencia-e-familiar-contra-a-mulher40
Atendimento Educacional Especializado;UEMS;Universidade Estadual de Mato Grosso do Sul;Educação e Pesquisa;https://www.ms.gov.br/educacao-e-pesquisa/atendimento-educacional-especializado188
Atendimento da equipe de comunicação;UEMS;Universidade Estadual de Mato Grosso do Sul;Comunicação e Transparência;https://www.ms.gov.br/comunicacao-e-transparencia/atendimento-da-equipe-de-comunicacao185
Atestado de inexistência para fins de diferimento do ICMS diferencial de alíquotas e de importação na aquisição de máquinas e equipamentos industriais - Termo de Acordo;SEFAZ MS;Secretaria de Estado de Fazenda de Mato Grosso do Sul;Empresa, Indústria e Comércio;https://www.ms.gov.br/empresa-industria-e-comercio/atestado-de-inexistencia-para-fins-de-diferimento-do-icms-diferencial-de-aliquotas-e-de-importacao-na-aquisicao-de-maquinas-e-equipamentos-industriais-termo-de-acordo8
Atualizar cadastro;MSGÁS;Companhia de Gás do Estado de Mato Grosso do Sul;Energia;https://www.ms.gov.br/energia/atualizacao-cadastral70
Atualizar cadastro de núcleo avícola comercial;IAGRO;Agência Estadual de Defesa Sanitária Animal Vegetal  Mato Grosso do Sul;Agropecuária e Vida Rural;https://www.ms.gov.br/agropecuaria-e-vida-rural/atualizacao-cadastral-de-nucleo-avicola-comercial166
Atualizar endereço de condutor (CNH/PPD);DETRAN;Departamento Estadual de Trânsito de Mato Grosso do Sul;Trânsito e Transportes;https://www.ms.gov.br/transito-e-transportes/atualizar-endereco-de-condutora-cnhppd109
Atualizar endereço do veículo;DETRAN;Departamento Estadual de Trânsito de Mato Grosso do Sul;Trânsito e Transportes;https://www.ms.gov.br/transito-e-transportes/solicitacao-de-atualizacao-de-endereco-do-condutor117
Autenticar livro digital;JUCEMS;Junta Comercial do Estado de Mato Grosso do Sul;Empresa, Indústria e Comércio;https://www.ms.gov.br/empresa-industria-e-comercio/autenticar-livro-digital30
Autenticidade de validação e veracidade de diploma;UEMS;Universidade Estadual de Mato Grosso do Sul;Educação e Pesquisa;https://www.ms.gov.br/educacao-e-pesquisa/autenticidade-de-validacao-e-veracidade-de-diploma52
Auto de cientificação (ACT) - prorrogação de prazo para pagamento;SEFAZ MS;Secretaria de Estado de Fazenda de Mato Grosso do Sul;Finanças e Impostos;https://www.ms.gov.br/financas-e-impostos/auto-de-cientificacao-act-prorrogacao-de-prazo-para-pagamento30
Auto de lançamento e de imposição de multa (ALIM) - impugnação;SEFAZ MS;Secretaria de Estado de Fazenda de Mato Grosso do Sul;Finanças e Impostos;https://www.ms.gov.br/financas-e-impostos/auto-de-lancamento-e-de-imposicao-de-multa-alim-impugnacao83
Auto de lançamento e de imposição de multa (ALIM), mod. 1 - solicitação de lavratura;SEFAZ MS;Secretaria de Estado de Fazenda de Mato Grosso do Sul;Finanças e Impostos;https://www.ms.gov.br/financas-e-impostos/auto-de-lancamento-e-de-imposicao-de-multa-alim-mod-1-solicitacao-de-lavratura97
Auto de lançamento e de imposição de multa (ALIM), mod. 2 - solicitação de lavratura referente a TVF e/ou TA - contraditório e ampla defesa;SEFAZ MS;Secretaria de Estado de Fazenda de Mato Grosso do Sul;Finanças e Impostos;https://www.ms.gov.br/financas-e-impostos/auto-de-lancamento-e-de-imposicao-de-multa-alim-mod-2-solicitacao-de-lavratura-referente-a-tvf-eou-ta198
Auto de lançamento e de imposição de multa (ALIM), mod. 2 - solicitação de lavratura referente a TVF e/ou TA - parcelamento de débito fiscal;SEFAZ MS;Secretaria de Estado de Fazenda de Mato Grosso do Sul;Finanças e Impostos;https://www.ms.gov.br/financas-e-impostos/auto-de-lancamento-e-de-imposicao-de-multa-alim-mod-2-solicitacao-de-lavratura-referente-a-tvf-eou-ta-parcelamento-de-debito-fiscal101
Auto de lançamento e de imposição de multa (ALIM), mod. 2 - solicitação de lavratura referente a termo de apreensão (TA), conforme art. 4º da Instrução Normativa/SAT nº 001/2020;SEFAZ MS;Secretaria de Estado de Fazenda de Mato Grosso do Sul;Finanças e Impostos;https://www.ms.gov.br/financas-e-impostos/auto-de-lancamento-e-de-imposicao-de-multa-alim-mod-2-solicitacao-de-lavratura-referente-a-termo-de-apreensao-ta-conforme-art-4o-da-instrucao-normativasat-no-001-de-23-de-janeiro-de-20201
Autorizar cultivos em unidades de pesquisa ou demonstrativa;IAGRO;Agência Estadual de Defesa Sanitária Animal Vegetal  Mato Grosso do Sul;Agropecuária e Vida Rural;https://www.ms.gov.br/agropecuaria-e-vida-rural/autorizacao-para-cultivos-em-unidades-de-pesquisa-ou-demonstrativa146
Autorização - controle de empresas interdependentes (art. 57-A da Lei nº 1.810/1997) - apenas para contribuintes de Mato Grosso do Sul;SEFAZ MS;Secretaria de Estado de Fazenda de Mato Grosso do Sul;Finanças e Impostos;https://www.ms.gov.br/financas-e-impostos/autorizacao-controle-de-empresas-interdependentes-art-57-a-da-lei-no-18101997166
Autorização - inclusão de franqueadora no regime especial de transportadora conveniada (Anexo XII ao RICMS) - apenas para transportadoras de MS com regime especial de transportadora conveniada;SEFAZ MS;Secretaria de Estado de Fazenda de Mato Grosso do Sul;Finanças e Impostos;https://www.ms.gov.br/financas-e-impostos/autorizacao-inclusao-de-franqueadora-no-regime-especial-de-transportadora-conveniada-anexo-xii-ao-ricms75
Autorização Específica mediante Termo de Acordo - concessão e renovação - distribuidora de medicamentos localizada neste Estado - tratamento tributário do Decreto nº 9.578/1999;SEFAZ MS;Secretaria de Estado de Fazenda de Mato Grosso do Sul;Empresa, Indústria e Comércio;https://www.ms.gov.br/empresa-industria-e-comercio/autorizacao-especifica-distribuidora-de-medicamentos-localizada-neste-estado-assumir-a-responsabilidade-pelo-icms-st-devido-e-adotar-base-de-calculo-do-icms-sem-aplicacao-do-pmc104
Autorização específica - aquisição de milho e soja para uso na ração animal, com diferimento do ICMS;SEFAZ MS;Secretaria de Estado de Fazenda de Mato Grosso do Sul;Agropecuária e Vida Rural;https://www.ms.gov.br/agropecuaria-e-vida-rural/autorizacao-especifica-aquisicao-de-milho-e-soja-para-uso-na-racao-animal-com-diferimento-do-icms117
Autorização específica - armazenagem de álcool combustível ou açúcar em outra usina com diferimento do ICMS;SEFAZ MS;Secretaria de Estado de Fazenda de Mato Grosso do Sul;Empresa, Indústria e Comércio;https://www.ms.gov.br/empresa-industria-e-comercio/autorizacao-especifica-armazenagem-de-alcool-combustivel-ou-acucar-em-outra-usina-com-diferimento-do-icms133
Autorização específica - concessão ou renovação do diferimento do EAC previsto no Convênio ICMS nº 15/2023, no cumprimento de obrigações, que dispõe sobre o regime de tributação monofásica do ICMS;SEFAZ MS;Secretaria de Estado de Fazenda de Mato Grosso do Sul;Finanças e Impostos;https://www.ms.gov.br/financas-e-impostos/autorizacao-especifica-concessao-ou-renovacao-do-diferimento-do-eac-previsto-no-convenio-icms-no-1523-no-cumprimento-de-obrigacoes-que-dispoe-sobre-o-regime-de-tributacao-monofasica-do-icms71
Autorização específica - credenciamento para remessa de alumínio a estabelecimentos de outra UF, assumindo a responsabilidade pelo pagamento do ICMS (art. 47-A, § 5º, II do Anexo III ao RICMS);SEFAZ MS;Secretaria de Estado de Fazenda de Mato Grosso do Sul;Finanças e Impostos;https://www.ms.gov.br/financas-e-impostos/autorizacao-especifica-credenciamento-para-remessa-de-aluminio-em-outra-uf-clausula-1a-4o-ii-do-convenio-icms-362016-art-47-a-5o-ii-do-anexo-iii-ao-regulamento-do-icms34
Autorização específica - crédito outorgado e redução do percentual de MVA nas operações internas realizadas por estabelecimentos comerciais atacadistas (Decreto nº 15.368/2020) - apenas para atacadistas;SEFAZ MS;Secretaria de Estado de Fazenda de Mato Grosso do Sul;Finanças e Impostos;https://www.ms.gov.br/financas-e-impostos/autorizacao-especifica-utilizacao-de-credito-outorgado-nas-operacoes-internas-realizadas-por-estabelecimentos-comerciais-atacadistas-com-mercadorias-destinadas-a-comercializacao-ou-a-industrializacao-dec-15368202042
Autorização específica - crédito outorgado nas operações internas e interestaduais com açúcar pelos fabricantes de açúcar;SEFAZ MS;Secretaria de Estado de Fazenda de Mato Grosso do Sul;Empresa, Indústria e Comércio;https://www.ms.gov.br/empresa-industria-e-comercio/autorizacao-especifica-credito-outorgado-nas-operacoes-internas-e-interestaduais-com-acucar-pelos-fabricantes-de-acucar145
Autorização específica - crédito presumido incidente nas operações com energia elétrica e serviços de comunicação;SEFAZ MS;Secretaria de Estado de Fazenda de Mato Grosso do Sul;Empresa, Indústria e Comércio;https://www.ms.gov.br/empresa-industria-e-comercio/autorizacao-especifica-credito-presumido-incidente-nas-operacoes-com-energia-eletrica-e-servicos-de-comunicacao123
Autorização específica - crédito presumido nas operações com os produtos resultantes da industrialização do leite (art. 1º do Decreto nº 6.996/1993) - apenas para industrializadores de leite;SEFAZ MS;Secretaria de Estado de Fazenda de Mato Grosso do Sul;Finanças e Impostos;https://www.ms.gov.br/financas-e-impostos/autorizacao-especifica-credito-presumido-incidente-nas-operacoes-com-os-produtos-resultantes-da-industrializacao-do-leite128
Autorização específica - crédito presumido nas operações internas ou interestaduais com produtos cerâmicos (art. 77, II do Anexo I ao RICMS) - apenas para indústrias;SEFAZ MS;Secretaria de Estado de Fazenda de Mato Grosso do Sul;Finanças e Impostos;https://www.ms.gov.br/financas-e-impostos/autorizacao-especifica-credito-presumido-nas-operacoes-internas-ou-interestaduais-com-produtos-ceramicos137
Autorização específica - diferimento do ICMS na aquisição de embalagens plásticas e latas produzidas em MS para acondicionar os produtos do adquirente (Resolução Interna SEF de 1993) - apenas para indústrias e abatedores de animais;SEFAZ MS;Secretaria de Estado de Fazenda de Mato Grosso do Sul;Finanças e Impostos;https://www.ms.gov.br/financas-e-impostos/autorizacao-especifica-diferimento-do-icms-na-aquisicao-de-embalagens-plasticas-e-latas-produzidas-em-ms-e-utilizadas-no-acondicionamento-dos-produtos-do-adquirente-resolucao-interna-sef-000-de-17081993173
Autorização específica - diferimento do ICMS na aquisição de produtos agrícolas por empresa industrializadora de ração animal, na operação interna (art. 7º do Decreto nº 9.895/2000) - apenas para indústrias de ração animal;SEFAZ MS;Secretaria de Estado de Fazenda de Mato Grosso do Sul;Finanças e Impostos;https://www.ms.gov.br/financas-e-impostos/autorizacao-especifica-aquisicao-de-produtos-agricolas-por-empresa-industrializadora-de-racao-animal-com-diferimento-do-lancamento-e-do-pagamento-do-icms-na-operacao-interna28
Autorização específica - diferimento do ICMS na aquisição de produtos agrícolas por indústrias, na operação interna (art. 3º do Decreto nº 9.895/2000) - apenas para indústrias, exceto fabricantes de ração animal;SEFAZ MS;Secretaria de Estado de Fazenda de Mato Grosso do Sul;Finanças e Impostos;https://www.ms.gov.br/financas-e-impostos/autorizacao-especifica-aquisicao-de-produtos-agricolas-por-industria-exceto-fabricante-de-racao-animal-com-diferimento-do-lancamento-e-do-pagamento-do-icms-na-operacao-interna28
Autorização específica - diferimento do ICMS nas operações internas com couro bovino ou bufalino e produtos químicos adquiridos por industrializadores de couro (Decreto nº 11.796/2005) - apenas para indústrias de couro;SEFAZ MS;Secretaria de Estado de Fazenda de Mato Grosso do Sul;Finanças e Impostos;https://www.ms.gov.br/financas-e-impostos/autorizacao-especifica-diferimento-do-lancamento-e-do-pagamento-do-icms-nas-operacoes-internas-com-couro-bovino-ou-bufalino-e-produtos-quimicos-adquiridos-por-empresa-industrializadora-de-couro193
Autorização específica - diferimento do ICMS nas saídas internas de algodão em pluma, realizadas por produtor, para outro estabelecimento do mesmo produtor (art. 10, II do Decreto nº 9.895/2000) - apenas para produtores de algodão;SEFAZ MS;Secretaria de Estado de Fazenda de Mato Grosso do Sul;Finanças e Impostos;https://www.ms.gov.br/financas-e-impostos/autorizacao-especifica-saidas-internas-de-algodao-em-pluma-realizadas-por-produtor-para-outro-estabelecimento-do-mesmo-produtor-com-diferimento-do-lancamento-e-do-pagamento-do-icms-art-10-ii-do-dec-98952000185
Autorização específica - diferimento do ICMS no recebimento de grãos da CONAB - para estabelecimentos industriais, comerciais ou de cooperativas (art. 1º, § 1º, II, c do Anexo II ao RICMS);SEFAZ MS;Secretaria de Estado de Fazenda de Mato Grosso do Sul;Finanças e Impostos;https://www.ms.gov.br/financas-e-impostos/autorizacao-especifica-diferimento-do-icms-no-recebimento-de-graos-da-conab-apenas-para-estabelecimentos-industriais-ou-comerciais-ou-de-cooperativas-art-1o-1o-ii-c-do-anexo-ii-ao-regulamento-do-icms142
Autorização específica - diferimento do lançamento e do pagamento do ICMS Garantido-Abate (Decreto nº 12.056/2006) - serviço exclusivo para atacadistas de carne (CAE 4.17.00);SEFAZ MS;Secretaria de Estado de Fazenda de Mato Grosso do Sul;Finanças e Impostos;https://www.ms.gov.br/financas-e-impostos/autorizacao-especifica-diferimento-do-lancamento-e-pagamento-do-icms-incidente-na-aquisicao-de-gado-garantido-abate-decreto-no-120562006-servico-exclusivo-para-atacadistas-de-carne-cae-4170089
Autorização específica - diferimento do lançamento e do pagamento do ICMS incidente na aquisição de gado bovino e bufalino em pé para abate (Decreto nº 12.056/2006) - serviço exclusivo para frigoríficos (CAE 3.17.03);SEFAZ MS;Secretaria de Estado de Fazenda de Mato Grosso do Sul;Finanças e Impostos;https://www.ms.gov.br/financas-e-impostos/autorizacao-especifica-diferimento-do-lancamento-e-pagamento-do-icms-incidente-na-aquisicao-de-gado-em-pe-para-abate-art-2o-1o-e-art-17-d-ii-do-decreto-no-120562006-servico-exclusivo-para-frigorificos-cae-31703179
Autorização específica - dilatação do prazo para pagamento semanal do ICMS devido nas saídas interestaduais (art. 72, V do Anexo V ao RICMS) - apenas para usinas e industriais de combustíveis, derivados ou não de petróleo;SEFAZ MS;Secretaria de Estado de Fazenda de Mato Grosso do Sul;Finanças e Impostos;https://www.ms.gov.br/financas-e-impostos/autorizacao-especifica-dilatacao-do-prazo-para-pagamento-semanal-do-icms-devido-nas-saidas-interestaduais-art-72-v-do-anexo-v-ao-ricms-servico-exclusivo-para-industriais-de-combustiveis-derivados-ou-nao-de-petroleo36
Autorização específica - dilatação do prazo para pagamento semanal do ICMS devido nas saídas interestaduais (art. 72, V do Anexo V ao RICMS) - serviço exclusivo para cerealistas ou comercializadoras de cereais;SEFAZ MS;Secretaria de Estado de Fazenda de Mato Grosso do Sul;Finanças e Impostos;https://www.ms.gov.br/financas-e-impostos/autorizacao-especifica-dilatacao-do-prazo-para-pagamento-semanal-do-icms-devido-nas-saidas-interestaduais-art-72-v-do-anexo-v-ao-ricms188
Autorização específica - dilatação do prazo para pagamento semanal do ICMS devido nas saídas interestaduais - diferimento do ICMS Garantido-Abate - serviços exclusivos para atacadistas de carne (CAE 4.17.00);SEFAZ MS;Secretaria de Estado de Fazenda de Mato Grosso do Sul;Finanças e Impostos;https://www.ms.gov.br/financas-e-impostos/autorizacao-especifica-dilatacao-do-prazo-para-pagamento-semanal-do-icms-devido-nas-saidas-interestaduais-e-diferimento-do-icms-nas-operacoes-com-gado-para-abate-servico-exclusivo-para-atacadistas-de-carne-cae-4170056
Autorização específica - dilatação do prazo para pagamento semanal do ICMS devido nas saídas interestaduais - diferimento do ICMS nas operações com gado bovino e bufalino para abate ou diferimento do ICMS Garantido-Abate - exclusivo para frigoríficos;SEFAZ MS;Secretaria de Estado de Fazenda de Mato Grosso do Sul;Finanças e Impostos;https://www.ms.gov.br/financas-e-impostos/autorizacao-especifica-dilatacao-do-prazo-para-pagamento-semanal-do-icms-devido-nas-saidas-interestaduais-e-diferimento-do-icms-nas-operacoes-com-gado-para-abate-servico-exclusivo-para-frigorificos-cae-31703159
Autorização específica - dilatação do prazo para pagamento semanal do ICMS nas saídas interestaduais - empresas NÃO ENQUADRADAS como cerealistas ou comercializadoras de cereais, usinas ou industriais de combustíveis, frigoríficos e atacadistas de carne;SEFAZ MS;Secretaria de Estado de Fazenda de Mato Grosso do Sul;Finanças e Impostos;https://www.ms.gov.br/financas-e-impostos/autorizacao-especifica-dilatacao-do-prazo-p-pagamento-semanal-do-icms-devido-nas-saidas-interestaduais-p-empresas-que-nao-se-enquadram-como-cerealistas-comercializadoras-de-cereais-industriais-de-combustiveis-frigorificos-e-atacadistas-de-carne88
Autorização específica - percentual de valor diferenciado de MVA para produtos alimentícios (art. 6º-D do Anexo III ao RICMS) - apenas para indústrias de alimentos;SEFAZ MS;Secretaria de Estado de Fazenda de Mato Grosso do Sul;Finanças e Impostos;https://www.ms.gov.br/financas-e-impostos/autorizacao-especifica-concessao-percentual-de-valor-de-margem-de-valor-diferenciado-para-produtos-alimenticios80
