titulo_servico;siglaorgao;nome_orgao;categoria;url
Realizar cursos de aperfeiçoamento (carga horária acima de 120 horas);ESCOLAGOV;Fundação Escola de Governo;Educação e Pesquisa;https://www.ms.gov.br/educacao-e-pesquisa/realizar-cursos-de-aperfeicoamento-carga-horaria-acima-de-120-horas150
Realizar cursos de graduação e pós-graduação;ESCOLAGOV;Fundação Escola de Governo;Educação e Pesquisa;https://www.ms.gov.br/educacao-e-pesquisa/graduacao-tecnologo-em-gestao-publica40
Realizar denúncia ou Disque Denúncia 181;PMMS;Polícia Militar de Mato Grosso do Sul;Segurança;https://www.ms.gov.br/seguranca/16-servico-de-denuncia-181-disque-denuncia60
Realizar doação de sangue;SES;Secretaria de Estado de Saúde de Mato Grosso do Sul;Saúde e Cuidado;https://www.ms.gov.br/saude-e-cuidado/coleta-de-sangue167
Realizar exame de Doença de Aujeszky;IAGRO;Agência Estadual de Defesa Sanitária Animal Vegetal  Mato Grosso do Sul;Agropecuária e Vida Rural;https://www.ms.gov.br/agropecuaria-e-vida-rural/realizar-exame-de-doenca-de-aujeszky1
Realizar exame de Peste Suína Africana;IAGRO;Agência Estadual de Defesa Sanitária Animal Vegetal  Mato Grosso do Sul;Agropecuária e Vida Rural;https://www.ms.gov.br/agropecuaria-e-vida-rural/diagnosticar-botulismo38
Realizar exame de Síndrome Reprodutiva e Respiratória dos Suínos;IAGRO;Agência Estadual de Defesa Sanitária Animal Vegetal  Mato Grosso do Sul;Agropecuária e Vida Rural;https://www.ms.gov.br/agropecuaria-e-vida-rural/realizar-exame-de-sindrome-reprodutiva-e-respiratoria-dos-suinos22
Realizar exame de anemia infecciosa equina;IAGRO;Agência Estadual de Defesa Sanitária Animal Vegetal  Mato Grosso do Sul;Agropecuária e Vida Rural;https://www.ms.gov.br/agropecuaria-e-vida-rural/realizar-exame-de-anemia-infecciosa-equina-por-elisa79
Realizar exame de audiometria;SED MS;Secretaria de Estado de Educação de Mato Grosso do Sul;Educação e Pesquisa;https://www.ms.gov.br/educacao-e-pesquisa/exame-de-audiometria185
Realizar exame de mormo;IAGRO;Agência Estadual de Defesa Sanitária Animal Vegetal  Mato Grosso do Sul;Agropecuária e Vida Rural;https://www.ms.gov.br/agropecuaria-e-vida-rural/diagnosticar-mormo182
Realizar exame de peste suína clássica;IAGRO;Agência Estadual de Defesa Sanitária Animal Vegetal  Mato Grosso do Sul;Agropecuária e Vida Rural;https://www.ms.gov.br/agropecuaria-e-vida-rural/diagnosticar-anemia-infecciosa-equina73
Realizar inscrição no programa vencendo o medo de dirigir;DETRAN;Departamento Estadual de Trânsito de Mato Grosso do Sul;Trânsito e Transportes;https://www.ms.gov.br/transito-e-transportes/realizar-inscricao-no-programa-vencendo-o-medo-de-dirigir15
Realizar programa ou cursos de capacitação continuada;ESCOLAGOV;Fundação Escola de Governo;Educação e Pesquisa;https://www.ms.gov.br/educacao-e-pesquisa/realizar-programa-ou-cursos-de-capacitacao-continuada91
Realizar transferência do registro no Serviço de Inspeção Estadual (SIE);IAGRO;Agência Estadual de Defesa Sanitária Animal Vegetal  Mato Grosso do Sul;Empresa, Indústria e Comércio;https://www.ms.gov.br/empresa-industria-e-comercio/transferencia-de-sie-alteracao-de-razao-social7
Realização de cursos, palestras e formações em Direitos Humanos;UEMS;Universidade Estadual de Mato Grosso do Sul;Educação e Pesquisa;https://www.ms.gov.br/educacao-e-pesquisa/realizacao-de-cursos-palestras-e-formacoes-em-direitos-humanos46
Receber apoio para emitir o contracheque (aposentado ou pensionista);AGEPREV;Agência de Previdência Social de Mato Grosso do Sul;Trabalho, Emprego e Previdência;https://www.ms.gov.br/trabalho-emprego-e-previdencia/receber-apoio-para-emitir-o-contracheque-aposentado-ou-pensionista12
Receber apoio para viver bem após a aposentadoria e a pensão (Apoio psicossocial e previdenciário);AGEPREV;Agência de Previdência Social de Mato Grosso do Sul;Trabalho, Emprego e Previdência;https://www.ms.gov.br/trabalho-emprego-e-previdencia/receber-apoio-para-viver-bem-apos-a-aposentadoria-e-a-pensao5
Receber orientação para entrar no mercado de trabalho, com apoio da previdência (Jovem Pensionista);AGEPREV;Agência de Previdência Social de Mato Grosso do Sul;Trabalho, Emprego e Previdência;https://www.ms.gov.br/trabalho-emprego-e-previdencia/receber-orientacao-para-entrar-no-mercado-de-trabalho-com-apoio-da-previdencia20
Receber orientações sobre seus direitos e deveres previdenciários, por meio do PROEP - Programa de Educação Previdenciária do Regime Próprio de Previdência Social de MS;AGEPREV;Agência de Previdência Social de Mato Grosso do Sul;Trabalho, Emprego e Previdência;https://www.ms.gov.br/trabalho-emprego-e-previdencia/receber-orientacoes-sobre-seus-direitos-e-deveres-previdenciario-por-meio-do-proep-programa-de-educacao-previdenciaria-do-regime-proprio-de-previdencia-social-de-ms137
Recebimento de doação de livros;UEMS;Universidade Estadual de Mato Grosso do Sul;Educação e Pesquisa;https://www.ms.gov.br/educacao-e-pesquisa/recebimento-de-doacao-de-livros24
Reclame jucems;JUCEMS;Junta Comercial do Estado de Mato Grosso do Sul;Comunicação e Transparência;https://www.ms.gov.br/comunicacao-e-transparencia/reclame-jucems109
Recorrer das multas de trânsito em rodovias de MS;AGESUL;Agência Estadual de Gestão de Empreendimentos de Mato Grosso do Sul;Trânsito e Transportes;https://www.ms.gov.br/transito-e-transportes/divisao-de-multas-dim140
Recorrer de notificação ou autuação oriunda de fiscalização da AGEMS;AGEMS;Agência Estadual de Regulação de Serviços Públicos de Mato Grosso do Sul;Administração Pública;https://www.ms.gov.br/administracao-publica/recorrer-de-notificacao-ou-autuacao-oriunda-de-fiscalizacao-da-agems2
Recuperação de senha Microsoft e do e-mail institucional;UEMS;Universidade Estadual de Mato Grosso do Sul;Educação e Pesquisa;https://www.ms.gov.br/educacao-e-pesquisa/recuperacao-de-senha-microsoft-e-do-e-mail-institucional46
Recuperação de senha do login UEMS;UEMS;Universidade Estadual de Mato Grosso do Sul;Educação e Pesquisa;https://www.ms.gov.br/educacao-e-pesquisa/recuperacao-de-senha-do-login-uems190
Redefinir a senha do login de rede;SEGOV MS;Secretaria de Estado de Governo e Gestão Estratégica de Mato Grosso do Sul;Ciência e Tecnologia;https://www.ms.gov.br/ciencia-e-tecnologia/redefinir-a-senha-do-login-de-rede115
Redefinir senha - LEGISLAÇÃO;SEGOV MS;Secretaria de Estado de Governo e Gestão Estratégica de Mato Grosso do Sul;Ciência e Tecnologia;https://www.ms.gov.br/ciencia-e-tecnologia/redefinir-senha-legislacao198
Redefinir senha de e-mail SIRIEMA;SEGOV MS;Secretaria de Estado de Governo e Gestão Estratégica de Mato Grosso do Sul;Ciência e Tecnologia;https://www.ms.gov.br/ciencia-e-tecnologia/redefinir-senha-de-e-mail-siriema162
Redefinir senha do e-mail oficial;SEGOV MS;Secretaria de Estado de Governo e Gestão Estratégica de Mato Grosso do Sul;Ciência e Tecnologia;https://www.ms.gov.br/ciencia-e-tecnologia/redefinir-senha-do-e-mail-oficial45
Redefinição de senha do login UEMS dos alunos de pós-graduação;UEMS;Universidade Estadual de Mato Grosso do Sul;Educação e Pesquisa;https://www.ms.gov.br/educacao-e-pesquisa/redefinicao-de-senha-do-login-uems-dos-alunos-de-pos-graduacao191
Reemitir ou substituir DAEMS vencida;IAGRO;Agência Estadual de Defesa Sanitária Animal Vegetal  Mato Grosso do Sul;Agropecuária e Vida Rural;https://www.ms.gov.br/agropecuaria-e-vida-rural/reemitir-ou-substituir-daems-vencida20
Regime especial - PROEXPRP - Ponta Porã (art. 5º-A do Decreto nº 14.426/2016);SEFAZ MS;Secretaria de Estado de Fazenda de Mato Grosso do Sul;Finanças e Impostos;https://www.ms.gov.br/financas-e-impostos/regime-especial-proexprp-ponta-pora-art-5o-a-do-dec-144262016129
Regime especial - PROEXPRP - programa de estímulo à exportação pelos portos do rio Paraguai (art. 1º, § único, inciso I do Decreto nº 14.426/2016);SEFAZ MS;Secretaria de Estado de Fazenda de Mato Grosso do Sul;Finanças e Impostos;https://www.ms.gov.br/financas-e-impostos/regime-especial-proexprp-programa-de-estimulo-a-exportacao-pelos-portos-do-rio-paraguai-art-1o-unico-inciso-i-do-dec-14426201678
Regime especial - concessão ou renovação de tratamento diferenciado no cumprimento de obrigações tributárias relativas ao ICMS na prestação de serviço de transporte e na armazenagem de etanol combustível pelo sistema dutoviário;SEFAZ MS;Secretaria de Estado de Fazenda de Mato Grosso do Sul;Finanças e Impostos;https://www.ms.gov.br/financas-e-impostos/regime-especial-concessao-ou-renovacao-de-tratamento-diferenciado-no-cumprimento-de-obrigacoes-tributarias-relativas-ao-icms-na-prestacao-de-servico-de-transporte-e-na-armazenagem-de-etanol-combustivel-pelo-sistema-dutoviario156
Regime especial - dilatação de prazo para pagamento mensal do ICMS diferencial de alíquota devido na entrada de mercadorias destinadas ao uso, consumo ou ativo fixo (art. 4º, I, b do Anexo V ao RICMS);SEFAZ MS;Secretaria de Estado de Fazenda de Mato Grosso do Sul;Finanças e Impostos;https://www.ms.gov.br/financas-e-impostos/regime-especial-dilatacao-de-prazo-para-pagamento-mensal-do-icms-diferencial-de-aliquotas-devido-na-entrada-de-mercadorias-destinadas-ao-uso-consumo-ou-ativo-fixo-art-4o-i-b-do-anexo-v-ao-ricms52
Regime especial - dilatação de prazo para pagamento, por período mensal, do ICMS devido nas saídas interestaduais de soja e farelo de soja - indústrias de óleo de soja (art. 4º, I, a do Anexo V ao RICMS, c/c art. 74, III do RICMS);SEFAZ MS;Secretaria de Estado de Fazenda de Mato Grosso do Sul;Finanças e Impostos;https://www.ms.gov.br/financas-e-impostos/regime-especial-dilatacao-do-prazo-para-pagamento-mensal-do-icms-devido-nas-saidas-interestaduais-de-soja-e-farelo-de-soja-apenas-para-industrias-de-oleo-de-soja-art-4o-i-a-do-anexo-v-ao-ricms-combinado-com-art-74-iii-do-regulamento-do-icms-r13
Regime especial - dilatação de prazo para pagamento, por período quinzenal, do ICMS ST devido na entrada de mercadorias no estado - concessionárias de veículos ou máquinas agrícolas (art. 4º, I, b do Anexo V ao RICMS e art. 5º do Decreto nº 14.383/2016);SEFAZ MS;Secretaria de Estado de Fazenda de Mato Grosso do Sul;Finanças e Impostos;https://www.ms.gov.br/financas-e-impostos/regime-especial-dilatacao-de-prazo-para-pagamento-quinzenal-do-icms-substituicao-tributaria-devido-na-entrada-de-mercadorias-no-estado-de-ms-apenas-para-concessionarias-de-veiculos-ou-de-maquinas-agricolas50
Regime especial - dilatação de prazo para pagamento, por período quinzenal, do ICMS substituição tributária devido na entrada de mercadorias no estado de MS (art. 4º, I, b do Anexo V ao RICMS);SEFAZ MS;Secretaria de Estado de Fazenda de Mato Grosso do Sul;Finanças e Impostos;https://www.ms.gov.br/financas-e-impostos/regime-especial-dilatacao-de-prazo-para-pagamento-quinzenal-do-icms-substituicao-tributaria-devido-na-entrada-de-mercadorias-no-estado-de-ms-art-4o-i-b-do-anexo-v-ao-ricms187
Regime especial - frigorífico de outra UF - cadastro como substituto tributário responsável pelo pagamento da diferença de peso ou preço - frigoríficos do estado de São Paulo (Protocolo ICMS 03/88);SEFAZ MS;Secretaria de Estado de Fazenda de Mato Grosso do Sul;Finanças e Impostos;https://www.ms.gov.br/financas-e-impostos/regime-especial-frigorifico-de-outra-uf-cadastro-como-substituto-tributario-responsavel-pelo-pagamento-da-diferenca-de-peso-ou-preco-apenas-para-frigorificos-do-estado-de-sao-paulo-prot-icms-0388146
Regime especial - operações de exportação, saídas com o fim específico de exportação e remessas para formação de lote de produtos in natura soja e milho em grãos (Decreto nº 11.803/2005) - cerealista/comercializador de soja e/ou milho;SEFAZ MS;Secretaria de Estado de Fazenda de Mato Grosso do Sul;Finanças e Impostos;https://www.ms.gov.br/financas-e-impostos/regime-especial-apenas-para-cerealistacomercializador-de-soja-eou-milho-permissao-para-realizar-operacoes-de-exportacao-de-saidas-com-o-fim-especifico-de-exportacao-e-de-remessas-para-formacao-de-lote-de-produtos-in-natura-soja-e-milho-em-graos187
Regime especial - operações de exportação, saídas com o fim específico de exportação e remessas para formação de lote de produtos in natura, inclusive algodão em pluma, exceto soja e milho (Decreto nº 11.803/2005);SEFAZ MS;Secretaria de Estado de Fazenda de Mato Grosso do Sul;Finanças e Impostos;https://www.ms.gov.br/financas-e-impostos/regime-especial-permissao-para-realizar-operacoes-de-exportacao-de-saidas-com-o-fim-especifico-de-exportacao-e-de-remessas-para-formacao-de-lote-de-produtos-in-natura-inclusive-algodao-em-pluma-dec-118032005128
Regime especial - operações de exportação, saídas com o fim específico de exportação e remessas para formação de lote de produtos industrializados ou semielaborados (Decreto nº 11.803/2005);SEFAZ MS;Secretaria de Estado de Fazenda de Mato Grosso do Sul;Finanças e Impostos;https://www.ms.gov.br/financas-e-impostos/regime-especial-permissao-para-realizar-operacoes-de-exportacao-de-saidas-com-o-fim-especifico-de-exportacao-e-de-remessas-para-formacao-de-lote-de-produtos-industrializados-ou-semielaborados-dec-11803200558
Regime especial - operações de exportação, saídas com o fim específico de exportação e remessas para formação de lote de produtos industrializados ou semielaborados (Decreto nº 11.803/2005) - frigoríficos;SEFAZ MS;Secretaria de Estado de Fazenda de Mato Grosso do Sul;Finanças e Impostos;https://www.ms.gov.br/financas-e-impostos/regime-especial-apenas-para-frigorificos-permissao-para-realizar-operacoes-de-exportacao-de-saidas-com-o-fim-especifico-de-exportacao-e-de-remessas-para-formacao-de-lote-de-produtos-industrializados-ou-semielaborados-dec-118032005148
Regime especial - operações de exportação, saídas com o fim específico de exportação e remessas para formação de lote de produtos industrializados ou semielaborados (Decreto nº 11.803/2005) - indústrias de combustíveis e usinas de açúcar e álcool;SEFAZ MS;Secretaria de Estado de Fazenda de Mato Grosso do Sul;Finanças e Impostos;https://www.ms.gov.br/financas-e-impostos/regime-especial-apenas-p-industrias-de-combustiveis-e-usinas-de-acucar-e-alcool-permissao-p-realizar-operacoes-de-exportacao-saidas-com-o-fim-especifico-de-exportacao-e-de-remessas-p-formacao-de-lote-de-produtos-industrializados-ou-semielaborados6
Regime especial - substituto tributário do ICMS devido sobre autopeças adquiridas em outra Unidade da Federação - apenas para atacadistas/distribuidoras de autopeças (art. 4º, I, c, 4 do Anexo V ao RICMS e art. 5º do Decreto nº 14.383/2016);SEFAZ MS;Secretaria de Estado de Fazenda de Mato Grosso do Sul;Finanças e Impostos;https://www.ms.gov.br/financas-e-impostos/regime-especial-substituto-tributario-do-icms-devido-sobre-autopecas-adquiridas-em-outra-unidade-da-federacao-apenas-para-atacadistasdistribuidoras-de-autopecas-art-4o-i-c-4-do-anexo-v-ao-ricms-e-art-5o-do-dec-143832016183
Regime especial - substituto tributário responsável pelo pagamento semanal do ICMS Transporte devido por transportadora desta ou de outra UF ou por transportador autônomo (Decreto nº 14.923/2018);SEFAZ MS;Secretaria de Estado de Fazenda de Mato Grosso do Sul;Finanças e Impostos;https://www.ms.gov.br/financas-e-impostos/regime-especial-substituto-tributario-responsavel-pelo-pagamento-semanal-do-icms-transporte-devido-por-transportadora-de-outra-uf-ou-por-transportador-autonomo-dec-149232018163
Regime especial - transportador ferroviário deste estado apurar e recolher o ICMS transporte por período mensal (art. 50 do Anexo V ao RICMS, Ajuste SINIEF 19/89);SEFAZ MS;Secretaria de Estado de Fazenda de Mato Grosso do Sul;Finanças e Impostos;https://www.ms.gov.br/financas-e-impostos/regime-especial-transportador-ferroviario-deste-estado-apurar-e-recolher-o-icms-transporte-por-periodo-mensal-art-50-do-anexo-v-ao-ricms-ajuste-sinief-198960
Regime especial - transportadora conveniada por meio de Termo de Acordo para atuar como fiel depositária das mercadorias que transporta (Anexo XII ao RICMS);SEFAZ MS;Secretaria de Estado de Fazenda de Mato Grosso do Sul;Finanças e Impostos;https://www.ms.gov.br/financas-e-impostos/regime-especial-transportadora-conveniada-por-meio-de-termo-de-acordo-para-atuar-como-fiel-depositaria-das-mercadorias-que-transporta-anexo-xii-ao-ricms99
Regime especial para facilitar o cumprimento de obrigação acessória (art. 4º, II do Anexo V ao RICMS);SEFAZ MS;Secretaria de Estado de Fazenda de Mato Grosso do Sul;Finanças e Impostos;https://www.ms.gov.br/financas-e-impostos/regime-especial-para-facilitar-o-cumprimento-de-obrigacao-acessoria-art-4o-ii-do-anexo-v-ao-ricms73
Registrar Denúncia;FCMS;Fundação de Cultura de Mato Grosso do Sul;Comunicação e Transparência;https://www.ms.gov.br/comunicacao-e-transparencia/denuncia65
Registrar Reclamação, Solicitação, Sugestão e Elogio;FADEB;Fundação da Apoio e Desenvolvimento à Educação Básica;Administração Pública;https://www.ms.gov.br/administracao-publica/registar-reclamacao-solicitacao-sugestao-e-elogio98
Registrar Relatório Semestral Fitossanitário de Área de Citros;IAGRO;Agência Estadual de Defesa Sanitária Animal Vegetal  Mato Grosso do Sul;Agropecuária e Vida Rural;https://www.ms.gov.br/agropecuaria-e-vida-rural/declarar-semestralmente-as-condicoes-fitossanitarias-da-area-de-citros-cadastrada16
Registrar a entrega de solicitações, acompanhadas ou não de documentos e de processos no setor de protocolo registro e arquivo;AGEPREV;Agência de Previdência Social de Mato Grosso do Sul;Trabalho, Emprego e Previdência;https://www.ms.gov.br/trabalho-emprego-e-previdencia/servico-de-protocolo-recebimento-registro-envio-e-arquivamento-de-documentos-ou-processos-administrativos-e-previdenciarios17
Registrar a vacinação contra brucelose;IAGRO;Agência Estadual de Defesa Sanitária Animal Vegetal  Mato Grosso do Sul;Agropecuária e Vida Rural;https://www.ms.gov.br/agropecuaria-e-vida-rural/registrar-a-vacinacao-contra-brucelose179
Registrar abertura ou alteração de empresa;JUCEMS;Junta Comercial do Estado de Mato Grosso do Sul;Empresa, Indústria e Comércio;https://www.ms.gov.br/empresa-industria-e-comercio/registrar-abertura-de-empresa14
Registrar boletim de ocorrências on-line;PCMS;Polícia Civil de Mato Grosso do Sul;Segurança;https://www.ms.gov.br/seguranca/delegacia-virtual-devir105
Registrar boletins de ocorrência - B.O.;PCMS;Polícia Civil de Mato Grosso do Sul;Segurança;https://www.ms.gov.br/seguranca/registro-de-boletins-de-ocorrencia-depac126
Registrar denúncia;JUCEMS;Junta Comercial do Estado de Mato Grosso do Sul;Comunicação e Transparência;https://www.ms.gov.br/comunicacao-e-transparencia/registrar-denuncia6
Registrar denúncia;FUNTRAB;Fundação de Trabalho de Mato Grosso do Sul;Comunicação e Transparência;https://www.ms.gov.br/comunicacao-e-transparencia/registrar-denuncia76
Registrar denúncia;AGEMS;Agência Estadual de Regulação de Serviços Públicos de Mato Grosso do Sul;Comunicação e Transparência;https://www.ms.gov.br/comunicacao-e-transparencia/registrar-denuncia195
Registrar denúncia;CGP;Coordenadoria Geral de Perícias de Mato Grosso do Sul;Comunicação e Transparência;https://www.ms.gov.br/comunicacao-e-transparencia/registrar-denuncia58
Registrar denúncia;PGE MS;Procuradoria Geral do Estado de Mato Grosso do Sul;Administração Pública;https://www.ms.gov.br/administracao-publica/denuncias8
Registrar denúncia;SANESUL;Empresa de Saneamento de Mato Grosso do Sul;Comunicação e Transparência;https://www.ms.gov.br/comunicacao-e-transparencia/registrar-denuncia124
Registrar denúncia;AGRAER;Agência de Desenvolvimento Agrário e Extensão Rural de Mato Grosso do Sul;Comunicação e Transparência;https://www.ms.gov.br/comunicacao-e-transparencia/registrar-denuncia100
Registrar denúncia;SETESC;Secretaria de Estado de Turismo, Esporte e Cultura;Comunicação e Transparência;https://www.ms.gov.br/comunicacao-e-transparencia/denuncia18
Registrar denúncia;AGEPEN;Agência Estadual de Administração do Sistema Penitenciário;Comunicação e Transparência;https://www.ms.gov.br/comunicacao-e-transparencia/ouvidoria50
Registrar denúncia;CGE MS;Controladoria Geral do Estado de Mato Grosso do Sul;Comunicação e Transparência;https://www.ms.gov.br/comunicacao-e-transparencia/registrar-denuncia53
Registrar denúncia;FADEB;Fundação da Apoio e Desenvolvimento à Educação Básica;Comunicação e Transparência;https://www.ms.gov.br/comunicacao-e-transparencia/denuncia182
Registrar denúncia;AGEPREV;Agência de Previdência Social de Mato Grosso do Sul;Comunicação e Transparência;https://www.ms.gov.br/comunicacao-e-transparencia/registrar-denuncia110
Registrar denúncia;FUNDTUR;Fundação de Turismo de Mato Grosso do Sul;Comunicação e Transparência;https://www.ms.gov.br/comunicacao-e-transparencia/registrar-denuncia80
Registrar denúncia;AGEHAB;Agência de Habitação Popular de Mato Grosso do Sul;Comunicação e Transparência;https://www.ms.gov.br/comunicacao-e-transparencia/registrar-denuncia92
Registrar denúncia;AEM;Agência Estadual de Metrologia de Mato Grosso do Sul;Comunicação e Transparência;https://www.ms.gov.br/comunicacao-e-transparencia/registrar-denuncia139
Registrar denúncia;SEJUSP;Secretaria de Estado de Justiça e Segurança Pública de Mato Grosso do Sul;Segurança;https://www.ms.gov.br/seguranca/denuncia16
Registrar denúncia;CBMMS;Corpo de Bombeiros Militar;Comunicação e Transparência;https://www.ms.gov.br/comunicacao-e-transparencia/registrar-denuncia32
Registrar denúncia;SEFAZ MS;Secretaria de Estado de Fazenda de Mato Grosso do Sul;Comunicação e Transparência;https://www.ms.gov.br/comunicacao-e-transparencia/registrar-denuncia34
Registrar denúncia;IAGRO;Agência Estadual de Defesa Sanitária Animal Vegetal  Mato Grosso do Sul;Comunicação e Transparência;https://www.ms.gov.br/comunicacao-e-transparencia/registrar-denuncia116
Registrar denúncia;DETRAN;Departamento Estadual de Trânsito de Mato Grosso do Sul;Comunicação e Transparência;https://www.ms.gov.br/comunicacao-e-transparencia/registrar-denuncia171
Registrar denúncia;SEGOV MS;Secretaria de Estado de Governo e Gestão Estratégica de Mato Grosso do Sul;Comunicação e Transparência;https://www.ms.gov.br/comunicacao-e-transparencia/registrar-denuncia152
Registrar denúncia;FERTEL - Educativa MS;Fundação Estadual Jornalista Luiz Chagas de Rádio e Televisão;Comunicação e Transparência;https://www.ms.gov.br/comunicacao-e-transparencia/denuncia78
Registrar denúncia;FUNDESPORTE;Fundação de Desporto e Lazer de Mato Grosso do Sul;Comunicação e Transparência;https://www.ms.gov.br/comunicacao-e-transparencia/registrar-denuncia72
Registrar denúncia;SED MS;Secretaria de Estado de Educação de Mato Grosso do Sul;Comunicação e Transparência;https://www.ms.gov.br/comunicacao-e-transparencia/registrar-denuncia23
Registrar denúncia;SEC;Secretaria de Estado da Cidadania;Comunicação e Transparência;https://www.ms.gov.br/comunicacao-e-transparencia/registrar-denuncia148
Registrar denúncia;FUNSAU;Fundação Serviços de Saúde de MS;Comunicação e Transparência;https://www.ms.gov.br/comunicacao-e-transparencia/registrar-denuncia47
Registrar denúncia;SEILOG;Secretaria de Estado de Infraestrutura e Logística de Mato Grosso do Sul;Comunicação e Transparência;https://www.ms.gov.br/comunicacao-e-transparencia/registrar-denuncia103
Registrar denúncia;SAD;Secretaria de Estado de Administração de Mato Grosso do Sul;Comunicação e Transparência;https://www.ms.gov.br/comunicacao-e-transparencia/registrar-denuncia4
Registrar denúncia;ESCOLAGOV;Fundação Escola de Governo;Comunicação e Transparência;https://www.ms.gov.br/comunicacao-e-transparencia/registrar-denuncia28
Registrar denúncia;AGESUL;Agência Estadual de Gestão de Empreendimentos de Mato Grosso do Sul;Comunicação e Transparência;https://www.ms.gov.br/comunicacao-e-transparencia/registrar-denuncia26
Registrar denúncia;PMMS;Polícia Militar de Mato Grosso do Sul;Comunicação e Transparência;https://www.ms.gov.br/comunicacao-e-transparencia/registrar-denuncia160
Registrar denúncia;SEAD;Secretaria de Estado de Assistência Social e Direitos Humanos;Comunicação e Transparência;https://www.ms.gov.br/comunicacao-e-transparencia/registrar-denuncia77
Registrar denúncia;SEMADESC;Secretaria de Estado de Meio Ambiente, Desenvolvimento, Ciência, Tecnologia e Inovação de Mato Grosso do Sul;Meio Ambiente;https://www.ms.gov.br/meio-ambiente/denuncia54
Registrar denúncia;IMASUL;Instituto de Meio Ambiente de Mato Grosso do Sul;Comunicação e Transparência;https://www.ms.gov.br/comunicacao-e-transparencia/registrar-denuncia18
Registrar denúncia;UEMS;Universidade Estadual de Mato Grosso do Sul;Comunicação e Transparência;https://www.ms.gov.br/comunicacao-e-transparencia/registrar-denuncia127
Registrar denúncia;FUNDECT;Fundação de Apoio ao Desenvolvimento do Ensino, Ciência e Tecnologia de Mato Grosso do Sul;Comunicação e Transparência;https://www.ms.gov.br/comunicacao-e-transparencia/registrar-denuncia14
Registrar denúncia;SES;Secretaria de Estado de Saúde de Mato Grosso do Sul;Comunicação e Transparência;https://www.ms.gov.br/comunicacao-e-transparencia/registrar-denuncia81
Registrar denúncia;PCMS;Polícia Civil de Mato Grosso do Sul;Direitos e Cidadania;https://www.ms.gov.br/direitos-e-cidadania/denuncia103
Registrar elogio aos servidores;AGEPEN;Agência Estadual de Administração do Sistema Penitenciário;Comunicação e Transparência;https://www.ms.gov.br/comunicacao-e-transparencia/teste-4189
