titulo_servico;siglaorgao;nome_orgao;categoria;url
Solicitar atendimento para ações de defesa civil;CBMMS;Corpo de Bombeiros Militar;Forças Armadas e Defesa Civil;https://www.ms.gov.br/forcas-armadas-e-defesa-civil/solicitar-atendimento-para-acoes-de-defesa-civil189
Solicitar atendimento para reinserção social do egresso;AGEPEN;Agência Estadual de Administração do Sistema Penitenciário;Direitos e Cidadania;https://www.ms.gov.br/direitos-e-cidadania/atendimento-ao-egresso133
Solicitar atendimento pelo Programa Direitos Humanos em Ação;SEAD;Secretaria de Estado de Assistência Social e Direitos Humanos;Direitos e Cidadania;https://www.ms.gov.br/direitos-e-cidadania/solicitacao-do-programa-direitos-humanos-em-acao171
Solicitar atendimento pelo centro especializado de Atendimento à Mulher, à Criança e ao Adolescente em Situação de Violência - CEAMCA;SEC;Secretaria de Estado da Cidadania;Direitos e Cidadania;https://www.ms.gov.br/direitos-e-cidadania/solicitar-atendimento-pelo-centro-especializado-de-atendimento-a-mulher-ceam181
Solicitar atendimento pré-hospitalar;CBMMS;Corpo de Bombeiros Militar;Segurança;https://www.ms.gov.br/seguranca/solicitar-atendimento-pre-hospitalar87
Solicitar atendimento religioso a pacientes internados e familiares;FUNSAU;Fundação Serviços de Saúde de MS;Saúde e Cuidado;https://www.ms.gov.br/saude-e-cuidado/servico-de-capelania-hospitalar40
Solicitar atendimento técnico para acesso a recursos financeiros disponibilizados por instituições do sistema nacional de crédito rural;AGRAER;Agência de Desenvolvimento Agrário e Extensão Rural de Mato Grosso do Sul;Agropecuária e Vida Rural;https://www.ms.gov.br/agropecuaria-e-vida-rural/credito-rural132
Solicitar atendimento via whatsapp;AGEHAB;Agência de Habitação Popular de Mato Grosso do Sul;Habitação;https://www.ms.gov.br/habitacao/atendimento-via-whatsapp25
Solicitar atestado de permanência carcerária;AGEPEN;Agência Estadual de Administração do Sistema Penitenciário;Direitos e Cidadania;https://www.ms.gov.br/direitos-e-cidadania/solicitar-atestado-de-permanencia-carceraria48
Solicitar atualização de dados cadastrais do acadêmico;UEMS;Universidade Estadual de Mato Grosso do Sul;Educação e Pesquisa;https://www.ms.gov.br/educacao-e-pesquisa/atualizacao-de-dados-cadastrais-do-academico173
Solicitar atualização de dados cadastrais no SAU - Sistema Acadêmico da UEMS;UEMS;Universidade Estadual de Mato Grosso do Sul;Educação e Pesquisa;https://www.ms.gov.br/educacao-e-pesquisa/atualizacao-de-dados-cadastrais-no-sau-sistema-academico-da-uems70
Solicitar aumento de quota de e-mail Oficial;SEGOV MS;Secretaria de Estado de Governo e Gestão Estratégica de Mato Grosso do Sul;Ciência e Tecnologia;https://www.ms.gov.br/ciencia-e-tecnologia/solicitar-aumento-de-quota-de-e-mail-oficial87
Solicitar autorização ambiental para Corte Isolado de Árvores Nativas (CANI);IMASUL;Instituto de Meio Ambiente de Mato Grosso do Sul;Meio Ambiente;https://www.ms.gov.br/meio-ambiente/corte-isolado-de-arvores-nativas-cani195
Solicitar autorização ambiental para a pesca amadora e/ou desportiva;IMASUL;Instituto de Meio Ambiente de Mato Grosso do Sul;Meio Ambiente;https://www.ms.gov.br/meio-ambiente/emissao-de-autorizacoes-ambientais-para-a-pesca-amadora116
Solicitar autorização ambiental para manejo de fauna ex situ;IMASUL;Instituto de Meio Ambiente de Mato Grosso do Sul;Meio Ambiente;https://www.ms.gov.br/meio-ambiente/solicitar-autorizacao-ambiental-para-manejo-de-fauna-ex-situ185
Solicitar autorização ambiental para pesca profissional;IMASUL;Instituto de Meio Ambiente de Mato Grosso do Sul;Meio Ambiente;https://www.ms.gov.br/meio-ambiente/emissao-de-autorizacoes-ambientais-para-a-pesca-profissional86
Solicitar autorização especial de trânsito - A.E.T;AGESUL;Agência Estadual de Gestão de Empreendimentos de Mato Grosso do Sul;Trânsito e Transportes;https://www.ms.gov.br/transito-e-transportes/aet-autorizacao-especial-de-transito170
Solicitar autorização para eventos com aglomeração de animais;IAGRO;Agência Estadual de Defesa Sanitária Animal Vegetal  Mato Grosso do Sul;Agropecuária e Vida Rural;https://www.ms.gov.br/agropecuaria-e-vida-rural/solicitar-autorizacao-para-realizacao-de-eventos-com-aglomeracao-de-animais194
Solicitar autorização para oferta da educação profissional técnica de nível médio;SED MS;Secretaria de Estado de Educação de Mato Grosso do Sul;Educação e Pesquisa;https://www.ms.gov.br/educacao-e-pesquisa/autorizacao-para-a-oferta-da-educacao-profissional-tecnica-de-nivel-medio149
Solicitar autorização para prestação de assistência religiosa;AGEPEN;Agência Estadual de Administração do Sistema Penitenciário;Assistência Social;https://www.ms.gov.br/assistencia-social/solicitar-cadastro-para-prestacao-de-assistencia-religiosa21
Solicitar avaliação funcional da visão;SED MS;Secretaria de Estado de Educação de Mato Grosso do Sul;Educação e Pesquisa;https://www.ms.gov.br/educacao-e-pesquisa/solicitar-avaliacao-funcional-da-visao69
Solicitar avaliação para identificação para Altas Habilidades ou Superdotação;SED MS;Secretaria de Estado de Educação de Mato Grosso do Sul;Educação e Pesquisa;https://www.ms.gov.br/educacao-e-pesquisa/solicitar-avaliacao-para-identificacao-para-altas-habilidades-ou-superdotacao-ceamahs120
Solicitar baixa de Hipoteca do Programa Nacional de Crédito Fundiário - PNCF;AGRAER;Agência de Desenvolvimento Agrário e Extensão Rural de Mato Grosso do Sul;Agropecuária e Vida Rural;https://www.ms.gov.br/agropecuaria-e-vida-rural/solicitacao-de-baixa-de-hipoteca-do-programa-nacional-de-credito-fundiario-pncf107
Solicitar baixa definitiva do veículo;DETRAN;Departamento Estadual de Trânsito de Mato Grosso do Sul;Trânsito e Transportes;https://www.ms.gov.br/transito-e-transportes/solicitacao-de-baixa-definitiva-de-cadastro-de-veiculo55
Solicitar benefício da tarifa social;SANESUL;Empresa de Saneamento de Mato Grosso do Sul;Empresa, Indústria e Comércio;https://www.ms.gov.br/empresa-industria-e-comercio/solicitar-tarifa-social107
Solicitar bloqueio de ligação de telemarketing;SEAD;Secretaria de Estado de Assistência Social e Direitos Humanos;Direitos e Cidadania;https://www.ms.gov.br/direitos-e-cidadania/solicitar-bloqueio-de-ligacao-de-telemaketing22
Solicitar bolsa de pós-graduação – PIBAP;UEMS;Universidade Estadual de Mato Grosso do Sul;Educação e Pesquisa;https://www.ms.gov.br/educacao-e-pesquisa/041-propp-programa-institucional-de-bolsas-aos-alunos-da-pos-graduacao-pibap155
Solicitar busca e salvamento de pessoas ou bens;CBMMS;Corpo de Bombeiros Militar;Segurança;https://www.ms.gov.br/seguranca/solicitar-busca-e-salvamento-de-pessoas-ou-bens119
Solicitar cadastramento da agricultura rural familiar;AGRAER;Agência de Desenvolvimento Agrário e Extensão Rural de Mato Grosso do Sul;Agropecuária e Vida Rural;https://www.ms.gov.br/agropecuaria-e-vida-rural/cadastramento-da-agricultura-familiar82
Solicitar cadastramento de doador voluntário de medula óssea;SES;Secretaria de Estado de Saúde de Mato Grosso do Sul;Saúde e Cuidado;https://www.ms.gov.br/saude-e-cuidado/doar-medula-ossea153
Solicitar cadastro de atividades complementares de ensino (ACE);UEMS;Universidade Estadual de Mato Grosso do Sul;Educação e Pesquisa;https://www.ms.gov.br/educacao-e-pesquisa/cadastro-de-atividades-complementares-de-ensino-ace40
Solicitar cadastro de áreas de Florestas Plantadas.;SEMADESC;Secretaria de Estado de Meio Ambiente, Desenvolvimento, Ciência, Tecnologia e Inovação de Mato Grosso do Sul;Empresa, Indústria e Comércio;https://www.ms.gov.br/empresa-industria-e-comercio/solicitar-cadastro-de-areas-de-florestas-plantadas36
Solicitar cadastro e outorga de uso de recursos hídricos (CEURH);IMASUL;Instituto de Meio Ambiente de Mato Grosso do Sul;Meio Ambiente;https://www.ms.gov.br/meio-ambiente/outorga-de-direito-de-uso-de-recursos-hidricos-e-cadastro-estadual-de-usuario-de-recursos-hidricos-ceurh144
Solicitar cadastro e recadastro de suinoculturas;IAGRO;Agência Estadual de Defesa Sanitária Animal Vegetal  Mato Grosso do Sul;Agropecuária e Vida Rural;https://www.ms.gov.br/agropecuaria-e-vida-rural/cadastrar-recadastrar-suinoculturas-tecnificadas-suinocultura-nao-tecnificada-de-substistencia-e-suinocultura-nao-tecnificada-de-comercio-local181
Solicitar campanhas e ações educativas de trânsito;DETRAN;Departamento Estadual de Trânsito de Mato Grosso do Sul;Trânsito e Transportes;https://www.ms.gov.br/transito-e-transportes/solicitacao-de-participacao-em-campanhas-educativas-voltadas-ao-transito44
Solicitar cancelamento de GTA;IAGRO;Agência Estadual de Defesa Sanitária Animal Vegetal  Mato Grosso do Sul;Agropecuária e Vida Rural;https://www.ms.gov.br/agropecuaria-e-vida-rural/solicitar-cancelamento-de-gta33
Solicitar cancelamento de matrícula por iniciativa do acadêmico;UEMS;Universidade Estadual de Mato Grosso do Sul;Educação e Pesquisa;https://www.ms.gov.br/educacao-e-pesquisa/cancelamento-de-matricula-por-iniciativa-do-academico68
Solicitar capacitação e qualificação para atuar como agente voluntário de Defesa Civil - AVDC;SEGOV MS;Secretaria de Estado de Governo e Gestão Estratégica de Mato Grosso do Sul;Segurança;https://www.ms.gov.br/seguranca/agente-voluntario-de-defesa-civil-avdc25
Solicitar capacitação para conselheiros tutelares e municipais dos direitos da criança e do adolescente;SEAD;Secretaria de Estado de Assistência Social e Direitos Humanos;Direitos e Cidadania;https://www.ms.gov.br/direitos-e-cidadania/solicitacao-de-apoio-para-conselheiros-tutelares-e-municipais-dos-direitos-da-crianca-e-do-adolescente149
Solicitar capacitação sobre economia criativa;SETESC;Secretaria de Estado de Turismo, Esporte e Cultura;Arte e Cultura;https://www.ms.gov.br/arte-e-cultura/solicitar-capacitacao-sobre-economia-criativa66
Solicitar captação de órgãos e tecidos para transplante;SES;Secretaria de Estado de Saúde de Mato Grosso do Sul;Saúde e Cuidado;https://www.ms.gov.br/saude-e-cuidado/captacao-de-orgaos-e-tecidos-para-transplante95
Solicitar caravana da castração;SETESC;Secretaria de Estado de Turismo, Esporte e Cultura;Direitos e Cidadania;https://www.ms.gov.br/direitos-e-cidadania/caravana-da-castracao-servico-a-ser-oferecido-a-partir-de-novembro202454
Solicitar carteira de identidade;CGP;Coordenadoria Geral de Perícias de Mato Grosso do Sul;Direitos e Cidadania;https://www.ms.gov.br/direitos-e-cidadania/expedicao-de-carteira-de-identidade127
Solicitar carteira de identificação por nome social - CNS;SEC;Secretaria de Estado da Cidadania;Direitos e Cidadania;https://www.ms.gov.br/direitos-e-cidadania/solicitar-carteira-de-identificacao-por-nome-social-cns171
Solicitar carteira do Passe Livre Intermunicipal;SEAD;Secretaria de Estado de Assistência Social e Direitos Humanos;Assistência Social;https://www.ms.gov.br/assistencia-social/solicitacao-de-passe-livre-intermunicipal62
Solicitar cedência de espaço por cidadão externo;UEMS;Universidade Estadual de Mato Grosso do Sul;Educação e Pesquisa;https://www.ms.gov.br/educacao-e-pesquisa/91-unidade-universitaria-de-campo-grande-gerencia-solicitacao-de-espacos75
Solicitar certidão de inteiro teor;AGRAER;Agência de Desenvolvimento Agrário e Extensão Rural de Mato Grosso do Sul;Agropecuária e Vida Rural;https://www.ms.gov.br/agropecuaria-e-vida-rural/solicitar-certidao-de-inteiro-teor165
Solicitar certidão de legitimidade dominial;AGRAER;Agência de Desenvolvimento Agrário e Extensão Rural de Mato Grosso do Sul;Agropecuária e Vida Rural;https://www.ms.gov.br/agropecuaria-e-vida-rural/solicitar-certidao-de-legitimidade86
Solicitar certidão de localização quanto a titulação primitiva;AGRAER;Agência de Desenvolvimento Agrário e Extensão Rural de Mato Grosso do Sul;Agropecuária e Vida Rural;https://www.ms.gov.br/agropecuaria-e-vida-rural/asf46
Solicitar certidão de localização quanto ao município;AGRAER;Agência de Desenvolvimento Agrário e Extensão Rural de Mato Grosso do Sul;Agropecuária e Vida Rural;https://www.ms.gov.br/agropecuaria-e-vida-rural/solicitar-certidao-de-localizacao-quanto-ao-municipio183
Solicitar certidão de localização quanto ao município para pessoa física;AGRAER;Agência de Desenvolvimento Agrário e Extensão Rural de Mato Grosso do Sul;Agropecuária e Vida Rural;https://www.ms.gov.br/agropecuaria-e-vida-rural/solicitar-certidao-de-localizacao-quanto-ao-municipio-para-pessoa-fisica23
Solicitar certidão de veracidade de Matricula para fins de compensação de reserva ambiental;AGRAER;Agência de Desenvolvimento Agrário e Extensão Rural de Mato Grosso do Sul;Agropecuária e Vida Rural;https://www.ms.gov.br/agropecuaria-e-vida-rural/solicitar-certidao-de-veracidade-de-matricula-do-imovel-reserva-legal181
Solicitar certificado estadual de protetoras de animais de mato grosso do sul(CEPA);SETESC;Secretaria de Estado de Turismo, Esporte e Cultura;Direitos e Cidadania;https://www.ms.gov.br/direitos-e-cidadania/solicitar-certificado-estadual-de-protetoras-de-animais-de-mato-grosso-do-sulcepa16
Solicitar certificação do Ensino Médio por meio do Enem, no período de 2009 a 2012;SED MS;Secretaria de Estado de Educação de Mato Grosso do Sul;Comunicação e Transparência;https://www.ms.gov.br/comunicacao-e-transparencia/atendimento-para-esclarecimentos-sobre-certificacao-do-ensino-medio-pelo-enem-no-periodo-de-2009-a-2012114
Solicitar cessão de espaço;UEMS;Universidade Estadual de Mato Grosso do Sul;Educação e Pesquisa;https://www.ms.gov.br/educacao-e-pesquisa/151-unidade-de-aquidauana-solicitacao-de-infraestruturas-e-espacos149
Solicitar coleta e doação de leite materno;FUNSAU;Fundação Serviços de Saúde de MS;Saúde e Cuidado;https://www.ms.gov.br/saude-e-cuidado/banco-de-leite-humano135
Solicitar combate a incêndios urbanos e rurais;CBMMS;Corpo de Bombeiros Militar;Segurança;https://www.ms.gov.br/seguranca/combate-a-incendios-urbanos-e-rurais173
Solicitar concessão de bolsas de estudo;FUNDECT;Fundação de Apoio ao Desenvolvimento do Ensino, Ciência e Tecnologia de Mato Grosso do Sul;Ciência e Tecnologia;https://www.ms.gov.br/ciencia-e-tecnologia/concessao-de-bolsas-de-estudo159
Solicitar conserto de cavalete;SANESUL;Empresa de Saneamento de Mato Grosso do Sul;Empresa, Indústria e Comércio;https://www.ms.gov.br/empresa-industria-e-comercio/solicitar-conserto-de-cavalete32
Solicitar conserto de rede;SANESUL;Empresa de Saneamento de Mato Grosso do Sul;Empresa, Indústria e Comércio;https://www.ms.gov.br/empresa-industria-e-comercio/solicitar-conserto-de-rede166
Solicitar consulta de livros e catálogos de artes visuais da biblioteca do MARCO - Museu de Arte Contemporânea.;FCMS;Fundação de Cultura de Mato Grosso do Sul;Educação e Pesquisa;https://www.ms.gov.br/educacao-e-pesquisa/consulta-de-livros-e-catalogos-de-artes-visuais-da-biblioteca-do-marco76
Solicitar consulta e empréstimo de publicações, periódicos, livros e obras raras do acervo da biblioteca estadual;FCMS;Fundação de Cultura de Mato Grosso do Sul;Educação e Pesquisa;https://www.ms.gov.br/educacao-e-pesquisa/solicitar-consulta-e-emprestimo-de-publicacoes-periodicos-livros-e-obras-raras-do-acervo-da-biblioteca-estadual14
Solicitar consulta médica especializada;FUNSAU;Fundação Serviços de Saúde de MS;Saúde e Cuidado;https://www.ms.gov.br/saude-e-cuidado/ambulatorio1
Solicitar consultoria e assessoramento jurídicos;PGE MS;Procuradoria Geral do Estado de Mato Grosso do Sul;Administração Pública;https://www.ms.gov.br/administracao-publica/direcao-assessoramento-e-coordenacao-juridica39
Solicitar consultoria técnica de legislação da defesa civil;SEGOV MS;Secretaria de Estado de Governo e Gestão Estratégica de Mato Grosso do Sul;Segurança;https://www.ms.gov.br/seguranca/consultoria-tecnica-quanto-a-legislacao-da-defesa-civil58
Solicitar consumo final da ligação;SANESUL;Empresa de Saneamento de Mato Grosso do Sul;Empresa, Indústria e Comércio;https://www.ms.gov.br/empresa-industria-e-comercio/solicitar-consumo-final69
Solicitar credenciamento de agentes religiosos;SEJUSP;Secretaria de Estado de Justiça e Segurança Pública de Mato Grosso do Sul;Direitos e Cidadania;https://www.ms.gov.br/direitos-e-cidadania/credenciamento-de-agentes-religiosos39
Solicitar credenciamento de instituições no SIATER;SEMADESC;Secretaria de Estado de Meio Ambiente, Desenvolvimento, Ciência, Tecnologia e Inovação de Mato Grosso do Sul;Comunicação e Transparência;https://www.ms.gov.br/comunicacao-e-transparencia/solicitar-credenciamento-de-instrucao-de-assistencia-tecnica-e-extesao-ruralater-no-sistema-de-informacao-de-assistencia-tecnicasiater111
Solicitar credenciamento de visitante ao socioeducando;SEJUSP;Secretaria de Estado de Justiça e Segurança Pública de Mato Grosso do Sul;Administração Pública;https://www.ms.gov.br/administracao-publica/credenciamento-de-visitante-ao-socio-educando77
Solicitar credenciamento e autorização de instituições públicas e privadas para oferta da educação básica;SED MS;Secretaria de Estado de Educação de Mato Grosso do Sul;Educação e Pesquisa;https://www.ms.gov.br/educacao-e-pesquisa/credenciamento-e-autorizacao-de-instituicoes-publicas-e-privadas-para-oferta-da-educacao-basica86
Solicitar credenciamento e autorização de instituições públicas e privadas para oferta de Cursos de ensino médio, educa profissional técnica de nível médio e educ. de Jovens e adultos, nas etapas do ensino fundamental e do ensino médio, na modalidade EaD;SED MS;Secretaria de Estado de Educação de Mato Grosso do Sul;Educação e Pesquisa;https://www.ms.gov.br/educacao-e-pesquisa/credenciamento-e-autorizacao-de-instituicoes-publicas-e-privadas-para-a-oferta-de-cursos-de-ensino-medio-educacao-profissional-tecnica-de-nivel-medio-e-educacao-de-jovens-e-adultos-nas-etapas-do-ensino-fundamental-e-do-ensino-medio-na-modalidade-ead61
Solicitar credenciamento e autorização de instituições públicas e privadas para oferta de educação escolar para estudantes com necessidades educacionais especiais;SED MS;Secretaria de Estado de Educação de Mato Grosso do Sul;Educação e Pesquisa;https://www.ms.gov.br/educacao-e-pesquisa/credenciamento-e-autorizacao-de-instituicoes-publicas-e-privadas-para-oferta-de-educacao-escolar-de-estudantes-com-necessidades-educacionais-especiais70
Solicitar credenciamento e recredenciamento, autorização, reconhecimento e renovação de reconhecimento de Curso da Educação Superior;SED MS;Secretaria de Estado de Educação de Mato Grosso do Sul;Educação e Pesquisa;https://www.ms.gov.br/educacao-e-pesquisa/credenciamento-e-recredenciamento-autorizacao-reconhecimento-e-renovacao-de-reconhecimento-de-curso-da-educacao-superior128
Solicitar credenciamento e/ou renovação de credenciamento de laboratório;IMASUL;Instituto de Meio Ambiente de Mato Grosso do Sul;Meio Ambiente;https://www.ms.gov.br/meio-ambiente/solicitar-credenciamento-eou-renovacao-de-credenciamento-de-laboratorio120
Solicitar curso normal médio – habilitação para docência na educação infantil e anos iniciais do ensino fundamental;SED MS;Secretaria de Estado de Educação de Mato Grosso do Sul;Educação e Pesquisa;https://www.ms.gov.br/educacao-e-pesquisa/curso-normal-medio-habilitacao-para-docencia-na-educacao-infantil-e-anos-iniciais-do-ensino-fundamental160
Solicitar cursos de educação profissional na área da saúde;SES;Secretaria de Estado de Saúde de Mato Grosso do Sul;Saúde e Cuidado;https://www.ms.gov.br/saude-e-cuidado/cursos-de-educacao-profissional-na-area-da-saude149
Solicitar cursos técnicos e qualificação profissional - integrado, concomitante e subsequente ao ensino médio;SED MS;Secretaria de Estado de Educação de Mato Grosso do Sul;Educação e Pesquisa;https://www.ms.gov.br/educacao-e-pesquisa/oferta-de-cursos-tecnicos-e-qualificacao-profissional-nas-formas-integrada-concomitante-e-subsequente-ao-ensino-medio172
Solicitar cópia de laudos periciais;CGP;Coordenadoria Geral de Perícias de Mato Grosso do Sul;Segurança;https://www.ms.gov.br/seguranca/emissao-de-copia-de-laudos-periciais145
Solicitar cópia de processo administrativo de débito inscrito em dívida ativa;PGE MS;Procuradoria Geral do Estado de Mato Grosso do Sul;Administração Pública;https://www.ms.gov.br/administracao-publica/inscricao-em-divida-ativa-processo-administrativo74
Solicitar cópia de processo ambiental;IMASUL;Instituto de Meio Ambiente de Mato Grosso do Sul;Meio Ambiente;https://www.ms.gov.br/meio-ambiente/solicitar-pedido-de-vista-e-copia105
Solicitar cópias processuais;AGRAER;Agência de Desenvolvimento Agrário e Extensão Rural de Mato Grosso do Sul;Agropecuária e Vida Rural;https://www.ms.gov.br/agropecuaria-e-vida-rural/solicitar-copias-processuais126
Solicitar de apoio e orientação às organizações da sociedade civil;SEAD;Secretaria de Estado de Assistência Social e Direitos Humanos;Direitos e Cidadania;https://www.ms.gov.br/direitos-e-cidadania/solicitacao-de-apoio-e-orientacao-as-organizacoes-da-sociedade-civil1
Solicitar declaração de inexistência de projeto de assentamento;AGRAER;Agência de Desenvolvimento Agrário e Extensão Rural de Mato Grosso do Sul;Agropecuária e Vida Rural;https://www.ms.gov.br/agropecuaria-e-vida-rural/solicitar-declaracao-de-inexistencia-de-projeto-de-assentamento78
Solicitar declaração negativa relativo a multa ambiental;IMASUL;Instituto de Meio Ambiente de Mato Grosso do Sul;Meio Ambiente;https://www.ms.gov.br/meio-ambiente/certidao-negativa166
Solicitar deslocamento de ligação ou de cavalete de água;SANESUL;Empresa de Saneamento de Mato Grosso do Sul;Empresa, Indústria e Comércio;https://www.ms.gov.br/empresa-industria-e-comercio/solicitar-deslocamento-de-ligacao-de-cavalete-de-agua113
Solicitar desobstrução de esgoto;SANESUL;Empresa de Saneamento de Mato Grosso do Sul;Empresa, Indústria e Comércio;https://www.ms.gov.br/empresa-industria-e-comercio/solicitar-desobstrucao-de-esgoto110
Solicitar desvinculação de multas de veículos adquiridos em leilões;DETRAN;Departamento Estadual de Trânsito de Mato Grosso do Sul;Trânsito e Transportes;https://www.ms.gov.br/transito-e-transportes/solicitacao-de-desvinculacao-de-multas-de-veiculos-adquiridos-em-leiloes7
Solicitar doação de mudas;UEMS;Universidade Estadual de Mato Grosso do Sul;Educação e Pesquisa;https://www.ms.gov.br/educacao-e-pesquisa/124-unidade-universitaria-de-ivinhema-doacao-de-mudas194
Solicitar documentos relativos a vida acadêmica;SES;Secretaria de Estado de Saúde de Mato Grosso do Sul;Saúde e Cuidado;https://www.ms.gov.br/saude-e-cuidado/secretaria-academica169
Solicitar emissão da autorização para a utilização/uso e/ou ocupação das faixas de domínios;AGESUL;Agência Estadual de Gestão de Empreendimentos de Mato Grosso do Sul;Infraestrutura;https://www.ms.gov.br/infraestrutura/carta-de-anuencia134
Solicitar emissão de Carteira de Identidade Funcional;AGEPEN;Agência Estadual de Administração do Sistema Penitenciário;Segurança;https://www.ms.gov.br/seguranca/solicitar-emissao-de-carteira-de-identidade-funcional104
Solicitar emissão de certidão de atendimento de emergência;SEJUSP;Secretaria de Estado de Justiça e Segurança Pública de Mato Grosso do Sul;Administração Pública;https://www.ms.gov.br/administracao-publica/emissao-de-certidao-de-atendimento66
Solicitar emissão de certidão de nascimento e documentos básicos;SEAD;Secretaria de Estado de Assistência Social e Direitos Humanos;Direitos e Cidadania;https://www.ms.gov.br/direitos-e-cidadania/solicitar-emissao-de-certidao-de-nascimento-e-documentos-basicos152
Solicitar emissão de certidão negativa de débitos;SANESUL;Empresa de Saneamento de Mato Grosso do Sul;Empresa, Indústria e Comércio;https://www.ms.gov.br/empresa-industria-e-comercio/solicitar-emissao-de-certidao-negativa-da-conta-de-agua-eou-esgoto151
Solicitar emissão de certificados de projetos de ensino;UEMS;Universidade Estadual de Mato Grosso do Sul;Educação e Pesquisa;https://www.ms.gov.br/educacao-e-pesquisa/emissao-de-certificados-de-projetos-de-ensino45
Solicitar emissão de declaração anual de quitação de débitos;SANESUL;Empresa de Saneamento de Mato Grosso do Sul;Empresa, Indústria e Comércio;https://www.ms.gov.br/empresa-industria-e-comercio/solicitar-emissao-de-declaracao-anual-de-quitacao-de-debitos-da-conta-de-agua-eou-esgoto196
Solicitar empréstimo de materiais;UEMS;Universidade Estadual de Mato Grosso do Sul;Educação e Pesquisa;https://www.ms.gov.br/educacao-e-pesquisa/emprestimo-de-materiais7
Solicitar equivalência de estudos;SED MS;Secretaria de Estado de Educação de Mato Grosso do Sul;Educação e Pesquisa;https://www.ms.gov.br/educacao-e-pesquisa/concessao-da-equivalencia-de-estudos96
Solicitar esporte de aventura e natureza;FUNDESPORTE;Fundação de Desporto e Lazer de Mato Grosso do Sul;Esporte e Lazer;https://www.ms.gov.br/esporte-e-lazer/esporte-de-aventura-e-natureza72
Solicitar esportes urbanos;FUNDESPORTE;Fundação de Desporto e Lazer de Mato Grosso do Sul;Esporte e Lazer;https://www.ms.gov.br/esporte-e-lazer/esportes-urbanos154
Solicitar exame de  leptospirose;IAGRO;Agência Estadual de Defesa Sanitária Animal Vegetal  Mato Grosso do Sul;Agropecuária e Vida Rural;https://www.ms.gov.br/agropecuaria-e-vida-rural/diagnosticar-leptospirose53
Solicitar exame de raiva;IAGRO;Agência Estadual de Defesa Sanitária Animal Vegetal  Mato Grosso do Sul;Agropecuária e Vida Rural;https://www.ms.gov.br/agropecuaria-e-vida-rural/diagnosticar-raiva126
Solicitar exames de hemodinâmica;FUNSAU;Fundação Serviços de Saúde de MS;Saúde e Cuidado;https://www.ms.gov.br/saude-e-cuidado/servico-de-hemodinamica25
